id,postado_em:,numero_de_favoritos,numero_de_retweets,texto
1306612780691329026,2020-09-17 15:15:37,86,6,"Santa Catarina é o segundo Estado mais competitivo do Brasil, segundo ranking divulgado hoje pelo @CLP_Brasil. É um mérito coletivo de todos os catarinenses. A pandemia mudou nossas vidas, mas não afetou o que somos em essência."
1304915268221706240,2020-09-12 22:50:18,40,4,"Tenho certeza que essas pessoas não são maioria, por isso prefiro me concentrar no que hoje é mais importante para os catarinenses: trabalhar para que Santa Catarina supere a pandemia com o máximo possível de vidas preservadas e o menor custo econômico. @raz_bra #tvbv"
1302926040625491969,2020-09-07 11:05:49,113,4,"Neste 7/09 a celebração de um ato tão importante na nossa história, a Independência, será diferente do habitual por causa da pandemia. Mas o que vale é o sentimento de amor e orgulho da nossa pátria. Juntos podemos fazer dela o melhor lugar para se viver. Pátria amada, Brasil! 🇧🇷 https://t.co/rDxeSqQyQk"
1302261121513127936,2020-09-05 15:03:40,120,5,A Justiça atendeu ao nosso pedido por meio do @Proconsc e da @PGE_SC e o aumento na conta da luz em SC está suspenso durante o estado de calamidade pública por conta da pandemia de Covid-19. É uma conquista muito importante! Este é um momento sensível e exige adequações.
1301927757828546560,2020-09-04 16:59:00,73,0,"Estamos investindo R$ 2,2 milhões em 16 projetos de pesquisa e inovação que vão nos ajudar no combate ao coronavírus em SC. O incentivo é para empresas catarinenses e pesquisadores em universidades. Unidos, de forma eficiente e com boas parcerias, estamos cuidando de todos."
1293990533451452418,2020-08-13 19:19:19,36,1,"A saúde é prioridade e já abrimos mais leitos do que o realizado nos últimos 20 anos. Neste momento, a Grande Florianópolis está com a menor taxa de ocupação das UTIs, cerca de 70%. Cuide-se e seja responsável. Seguimos unidos para vencer essa pandemia e cuidar de SC."
1293567712669704193,2020-08-12 15:19:10,43,1,"Temos um povo trabalhador, uma economia diversificada e investimos em inovação. Por isso, seguimos em desenvolvimento mesmo diante da pandemia. A nossa indústria teve um crescimento pelo segundo mês consecutivo e acima da média nacional. Em maio, já havia subido 6,1%. https://t.co/4lntIFoYKF"
1292988059311628290,2020-08-11 00:55:50,95,7,"Dia importante para Lages e a Serra Catarinense. Ativada a nova ala do Hospital Tereza Ramos, um reforço para o enfrentamento à pandemia e para a qualificação do atendimento aos moradores da região agora e no futuro. Assim começamos uma semana de muito trabalho pela frente. https://t.co/G5pIEhL0Rw"
1291417707800408065,2020-08-06 16:55:49,99,6,Reduzimos o número de regiões classificadas em situação gravíssima. Isso mostra que as novas medidas e a contribuição dos catarinenses estão gerando resultados. Mas não significa que a pandemia está vencida e nem que o pior já passou. Ainda teremos dias desafiadores à frente. https://t.co/UU1htUOS49
1290963915778785280,2020-08-05 10:52:37,43,1,"Este fator é muito importante para ficarmos menos vulneráveis a qualquer tipo de doença. Quando o assunto é se proteger, este momento de pandemia exige atenção ainda maior."
1289668724979453953,2020-08-01 21:05:59,17,2,"Só no mês de maio nós disponibilizamos mais de R$ 6 milhões. Esse empréstimo é fundamental para garantir a manutenção dos pequenos negócios em momentos difíceis, como o desta pandemia do coronavírus. É MEI e precisa de apoio com juros zero? Saiba mais: https://t.co/pvcXmQMj7P https://t.co/zcIr0Zk30p"
1289611023331270656,2020-08-01 17:16:42,204,19,"O governo federal vai repassar recursos para SC usar em ações de fomento à cultura e seus trabalhadores neste momento de pandemia. O repasse para nosso Estado será de R$ 97,5 milhões. Uma notícia muito importante para todos nós. Muito obrigado presidente @jairbolsonaro"
1288932862260129794,2020-07-30 20:21:56,58,1,"Vou continuar trabalhando por Santa Catarina, especialmente no enfrentamento à pandemia, que é o nosso foco hoje. Vamos cuidar da economia, dos catarinenses e de todos que vivem aqui."
1288932858967609351,2020-07-30 20:21:55,157,8,"Eu respeito a Alesc e todos os deputados. Lamento a decisão do presidente Júlio Garcia de recepcionar esse processo em um momento tão inadequado, em meio à pandemia, e sem um fundamento jurídico. https://t.co/rH1a5wh3zI"
1288780327482208258,2020-07-30 10:15:49,43,2,"Desburocratizar a abertura de empresas é um dos nossos muitos esforços para melhorar o ambiente de negócios. Os resultados já estão aparecendo. No primeiro semestre, mesmo com a pandemia, o saldo de novas empresas foi 11,8% maior do que em 2019. https://t.co/OBz3GFcEM0"
1287857118897463296,2020-07-27 21:07:19,21,1,"Mesmo com uma força de trabalho intensa voltada ao enfrentamento da pandemia, que é a questão prioritária neste momento, as obras pelo Estado não param. Esta semana será de muito trabalho."
1286809265953558533,2020-07-24 23:43:31,56,6,"Por isso, hoje determinei que as medidas restritivas anunciadas na última semana para as regiões com risco considerado ""gravíssimo"" de propagação do coronavírus sejam aplicadas também para Oeste, Meio Oeste e Extremo Sul. Mais detalhes: https://t.co/pVGkCe1hvZ"
1286378128491913217,2020-07-23 19:10:20,38,3,"E a nossa economia dá sinais de retomada. Além da abertura de 33.480 novas empresas entre março e julho, a confiança dos empresários aumentou desde o início da pandemia, apresentando índice de 51,1 pontos em julho, de acordo com o ICEI, do Observatório Fiesc."
1286378127250329600,2020-07-23 19:10:19,91,4,"Seguimos firmes no combate à pandemia e trabalhando para que nossa economia se recupere rapidamente. A gestão compartilhada, a prioridade para a preservação da vida e a atenção à sustentabilidade econômica são prioridades. SC mantém a menor taxa de letalidade do país, 1,28%."
1285994539459674112,2020-07-22 17:46:05,17,0,"@minsaude @govbr @secomvc @GovSC Com apoio do presidente @jairbolsonaro e do @minsaude, Santa Catarina vai permanecer no caminho responsável de enfrentamento à pandemia."
1285983178604392449,2020-07-22 17:00:56,169,5,"Recebi o ministro interino da Saúde, @eduardopazuello, para alinhar avanços no combate ao coronavírus. Com apoio do presidente @jairbolsonaro e do @minsaude, Santa Catarina vai permanecer no caminho responsável de enfrentamento à pandemia. https://t.co/bv0y8zjDcU"
1285291809502044163,2020-07-20 19:13:41,12,0,"Este é um ano que, apesar da pandemia que nos afasta fisicamente, diminui a arrecadação e impõe desafios, também nos dá a oportunidade reconstruir, de mãos dadas, o alicerce para um estado próspero e vencedor."
1284197206480887808,2020-07-17 18:44:07,150,4,"Hoje ativamos mais 10 leitos de UTI na Grande Florianópolis e nos próximos dias abriremos 20 novas vagas na nossa rede hospitalar. Esta semana enviamos equipamentos para Lages, Rio do Sul e Joinville. Desde o início da pandemia já ampliamos a nossa capacidade em 70%."
1284094741236285440,2020-07-17 11:56:58,95,9,"Este momento exige atenção ainda maior. O combate à pandemia da Covid-19 depende do esforço de todos: Estado, Poderes, municípios, cidadãos. Não podemos relaxar. Neste momento a coletividade deve estar acima de tudo. https://t.co/DO0ePD0gRt"
1283096934459342848,2020-07-14 17:52:02,113,11,"Santa Catarina tem seis novos projetos de pesquisa relacionados ao enfrentamento à pandemia aprovados em edital do @CNPq_Oficial pelo @mctic e @minsaude, de um total de 11 selecionados no Sul do Brasil. São iniciativas lideradas por pesquisadores da @unesc, @udesc, @UFSC e @ifsc."
1278431603786735616,2020-07-01 20:53:41,80,3,"A união dos Poderes é fundamental no enfrentamento a problemas que atingem todos os que vivem em SC, a exemplo deste evento climático. Já estamos trabalhando de forma conjunta nas ações de combate ao coronavírus e na construção de ferramentas de incentivo à retomada econômica."
1276571315923755010,2020-06-26 17:41:33,63,3,"Desde o início da pandemia, a Sec. de Assuntos Internacionais do @GovSC já conseguiu repatriar mais de 180 catarinenses que estavam no exterior e com dificuldades para voltar. Neste exato momento, nossas equipes estão indo a SP buscar mais 12 pessoas que vieram da Nova Zelândia."
1276147042809716736,2020-06-25 13:35:39,29,1,As medidas tomadas na hora certa nos permitiram começar a retomar algumas atividades econômicas mais cedo e nos levaram ao primeiro lugar no ranking de desempenho dos Estados frente à pandemia.
1276147041312411656,2020-06-25 13:35:38,16,2,"Mas o que queremos é evitar ao máximo que as pessoas precisem destas vagas. Com a chegada do inverno, estamos prestes a enfrentar dias ainda mais desafiadores nesta pandemia. Por isso, não é hora de relaxar."
1276147039882088450,2020-06-25 13:35:38,105,7,Hoje completamos 100 dias de ações de enfrentamento à pandemia e com medidas de isolamento social no Estado. Neste tempo criamos número de leitos de UTI públicos maior do que o total aberto nos últimos 20 anos e fortalecemos a infraestrutura dos nossos hospitais.
1275911006754148362,2020-06-24 21:57:43,29,2,"A nossa taxa de desocupação em maio ficou em 8%, a menor entre os estados do Sul, Sudeste e Centro-Oeste. Estes resultados mostram a base sólida da economia catarinense. Estamos sofrendo com os impactos da pandemia, mas temos força e potencial para nos reerguermos rapidamente."
1275911003394408453,2020-06-24 21:57:43,44,3,"Dados do PNAD Covid-19 divulgados hoje pelo IBGE mostram que estamos no caminho certo. Mesmo em momento de crise provocada pela pandemia, em maio mantivemos a menor taxa de informalidade da economia do país, em um percentual de 20,9%, bem abaixo da média nacional, de 34,7%."
1275501400382988291,2020-06-23 18:50:06,29,1,"A ideia é unir esforços e recursos para ajudar nossas empresas a atravessarem a pandemia, com apoio de Badesc, BRDE e outras instituições. Agora vamos alinhar os detalhes técnicos e operacionais para colocar em prática o quanto antes."
1275045925749227520,2020-06-22 12:40:12,16,1,"A @fampesc está muito bem representada pela presidente Rosi Dedekind, primeira mulher a assumir uma federação empresarial em SC. Rosi poderá contar conosco no planejamento de ações voltadas aos pequenos empresários. Juntos vamos superar o desafio imposto pela pandemia."
1273796938819932160,2020-06-19 01:57:10,1,0,"@Lilafavaretto Oi, Lila. Estive no Extremo Oeste semana passada para prestar apoio aos municípios atingidos pelo temporal. Alguns dias antes, fui ao Hospital Regional do Oeste. Dos 130 leitos de UTI disponíveis hoje na região, 62 foram ativados desde o início da pandemia."
1273760326186565635,2020-06-18 23:31:41,87,4,"Estive hoje nos hospitais Marieta, em Itajaí, e Ruth Cardoso, em Balneário Camboriú. Ativamos 20 leitos de UTI na região, um reforço importante e necessário. Desde o início da pandemia de Covid-19, já abrimos 500 novas vagas em SC. https://t.co/bVTjO1KElK"
1272872228879765504,2020-06-16 12:42:42,56,4,"Mesmo com as aulas suspensas na rede estadual em razão do coronavírus, em Santa Catarina a alimentação escolar continua chegando a quem mais precisa. O calendário de entregas está divulgado no endereço: https://t.co/o5gtCEhlwe. Dúvidas, ligue: 0800 644 7890, entre 12h30 e 19h. https://t.co/qK2122rojA"
1271912934600519687,2020-06-13 21:10:49,79,9,"A doação de órgãos é uma causa muito nobre. E o povo catarinense me orgulha por ser referência nacional neste quesito. Nos cinco primeiros meses deste ano, mesmo em meio a uma pandemia, aumentamos em 15% o número de doações em relação ao mesmo período de 2019. https://t.co/HCD0xkhHYc"
1268600196591767560,2020-06-04 17:47:10,15,0,"Reiterei meu propósito de estar cada vez mais próximo da Fecam, não só no enfrentamento à pandemia, mas em outras frentes de trabalho também. Desejo sucesso ao prefeito Orildo. Os desafios que teremos à frente vão exigir muita união."
1268570956605403144,2020-06-04 15:50:59,34,1,"Há cinco projetos de pesquisa catarinenses, selecionados e apoiados pela Fapesc, que visam desenvolver soluções de enfrentamento à pandemia, considerando os impactos sociais e econômicos. É nosso compromisso ter a ciência como aliada neste combate. https://t.co/AjaSHJsucR"
1268164393763835908,2020-06-03 12:55:27,120,1,"Determinei a retomada da última fase do concurso do Deap, suspensa em decorrência da pandemia. São 600 vagas para agente penitenciário em Santa Catarina."
1267510280004698114,2020-06-01 17:36:14,162,11,"A partir de hoje, as ações de combate à pandemia do novo coronavírus passam a ser regionalizadas. As providências adotadas pelo Estado e pelas prefeituras no sentido de restringir ou flexibilizar levará em conta a situação de cada região."
1265403179715493890,2020-05-26 22:03:22,157,12,Acabo de sair de uma reunião com representantes do setor produtivo para expor e planejar as nossas ações de combate à pandemia e em outras frentes de trabalho do Governo. Vamos criar um Conselho para ampliar a participação da iniciativa privada nas nossas decisões. https://t.co/iCR76KDr41
1265012774381420544,2020-05-25 20:12:02,853,40,"É lamentável que, em meio a uma pandemia, algumas pessoas se aproveitem da situação para divulgar mentiras. Uma destas faz referência a mim e à minha família. Todas as medidas cabíveis – criminais e cíveis – serão tomadas. Santa Catarina e os catarinenses merecem mais respeito."
1264890495207170050,2020-05-25 12:06:09,77,8,Em #SantaCatarina os municípios terão acesso aos dados que fundamentam as decisões do Governo no enfrentamento ao #coronavírus. Isso vai garantir mais segurança na execução de ações regionalizadas para minimizar os impactos da pandemia. https://t.co/MYA2naUGQm
1264574834895437824,2020-05-24 15:11:49,54,5,"As vistorias no Estado já são mais de 45.000. Mesmo com todo este empenho, o seu apoio e participação nesse processo é muito importante. Vamos juntos continuar controlando a curva de contaminação e vencer esta pandemia."
1264574830680162304,2020-05-24 15:11:48,94,7,"A @pmscoficial , @cbmscoficial e @pcscoficial trabalham integrados na fiscalização das medidas de restrições estabelecidas durante a pandemia. Eles atuam para que seja possível preservar a vida das pessoas, manter o comércio aberto e o controle dos números do #coronavírus em #SC. https://t.co/Mo4UQ9FJfz"
1264212411755761666,2020-05-23 15:11:41,98,19,"O fim de semana promete temperaturas mais baixas em #SantaCatarina. A @EpagriCiram informou que uma intensa massa de ar frio de origem polar vem por aí. Com este clima e em meio à pandemia do #coronavírus, os cuidados com a saúde e prevenção de doenças devem ser redobrados. https://t.co/7t8wNzvtmd"
1263441257633853445,2020-05-21 12:07:24,31,4,"A ação vai permitir melhor controle e monitoramento da pandemia na Região, que nos últimos dias registrou aumento significativo no número de casos do #coronavírus. É importante que você continue fazendo a sua parte, respeitando as medidas de proteção e distanciamento social."
1262880020160274442,2020-05-19 22:57:14,39,2,"Em breve, anunciaremos novidades que vão garantir autonomia e segurança aos gestores municipais na condução das ações de combate à pandemia. A ação do Estado só tem sentido com a participação dos municípios. É lá que está o cidadão, razão da nossa missão diária."
1262880015890493440,2020-05-19 22:57:13,97,5,"Unir forças. Isto é essencial neste momento. Hoje me reuni com o presidente da Fecam, Saulo Sperotto, e o vice-presidente, Orildo Severgnini, para reforçar a parceria e o trabalho de enfrentamento ao coronavírus. https://t.co/fHYmi83XM5"
1262721179900665857,2020-05-19 12:26:04,32,2,"Assim como os demais estudantes da rede estadual de ensino lidam com as mudanças provocadas pela pandemia, alunos da Educação Especial também vivem novas experiências em #SantaCatarina. 

Confira no vídeo um pouco desse trabalho. 
https://t.co/UUSHF7WTBo"
1261627961565949952,2020-05-16 12:02:00,68,2,"Alcançamos a maior taxa de empregos formais, com 88% dos trabalhadores do setor privado com registro formal. Mesmo com o impacto econômico provocado pela pandemia, os números destacam a força da nossa cadeia produtiva e indicam que aqui teremos uma recuperação mais rápida."
1261446833450041345,2020-05-16 00:02:16,253,11,"Estamos no caminho certo do enfrentamento ao #coronavírus e manter os cuidados é fundamental. Infelizmente há pessoas que preferem o “quanto pior, melhor”. Quem torce contra o sucesso das ações de enfrentamento à pandemia, torce contra os catarinenses. 

https://t.co/eLSaYmjwlw"
1261264660273205249,2020-05-15 11:58:22,195,6,"Apesar dos bons resultados alcançados no enfrentamento à pandemia em #SC, o isolamento social de 40% é um dado que nos coloca em alerta. Mais do que nunca, precisamos seguir firmes na manutenção dos cuidados e atitudes de proteção pessoal para preservar a saúde de todos. https://t.co/qeyVaD6Nd3"
1261069471134949378,2020-05-14 23:02:46,36,1,"O @minsaude entregou um novo lote com 34.500 testes que, somados aos demais, chegam a 173.920. 
Isso nos dá mais segurança nas ações de enfrentamento, precisão no mapeamento do avanço da pandemia no Estado e proteção para todos que vivem aqui."
1261069467725049856,2020-05-14 23:02:45,68,2,"Desde o início da pandemia, o Laboratório Central de Exames (Lacen) já realizou mais de 16.000 exames para Covid-19 em #SantaCatarina. É uma média de 325 amostras recebidas por dia, com resultados entregues em até 48 horas. https://t.co/S0ccXZdyUH"
1260526809910849537,2020-05-13 11:06:25,51,3,"Cada um de nós é parte essencial nesse enfrentamento à pandemia, por isso, contamos com você.

⚠️ Não esqueça:
✅ Sair de casa apenas em situações indispensáveis. 
✅ Usar máscaras sempre que sair de casa. 
✅ Lavar as mãos várias vezes ao dia.

@dive_sc @saudepublicasc"
1259087719642382336,2020-05-09 11:47:59,43,0,"A dedicação dos nossos servidores e a participação de pais, vizinhos e comunidade em geral têm feito toda a diferença em #SantaCatarina.
Vale destacar, também, o respeito de todos em relação às orientações de segurança, ajudando e protegendo uns aos outros em meio à pandemia."
1258936174225379329,2020-05-09 01:45:48,50,4,"Trago informações sobre a taxa de letalidade para coronavírus e o percentual de ocupação de leitos para portadores da Covid-19 em #SantaCatarina. Também apresento o novo comandante geral da @pmscoficial . 

Assista o vídeo e saiba mais 👉🏼 https://t.co/31jRtB6rNO"
1258543648301441025,2020-05-07 23:46:03,73,6,"Enquanto seguimos firmes - e juntos - no enfrentamento ao #coronavírus em #SantaCatarina, o Governo continua trabalhando pesado em outras áreas, como combate à estiagem e infraestrutura. 

Acesse o link e confira no vídeo 👉🏼 https://t.co/Lu4xecTumX"
1258366516799533061,2020-05-07 12:02:11,117,7,"Desde o início da pandemia já foram ativados 381 novos leitos de UTI para covid-19, em hospitais públicos e filantrópicos de #SC. É um aumento de 40% da capacidade pré-existente. E tem mai: devido ao coronavírus, esse número deve dobrar até o final de maio. https://t.co/9De2Eb8RmT"
1258180486574243840,2020-05-06 23:42:58,39,4,"Temos que evitar ao máximo criar novas demandas para a rede hospitalar de nosso Estado. Conto com seu apoio para isso. 
.
✅ Confira no vídeo a atualização dos números do #coronavírus em Santa Catarina."
1257644158065532928,2020-05-05 12:11:47,69,4,"Para enfrentar o impacto econômico causado pela pandemia, o empreendedor de #SC tem acesso facilitado a linhas de crédito, com recursos ofertados pelo BRDE, Badesc e pelo FDR. As parcelas de empréstimos em aberto também podem ser renegociadas.  

Acesse 👉🏼 https://t.co/TO92JEeVeL"
1257460215286546432,2020-05-05 00:00:52,118,6,"Anunciei o nome do novo secretário da Saúde: Dr. André Motta. Ele comandará a equipe que está à frente no combate à #Covid-19 em #SC. 
A taxa de ocupação dos leitos de UTI para pacientes com coronavírus é de 16,7%. Saiba mais no link a seguir 👉🏼 https://t.co/ShUVcwZyCF"
1256743826334658564,2020-05-03 00:34:12,57,2,"Vamos em frente, juntos, no enfrentamento à pandemia de #coronavírus. Sua participação é ESSENCIAL. 

Confira mais informações no site https://t.co/3hzKJ4sBOR

@saudepublicasc @defesacivilsc  @dive_sc"
1256583222953234433,2020-05-02 13:56:01,76,6,"No site https://t.co/3hzKJ4sBOR são publicados diariamente os dados atualizados sobre o combate à pandemia em #SC. Para facilitar o acesso do cidadão a todas as informações de forma transparente, disponibilizamos na plataforma o Portal de Dados Abertos.
Clique no vídeo e confira. https://t.co/fK2lflT0CC"
1256007162112999427,2020-04-30 23:46:57,368,25,"Em #SC estamos conseguindo achatar a curva de contaminação do #coronavírus.  Agradeço seu empenho e apoio, que está sendo ESSENCIAL para isso. 

Anunciei hoje duas medidas.  Confira no vídeo disponível no link 👉🏼 https://t.co/n0jwN1sC7f"
1255105007499821058,2020-04-28 12:02:07,67,5,"No site https://t.co/3hzKJ4sBOR além dos  boletins epidemiológicos  e do monitoramento da ocupação dos leitos de UTI em #SC, é possível acessar os decretos e portarias que regulamentam as ações de enfrentamento ao #coronavirus. 

Clique no vídeo e confira. https://t.co/BWrjbXcXmK"
1254743825949642752,2020-04-27 12:06:54,51,0,"Depois disso, uma segunda etapa atenderá toda rede estadual, hoje com 540 mil alunos. 

Com união e solidariedade vamos vencer essa pandemia.
@educacaosc"
1254743823173005312,2020-04-27 12:06:54,167,11,"Com as aulas suspensas, por conta do enfrentamento ao #coronavírus, a merenda escolar da rede estadual de ensino de #SC será distribuída aos alunos. Até o dia 30/04, serão entregues 50 mil kits de alimentos para estudantes cadastrados no Programa Bolsa Família. https://t.co/mcW4ZWviXw"
1254382056555065349,2020-04-26 12:09:22,115,5,Os dados oficiais sobre o enfrentamento ao coronavírus são atualizados e publicados diariamente no site https://t.co/3hzKJ4sBOR.
1253654788627214338,2020-04-24 11:59:28,32,6,"Informações sobre o enfrentamento ao #coronavírus estão disponíveis de forma transparente no https://t.co/3hzKJ4sBOR . Por lá, você pode saber, por exemplo, o número de leitos disponíveis por região, exclusivos para pacientes com a covid-19. 

Clica no vídeo e veja como acessar. https://t.co/4CcZurrw6J"
1253291407261020161,2020-04-23 11:55:31,58,3,"Seguimos trabalhando de forma muito séria e responsável no enfrentamento do coronavirus,  mas a sua participação é fundamental nessa luta.  Santa Catarina precisa de você. 
Use máscara, siga o protocolo de higienização e, sempre que puder, #fiqueemcasa."
1253291404895367168,2020-04-23 11:55:30,236,10,"Em meio à pandemia, uma notícia que reforça nossa esperança por dias melhores. O @minsaude divulgou que, no Brasil, aproximadamente 23.000 pessoas ja se recuperaram da Covid-19. Em #SantaCatarina, 161 pessoas já tiveram alta da UTI e apresentam boa recuperação. https://t.co/YOVdEPX1Iu"
1253097539685023754,2020-04-22 23:05:09,122,6,"O enfrentamento ao #coronavírus em #SC é gerenciado diariamente. Avaliamos a disponibilidade de leitos na rede hospitalar e a taxa de ocupação dos mesmos. Hoje esta taxa é de 16%. 

Clica no link a seguir e saiba mais 👉🏼
https://t.co/XnMEFnnDje"
1251659294556241928,2020-04-18 23:50:05,11,1,"@RealAndre12 Grato, @RealAndre12 . É um desafio gigantesco. Precisamos agir unidos para vencer o #coronavirus . Conto contigo. Abraço."
1251658721727520768,2020-04-18 23:47:48,10,1,"@accreedunity É importante mantermos o foco, @accreedunity ! A guerra contra o #coronavirus precisa da participação de todos. Abraço."
1251640103908278272,2020-04-18 22:33:49,659,49,"Boas notícias! Com a participação cidadã de todos que vivem em #SC estamos conseguindo reduzir a taxa de contágio do coronavírus aqui. Ainda, registramos 140 pacientes que deixaram a UTI e se recuperam bem da Covid-19.

Clica no link a seguir e saiba mais 
https://t.co/YGdP0b4uyA"
1251120246162939905,2020-04-17 12:08:06,192,8,"Com a chegada dos insumos adquiridos pelo Estado e os materiais recebidos por doações, estamos abastecendo todas as regiões de #SC para o enfrentamento do coronavírus. 

Nos ajude conscientizando mais pessoas aos cuidados adequados. Você é muito importante nessa luta.
@minsaude https://t.co/pucNfrJB2Z"
1250843494647767042,2020-04-16 17:48:23,99,9,"O acesso à informação também é uma arma importante na luta contra o coronavírus. Em #SC, o cidadão tem mais uma ferramenta para acessar dados oficiais sobre a pandemia.  Tudo de forma fácil e transparente. 

Confira no vídeo como acompanhar os números e informações atualizadas. https://t.co/MxYulmD2z1"
1250567087115943936,2020-04-15 23:30:02,741,56,"O momento é de união e não de fazer política. Há pessoas morrendo pelo coronavírus. Há empreendedores sofrendo com a crise econômica que é mundial. Usar este momento para promover embate político é lamentável. 

Acompanhe as atualizada de #SC em 👉🏼 https://t.co/MWo971edPO"
1250216921779372039,2020-04-15 00:18:36,67,3,"Confira no vídeo, no link abaixo, as atualizações sobre o coronavírus:

✅ Números #Brasil - 204 mortes em 24 horas.
✅ Números Santa Catarina.
✅ Painel com dados completos no site https://t.co/3hzKJ4sBOR

Acesse o vídeo em 👉🏼  https://t.co/vgwxOhvggS"
