id,postado_em:,numero_de_favoritos,numero_de_retweets,texto
1245002251267190784,2020-03-31 14:57:22,82,7,"Para reforçar o combate ao coronavírus na região, o governo garantiu a instalação de 20 leitos de UTI em Taquara, com investimento de mais de R$ 1,5 milhão mensais."
1245002246611501056,2020-03-31 14:57:21,39,2,"O hospital inaugurou nesta semana o atendimento em tenda externa para pacientes com sinais e sintomas de coronavírus. O serviço, que funciona das 7h às 19h, está localizado ao lado do setor de Emergência. https://t.co/fPuwHZEPCm"
1245002244682022913,2020-03-31 14:57:20,39,3,"No total, 66 novos leitos de enfermaria estão em construção no local e o governo espera entregar 20 novos leitos de UTI. A expectativa é de que a abertura dos novos espaços, que atenderão pacientes com coronavírus, ocorra até o fim de abril. https://t.co/jUi02TSIRZ"
1245002242618425344,2020-03-31 14:57:20,295,10,"Estive hoje no Hospital Vila Nova, em Porto Alegre, ao lado do prefeito @marchezan_. A instituição é uma das referências no cuidado a pacientes suspeitos de coronavírus e ampliou a sua capacidade para atender a essa demanda, com apoio do governo do Estado. https://t.co/i9Hh59ZtmT"
1244738688204124166,2020-03-30 21:30:04,50,1,"Também pedi a atenção dos parlamentares a temas que poderão ser votados nesta semana no Congresso para o enfrentamento da pandemia e que interessam ao RS, além do apoio em demandas de auxílio ao Estado que apresentamos ao governo federal. https://t.co/S5xSpnj46j"
1244694245862187009,2020-03-30 18:33:28,406,42,Anunciamos hoje mais duas medidas para mitigar o impacto econômico causado pelas restrições impostas para evitar a propagação do #coronavírus no RS. Uma delas via Banco de Desenvolvimento do Extremo Sul (BRDE).
1243263958422781953,2020-03-26 19:50:01,174,9,"São 95 leitos de cuidados prolongados, destinados a pacientes com gravidade intermediária. Assim, a ocupação de leitos de UTI fica concentrada naqueles pacientes com #coronavírus que evoluam com maior gravidade. https://t.co/eFmEM5eA6G"
1243250176543858688,2020-03-26 18:55:15,44,2,"Essa medida irá auxiliar a população na busca dos produtos, especialmente itens mais importantes de prevenção contra o #coronavírus. Tb será liberado o telefone do estabelecimento p/ que o usuário possa confirmar a disponibilidade da mercadoria antes de se deslocar ao local."
1243250172882272256,2020-03-26 18:55:14,364,19,"Anunciamos hoje medidas administrativas p/ facilitar os processos de trabalho das empresas e, também, de comunicação com a sociedade devido ao #coronavírus. O objetivo é simplificar obrigações dos contribuintes p/ minimizar os impactos gerados pelo vírus."
1242898648549203968,2020-03-25 19:38:24,216,24,"Entre as medidas p/ frear o avanço do #coronavírus, o @governo_rs lançou seis novos serviços digitais na plataforma unificada https://t.co/zaLi8cXErq. Objetivo é ampliar a oferta de soluções via internet, contribuindo p/ reduzir a necessidade de deslocamento até órgãos públicos."
1242856415141728256,2020-03-25 16:50:35,342,16,"Em instantes, estarei ao vivo no Facebook do Governo do Estado para darmos início a uma série de transmissões diárias sobre o coronavírus. 

Acompanhe em https://t.co/W6pPe6I2nZ"
1242521752619663361,2020-03-24 18:40:45,273,15,"A reunião que trata do assunto, e que vai resultar em outras medidas, está sendo acompanhada pelo secretário de Meio Ambiente, @arturlemosjr. Nosso objetivo é minimizar os efeitos da epidemia do coronavírus na vida dos gaúchos. Em breve, teremos mais novidades sobre esse tema."
1242493368661356546,2020-03-24 16:47:58,325,20,Tivemos uma reunião positiva hoje com o presidente @jairbolsonaro e ministros para estabelecer coordenação de esforços no enfrentamento do coronavírus e apresentar algumas demandas sanitárias e econômicas importantes para o RS. https://t.co/7zOkzjuapg
1242133830036787201,2020-03-23 16:59:17,323,21,"Conversei hoje com governadores dos Estados do Sul e do Sudeste. Oportunidade para alinhar ações no enfrentamento ao #coronavírus. Na reunião, também interagimos com o ministro @tarcisiogdf sobre medidas que garantam o abastecimento e os serviços essenciais à população. https://t.co/Khk3VZGZH3"
1242085081646272515,2020-03-23 13:45:34,103,35,"Reforço no enfrentamento ao #coronavírus 

👉🏻 https://t.co/2mpPtxdbOt https://t.co/ay5GyoFajg"
1241130987460976640,2020-03-20 22:34:21,223,32,O novo decreto também reforça as nossas ações de enfrentamento ao coronavírus no que diz respeito à atividade econômica. Estamos garantindo que não haja desabastecimento e que os serviços essenciais continuem funcionando.
1241130984847917057,2020-03-20 22:34:20,957,101,"Assinei há pouco um novo decreto, que estabelece mais medidas com o objetivo de minimizar os efeitos sanitários e econômicos da pandemia de coronavírus. O documento determina a interdição das praias do Litoral gaúcho e a proibição do fechamento dos limites entre municípios."
1241012859020197888,2020-03-20 14:44:57,12,0,"#CORONAVÍRUS Também focado no combate ao coronavírus, o instituto dispensou os serviços presenciais e elaborou alternativas para o atendimento online. Além disso, ampliou a rede de credenciados com 136 novos prestadores - 113 são médicos"
1240992145353388032,2020-03-20 13:22:38,84,6,"Farei uma transmissão ao vivo no Facebook para informar medidas do IPE-Saúde para o enfrentamento ao coronavírus. 

Acompanhe a partir das 10h30, na página do governo 
https://t.co/aNriCKUIG0"
1240748065864253452,2020-03-19 21:12:45,289,43,"Junto com os demais 26 chefes de Estados e do DF, assinei, hoje à tarde, uma carta solicitando apoio do governo federal para mitigar os efeitos sanitários e econômicos causados pela pandemia do #coronavírus. O documento, protocolado na Presidência, lista 6 medidas de auxílio."
1240715449236668417,2020-03-19 19:03:09,135,11,Sancionei agora os dois projetos que protocolamos na @AssembleiaRS incluindo ações para intensificar o combate ao #coronavírus no Estado. Ambos foram aprovados por unanimidade. Agradeço aos parlamentares pela agilidade e sensibilidade neste momento tão delicado. https://t.co/8ckE7FlJAZ
1240625920991539200,2020-03-19 13:07:23,294,38,Estou reunido agora com os chefes dos outros Poderes para apresentar as medidas que constam nos dois decretos que publicaremos hoje em função do coronavírus.
1240418624197865478,2020-03-18 23:23:40,326,46,O decreto ainda está sendo editado pelos nossos técnicos e será apresentado amanhã à sociedade gaúcha. Vamos intensificar ações que ajudem a minimizar os efeitos da pandemia no RS.
1240418622566207496,2020-03-18 23:23:40,1266,271,"Encerramos há pouco uma reunião de governo na qual decidimos pela decretação de estado de calamidade pública no Rio Grande do Sul por conta do #coronavírus. É uma medida drástica, mas necessária no momento delicado que vivemos."
1240384428406431754,2020-03-18 21:07:47,10,2,"Medidas do @Banrisul para reduzir prejuízos com #coronavírus para PJ (microempreend., peq e médias empresas):
- Carência de 2 meses no pagamento de prestações de dívidas contraídas junto ao banco;
- Para os que estão no limite da capacidade de crédito, ampliação de 10% no limite;"
1240384425218772992,2020-03-18 21:07:46,9,3,"Medidas do @Banrisul para reduzir prejuízos com #coronavírus para pessoas físicas:
- R$ 11 bilhões disponíveis de crédito para pessoas físicas;
- Aumento automático de 10% no limite do Banricompras;"
1240384421842366465,2020-03-18 21:07:46,56,8,"Além de todas as ações que estamos tomando em relação ao #coronavírus na área da saúde, decidimos adotar, junto com @Banrisul, BRDE e @badesul, medidas iniciais para minimizar o prejuízo econômico previsto em função do Covid-19 no nosso Estado. https://t.co/oEU5iN8WI6 https://t.co/9nhJg4efo4"
1240322779188248578,2020-03-18 17:02:49,46,7,"Na reunião de integração da @_federasul, discutimos o avanço do Covid-10 no RS, principal assunto na mente dos gaúchos, e falamos sobre preocupações econômicas. Daremos todo o apoio p/ reduzir o impacto das medidas restritivas, necessárias p/ conter a propagação do #coronavírus https://t.co/SVA5WIbMUv"
1240306554320150534,2020-03-18 15:58:20,71,17,"“A única forma de evitarmos perdas de vidas é com a colaboração de todos, para que as medidas restritivas sejam cumpridas e possamos conter o avanço do #coronavírus, que pode atingir mais de 4 mil pessoas em três semanas no RS. Portanto, o apelo é: #fiqueemcasa.” https://t.co/wS93uhvDwT"
1240305988655333377,2020-03-18 15:56:06,190,20,“Não é sobre não termos o #coronavírus no nosso Estado. Ele já está aqui e vai circular. Temos de agir para que os 20% da população que podem sofrer efeitos mais graves sejam preservados e quem realmente precise tenha atendimento.” https://t.co/CzXFbJCmCQ
1240256765691912192,2020-03-18 12:40:30,195,16,"O Exército também é nosso parceiro no combate ao coronavírus. Em encontro com o comandante militar do Sul, general Miotto, decidimos promover ações articuladas no RS. O Comando fará parte do Conselho de Crise que estamos criando e ao qual estamos unindo forças públicas e civis. https://t.co/wp2Mb1shiz"
1240058219235549186,2020-03-17 23:31:33,128,13,"Tivemos mais uma importante reunião de trabalho sobre as ações para conter o avanço do coronavírus no Estado, desta vez, com representantes de entidades e chefes de Poderes. A compreensão e a colaboração da iniciativa privada será fundamental p/ retardarmos a propagação do vírus https://t.co/AUXqL8ww27"
1240013389113540608,2020-03-17 20:33:24,125,9,"A fim de alinharmos as medidas a nível de Estado e Capital para conter a propagação do coronavírus em solo gaúcho, recebi o prefeito @marchezan_ e o secretário Christian Lemos. A Região Metropolitana é um dos focos de atenção devido à grande concentração e circulação de pessoas. https://t.co/oj6olkzCQM"
1239996334612131846,2020-03-17 19:25:38,146,11,"Chamei todos os secretários para que, juntos, pudéssemos conversar sobre as medidas que serão tomadas em todas as pastas para evitar a propagação do coronavírus, alinhadas aos decretos já publicados https://t.co/7YunnoEMwN"
1239931435215204358,2020-03-17 15:07:45,92,14,"Acabei de protocolar dois projetos, na @AssembleiaRS, para ampliar o combate ao coronavírus no RS. Vou falar mais sobre isso em instantes, em uma live no Facebook 

Acompanhe em: https://t.co/sZbqtE7ce5"
1239580242047631360,2020-03-16 15:52:14,670,143,"Devido ao coronavírus, optamos por suspender as aulas da rede estadual por duas semanas a partir do dia 19 de março. Estamos acompanhando a evolução dos casos e, conforme necessário, o período de suspensão pode ser estendido. Os alunos receberão atividades para fazer em casa"
1239562852815572992,2020-03-16 14:43:08,102,20,"Farei em instantes uma transmissão ao vivo para informar novas medidas em relação ao coronavírus. A live será feita no meu perfil no Facebook.

https://t.co/umPkxpZOgk"
1239329547239264256,2020-03-15 23:16:04,378,33,"Acabo de me reunir com equipe técnica do Centro de Operações de Emergência, avaliando evolução e projetando próximos passos para contenção da disseminação do coronavírus no RS. Amanhã cedo faremos nova reunião com secretários e definiremos novas diretrizes para a população gaúcha https://t.co/FYkvtGF1FS"
1238177010247237634,2020-03-12 18:56:18,163,20,"Estamos trabalhando em um decreto com orientações a respeito do coronavírus, que envolve a suspensão de viagens e de encontros governamentais que envolvam grande concentração de público. Estão sob análise todas medidas possíveis para mitigar os efeitos do coronavírus no RS."
1237755548923281408,2020-03-11 15:01:33,38,5,"O PIB do RS em 2019 foi de R$ 480,6 bilhões, enquanto o PIB per capita foi de R$ 42.246,52, uma alta de 1,5% em relação a 2018. Para 2020, os efeitos do coronavírus e os prejuízos da estiagem tornam o prognóstico para este ano ainda mais desafiador. https://t.co/eCNvyxGCxW"
1237399148300832768,2020-03-10 15:25:21,69,5,"Confirmamos em coletiva de imprensa na manhã de hoje, ao lado da secretária da Saúde, Arita Bergmann, o primeiro caso do novo coronavírus no Estado. É um homem de 60 anos, morador de Campo Bom, que esteve em Milão, na Itália, entre os dias 16 e 23 de fevereiro deste ano. https://t.co/9eZ50NISmq"
1233819480410804224,2020-02-29 18:21:02,29,1,Os governadores estão atentos e vigilantes em relação ao coronavírus. Estamos conversando para compartilhar informações e experiências com o intuito de frear um avanço do vírus nos Estados. Também solicitamos mais recursos federais para ampliarmos a nossa atuação.
1233805818014900224,2020-02-29 17:26:44,19,0,"Na edição deste sábado, em Foz do Iguaçu, conversamos principalmente sobre as ações de prevenção à disseminação do coronavírus, segurança pública, reformas estruturantes e desenvolvimento econômico, entre outros temas. https://t.co/gv08msb2wW"
