id,postado_em:,numero_de_favoritos,numero_de_retweets,texto
1277955102981132289,2020-06-30 13:20:14,605,24,"Agradeço, em nome de todos os gaúchos, à bancada federal gaúcha pelo repasse de R$ 43,3 milhões, via emendas extraordinárias, aos hospitais estaduais. O repasse contemplará 111 instituições de saúde. É um importante reforço no combate ao #coronavírus. https://t.co/loMorQOTZW"
1277720720223744000,2020-06-29 21:48:53,168,6,"Tem de haver uma análise de contexto, mas ao máximo respaldada pelos dados, pela ciência, pela informação. Assim estamos fazendo aqui no RS: adotando restrições que nos ajudam a controlar o contágio de #coronavírus em lugares onde se impõe verdadeiramente o risco."
1276271897387417603,2020-06-25 21:51:46,26,3,"Por meio deste termo, estamos manifestando publicamente que é seguro juridicamente e promissor o investimento que está sendo realizado no Cais Embarcadero e que vai sair do papel em breve, para que toda a comunidade possa desfrutar assim que a pandemia passar."
1276269345287606272,2020-06-25 21:41:38,146,10,"Desde março, estamos trabalhando para ampliar a estrutura da rede pública hospitalar no RS. Até o momento, o incremento já foi de quase 70% - de 933 leitos de UTI existentes antes da pandemia, passamos para quase 1,6 mil leitos habilitados e disponíveis para a população."
1276237133259378688,2020-06-25 19:33:38,1037,66,"Chegamos a 500 mortes por #coronavírus no RS. Expresso meu pesar e solidariedade aos familiares, amigos e colegas das pessoas que, infelizmente, perdemos. Todo nosso esforço e trabalho é p/ evitar essas perdas e, p/ conseguirmos isso, precisamos da colaboração de todos os gaúchos"
1276177673350451200,2020-06-25 15:37:22,227,13,"Em reunião virtual da @ahkrgs, falamos sobre o combate ao #coronavírus e a retomada econômica pós-pandemia. Neste momento bastante delicado, a boa relação entre os países é fundamental para a troca de experiências. https://t.co/jh3wNz37L8"
1274469706276225025,2020-06-20 22:30:31,541,41,"Reforço, portanto, o pedido à população gaúcha para que redobre os cuidados em relação à higiene, uso da máscara, uso de álcool gel e o hábito de lavar as mãos constantemente. Tudo isso nos ajuda a evitar a disseminação do #coronavírus e de outros vírus, como os da gripe."
1273688240265007105,2020-06-18 18:45:15,361,17,"Desde o início da pandemia de #coronavírus, adotamos como prioridade o aumento da capacidade de atendimento do sistema público de saúde. Nossa meta era ampliar em pelo menos 60% o número de leitos em UTI SUS habilitados, mas já alcançamos um aumento de 67%."
1271178413211090944,2020-06-11 20:32:05,596,39,"Com o objetivo de reduzir os riscos de esgotamento do sistema de saúde, garantir maior segurança aos gaúchos e aumentar a aderência às medidas de enfrentamento ao #coronavírus, anunciamos hoje alguns ajustes no modelo de Distanciamento Controlado."
1271166046779715585,2020-06-11 19:42:57,213,13,"Desde o começo da pandemia de #coronavírus, a @SGGE_RS vem mapeando o número de respiradores dos nossos hospitais que precisam de conserto. Com apoio de empresas e de organizações da iniciativa privada, foi possível recuperar 85 dos 245 equipamentos identificados."
1270459141119709185,2020-06-09 20:53:57,121,10,"O Estado alcança, agora, mais 624 leitos de UTI habilitados pelo SUS desde o início da pandemia de #coronavírus, o q representa um incremento de mais de 60% na rede pública de saúde. A habilitação desses 314 leitos é válida p/ o período de 90 dias, c/ possibilidade de prorrogação"
1270424463453061120,2020-06-09 18:36:10,63,5,"Mesmo em meio ao enfrentamento ao #coronavírus, seguimos atendendo a demandas da população. Os bombeiros são uma extensão da sociedade e reconhecemos a importância do trabalho da corporação e seus profissionais, tanto no combate a incidentes dos mais diversos quanto na prevenção."
1270064799603478528,2020-06-08 18:46:59,61,2,"Tomaremos todos os cuidados para garantir a segurança dos professores e dos alunos, respeitando normas estabelecidas pelos decretos do Distanciamento Controlado e medidas sanitárias para o período de pandemia."
1268655386929909761,2020-06-04 21:26:29,136,8,"Nossa equipe está focada no propósito de informar com clareza e transparência tudo o diz respeito à pandemia, desde o número de casos até o valor investido em cada EPI. Acreditamos que tempo de enfrentamento ao #coronavírus também é tempo de enfrentamento à corrupçao."
1268620630263357443,2020-06-04 19:08:22,377,15,Confirmamos o recebimento da segunda parcela do auxílio financeiro federal destinado às Santas Casas e aos hospitais filantrópicos do RS para atuação no enfrentamento à pandemia de #Covid19.
1268617641398169600,2020-06-04 18:56:30,33,4,"Doar também é um ato de amor, e pedimos que os itens que forem doados estejam em boas condições. Neste ano, temos um fator agravante, pois o rigor das baixas temperaturas do inverno está acompanhado pela crise provocada pela pandemia de #coronavírus."
1268252172262748165,2020-06-03 18:44:15,115,3,"Os insumos para 6 mil testes serão adquiridos com recursos do @MPT_RS. Agradeço por essa importante parceria, pois reconhecemos a política de testagem como algo fundamental no enfrentamento à pandemia."
1267513937286873091,2020-06-01 17:50:46,20,2,Fiz questão de ir pessoalmente no gabinete que cada um vai assumir para marcar o início de trabalho e dar as boas-vindas. São duas secretarias muito importantes e que serão ainda mais relevantes no período pós-pandemia de #coronavírus.
1265767644076093440,2020-05-27 22:11:37,266,14,"Ressalto que essa programação pode sofrer alterações na medida em que formos acompanhando a evolução do #coronavírus no Rio Grande do Sul. Estamos monitorando a situação, sempre com o dedo no pulso para avaliarmos a melhor estratégia para cada momento."
1265767638258667525,2020-05-27 22:11:36,2073,183,"Informamos hoje que as aulas nas escolas de ensino público e privado no Rio Grande do Sul não retornarão de forma presencial em junho. Estamos acompanhando a situação do #coronavírus e estabeleceremos um retorno gradual com segurança aos alunos, professores e funcionários."
1265718664113852416,2020-05-27 18:57:00,740,59,"Divulgamos hoje os resultados da 4ª etapa da pesquisa de prevalência na população gaúcha da #Covid19. Os dados apontam para uma estabilidade no número infectadas por #coronavírus no RS e um achatamento da curva de contágio, que é o nosso maior objetivo enquanto não temos vacina."
1265680121123475462,2020-05-27 16:23:50,96,5,"Especialmente importante terem sido entregues agora, por orientação do Comitê de Logística e Abastecimento #Covid19, pois muitos gaúchos estão precisando de ajuda por conta da pandemia e da estiagem. Quem puder, doe e colabore para que a gente passe logo e bem por tudo isso! https://t.co/Gw1FX90zMN"
1264985502249373701,2020-05-25 18:23:40,95,5,"Sabemos que, diante do cenário que se impõe pela pandemia de #Covid19, algumas pessoas não têm condições de manter os pagamentos, mas lembramos que é importante manter a regularidade porque são esses pagamentos que sustentam a atividade da @Corsan_Oficial."
1264985501016174592,2020-05-25 18:23:40,228,16,"Para minimizar os impactos da pandemia de #coronavírus, a @Corsan_Oficial, desde 25 de março, não está realizando cortes nas ligações de água. A iniciativa será prorrogada por mais 30 dias. A companhia também concedeu isenção da tarifa social por 90 dias, a contar de abril."
1264982655768104962,2020-05-25 18:12:22,1177,41,"Liguei há pouco para o presidente do Uruguai, @LuisLacallePou, que está hoje em Rivera por conta dos novos casos de #coronavírus na região. Estamos em diálogo para comunhão de esforços entre nossas equipes de Saúde para manter uma ação cooperada na nossa fronteira."
1262837279753723906,2020-05-19 20:07:24,307,11,"Além disso, farei um apelo no sentido de atender a ciência, dar segurança nas condições de enfrentamento ao #coronavírus p/ garantir segurança à população p/ q, assim, possamos criar um ambiente p/ a retomada econômica. https://t.co/6qOQ40PRE8"
1262811511824809984,2020-05-19 18:25:00,334,41,"Lançamos hoje um novo portal: https://t.co/WfFSg0vSif, que passa a ser referência para informações específicas e atualizadas em tempo real sobre o enfrentamento à pandemia no Estado. Todas as ferramentas de consulta de dados, notícias e serviços estão reunidos num único endereço."
1262473415182729217,2020-05-18 20:01:32,1513,210,"As aulas do projeto Pré-Enem Seduc RS, preparatórias p/ o Enem, começam a ser transmitidas a partir de hoje pela @TVE_RS. Frente à pandemia, estamos buscando alternativas p/ priorizar o estudo e garantir a qualificação necessária dos estudantes p/ o ingresso no Ensino Superior https://t.co/CgrvNMzqG4"
1261665879231692807,2020-05-16 14:32:40,396,13,"Aproveitando a visita, anunciamos que o Estado aumentará os repasses ao Hospital Geral em R$ 400 mil, totalizando aporte de R$ 3,7 milhões mensais para custeio do HG, que é uma referência em saúde para toda a serra gaúcha e terá essa importante ajuda neste momento de pandemia. https://t.co/ZQIMQvkH9w"
1261665860726464513,2020-05-16 14:32:36,1309,47,"Graças a um esforço coordenado, entregamos hoje mais 10 leitos de UTI, com atendimento 100% SUS, no Hospital Geral (HG) de Caxias do Sul. Durante a pandemia, eles serão destinados exclusivamente para pacientes com #coronavírus. https://t.co/pAWAExjajJ"
1260647051877998593,2020-05-13 19:04:13,714,117,"Divulgamos hoje os resultados da terceira etapa da pesquisa de prevalência de #coronavírus na população gaúcha. Estima-se que 24.860 pessoas já tenham sido infectadas pelo vírus no Estado. Na fase anterior, eram 15 mil, e na primeira, 5,6 mil. https://t.co/MrL3oogtaC"
1260292896143663107,2020-05-12 19:36:56,586,42,O @governo_rs está iniciando a distribuição de mais de 135 mil testes rápidos para detecção de anticorpos do #coronavírus a todos os municípios gaúchos e às CRSs. Outros cerca de 110 mil testes já haviam sido distribuídos. Os testes foram repassados ao Estado pelo @minsaude.
1259149684142149632,2020-05-09 15:54:13,469,17,"Debatemos nesta manhã medidas para proteger a saúde dos trabalhadores e evitar a disseminação do #coronavírus em frigoríficos, e para que não haja a interrupção das atividades nesses estabelecimentos e a consequente necessidade de abates sanitários. https://t.co/Hg8372W6oZ"
1258830674066386945,2020-05-08 18:46:35,140,4,"Estamos mantendo os repasses em dia, não apenas por causa da pandemia, mas porque é uma prioridade desde o 1º dia do nosso governo. É um recurso muito importante inclusive para pagamento da folha dos funcionários que estão na linha de frente no combate à pandemia de #Covid19."
1258824372921544705,2020-05-08 18:21:32,333,22,"A terceira fase da pesquisa de prevalência do #coronavírus no RS será feita entre este sábado e segunda-feira (11/5), em mais 4,5 mil moradores de Canoas, Caxias do Sul, Ijuí, Passo Fundo, Pelotas, Porto Alegre, Santa Cruz do Sul, Santa Maria e Uruguaiana."
1258531281467404289,2020-05-07 22:56:54,470,16,"Dialoguei, hoje, com os chefes dos demais Poderes e órgãos autônomos sobre as nossas ações de enfrentamento à #Covid19 e às dificuldades financeiras como consequência da pandemia. O RS, há anos, gasta mais do que arrecada, e a situação se agravou devido à pandemia e à estiagem. https://t.co/JrvsPhdU6z"
1257799490645438464,2020-05-05 22:29:02,739,81,"Estamos com as aulas suspensas no Estado devido à pandemia de #coronavírus e buscamos uma forma de manter a condição de aprendizagem. Sabemos o efeito do distanciamento social no calendário escolar e no processo de formação e de acesso ao Ensino Superior, como é o caso do Enem."
1255955657250963460,2020-04-30 20:22:17,161,14,"Como ocorreu uma evolução rápida da situação do #coronavírus nas regiões de Passo Fundo e Lajeado, fica determinada a vedação do comércio. Para a região Metropolitana, onde vigorava essa regra, a liberação do comércio passa a ser, agora, determinada pelo prefeito de cada cidade."
1255520827853996033,2020-04-29 15:34:26,72,10,"Dos 4,5 mil testes aplicados, 6 testaram positivo na 2ª fase. Na 1ª, feita entre 11 e 13 de abril, 2 casos deram positivo para a #Covid19, o que representava 0,05%. A estimativa era de que existissem 5.650 contaminados pelo #coronavírus no Estado – um caso a cada 2 mil habitantes https://t.co/o7wLuyHekr"
1255520825815547905,2020-04-29 15:34:25,471,71,"Apresentamos hoje o resultado da segunda etapa da pesquisa que mede a prevalência do #coronavírus no RS. O estudo indica que mais de 15 mil pessoas já teriam tido #Covid19 no Estado, o que equivale a um infectado a cada 769 habitantes - uma taxa de 0,13%. https://t.co/tTbmZa6qfG"
1255198070054273024,2020-04-28 18:11:55,159,12,"O programa Inova RS lançou hoje um edital específico, de R$ 1,2 milhão, para apoio ao enfrentamento ao #coronavírus. A intenção é promover e fomentar soluções tecnológicas inovadas para serviços, produtos ou processos relacionados ao combate à Covid-19."
1255197791644717058,2020-04-28 18:10:48,181,11,"Para reduzir os impactos decorrentes do #coronavírus sobre as contas públicas, anunciamos um novo contingenciamento orçamentário de R$ 40 milhões. No início do ano, havíamos definido a redução anual de R$ 420 milhões de um total de R$ 3,1 bilhões do custeio contingenciável."
1254852011822120960,2020-04-27 19:16:48,468,23,"Vistoriamos hoje 30 novos leitos clínicos e 10 novos leitos de UTI no Hospital Regional de Santa Maria. Disponíveis para receber pacientes a partir de amanhã, os leitos serão destinados exclusivamente a pacientes com suspeita ou confirmação de #coronavírus. https://t.co/TLLn6CFhdr"
1254504263969132544,2020-04-26 20:14:58,364,25,"Ao vivo agora no 1º Congresso Online @MBLivre, no painel ""O Executivo contra a pandemia"".  Acompanhe:  https://t.co/a3MTRbHCwt"
1254405048324493314,2020-04-26 13:40:43,101,11,Participo agora de live da @xpinvestimentos sobre a atuação dos Estados contra o #coronavírus. Clique no link p/ acompanhar https://t.co/EwGz5muhYa
1253754292093308929,2020-04-24 18:34:51,188,14,"Neste final de semana, a @ufpel, com apoio de diversas universidades, fará uma nova rodada de testes rápidos no Rio Grande do Sul. Mais 4,5 mil pessoas serão testadas a afim de que possamos medir a prevalência do #coronavírus no Estado."
1253058381511831552,2020-04-22 20:29:33,322,16,"Apresentei os dados referentes ao coronavírus no RS aos ministros gen Braga Netto, gen Augusto Heleno e gen Luiz Eduardo Ramos. Além do boletim diário, falei dos indicadores e do modelo de distanciamento social controlado, que deve ser implementado no Estado em maio. https://t.co/sn9FRHnsEW"
1252967362044866560,2020-04-22 14:27:52,1833,198,"ALERTA DE FAKE NEWS! 🚫

Estão espalhando fotos minhas de MUITO ANTES DA PANDEMIA dizendo que estou fazendo turismo. Essa foto com meu irmão foi tirada em JANEIRO DE 2019, muito antes de começar a pandemia, conforme mostra o post da Bondinhos Aéreos de Canela no Instagram. https://t.co/G2eNVF4tRy"
1252605053929734145,2020-04-21 14:28:11,168,6,"Nas diferentes regiões, levará em consideração a capacidade de resposta hospitalar e o comportamento da pandemia no território. Para os setores, os critérios serão o risco de contágio impostos pela atividade e a importância econômica de cada um."
1252605048691003395,2020-04-21 14:28:10,254,18,"O #coronavírus não está indo embora e não está passando. Está entre nós, circulará ao longo dos próximos períodos, e vamos conviver com isso. Por isso, precisamos continuar contando com o apoio da população p/ evitarmos um volume de contágio p/ além da nossa capacidade hospitalar"
1252605045402730498,2020-04-21 14:28:09,255,10,Sabemos que a pandemia tem exigido sacrifícios da população e que uma restrição uniforme e rigorosa não é sustentável por longo tempo. Tudo que fizemos até aqui foi priorizando a vida. Tudo que faremos daqui pra frente será priorizando a vida.
1252337800734806016,2020-04-20 20:46:13,340,23,"Encerramos hoje o processo que envolveu R$ 32 milhões de investimento do @governo_rs na aquisição de EPIs, incluindo máscaras, luvas, álcool 70%, óculos protetores e termômetros, entre outros. Também compramos mais 2.576 testes rápidos para diagnóstico de #coronavírus."
1251519996708167680,2020-04-18 14:36:33,649,44,"Estive em Canoas nesta manhã p/ conhecer o primeiro hospital de campanha voltado ao atendimento de pacientes de #coronavírus. A estrutura funcionará 24h, em frente à UPA Rio Branco, e tem 13 leitos clínicos e um de UTI, todos equipados com oxigênio. https://t.co/UYLEpOImV7"
1250855219593981953,2020-04-16 18:34:58,125,6,"Também anunciamos a reabertura do Hospital Bom Jesus, em Taquara. Fechado desde 10 de março, o hospital será reaberto, com recursos da prefeitura (R$ 366 mil/mês) e do Estado (R$ 1,6 milhão/mês) e reforça o combate ao #coronavírus na região com mais 20 leitos clínicos e 10 de UTI"
1250531736347381760,2020-04-15 21:09:34,88,11,"A pesquisa também mostra que, para cada diagnóstico do #coronavírus nessas 9 cidades, existem outros 4 casos não notificados. Em 1º de abril, o RS tinha 389 casos confirmados. Hoje, temos 747 casos e 19 óbitos."
1250531733310779396,2020-04-15 21:09:33,81,3,"Nossas decisões estão sendo tomadas com base em dados e análises do Comitê Científico, em pesquisa de prevalência do coronavírus e no controle de internações hospitalares."
1250531726188838912,2020-04-15 21:09:31,644,43,"Buscamos um equilíbrio entre saúde, emprego e amparo social aos que mais precisam. Estamos preparando o Estado para entrar em uma fase de distanciamento controlado, monitorando leitos hospitalares, a prevalência do #coronavírus e o domínio de informações."
1250411652228550656,2020-04-15 13:12:24,860,91,"Hoje, às 15h, anunciaremos os resultados da pesquisa do @governo_rs, em parceria com a @UFPel e outras universidades, referente à aplicação de testes para a detecção da Covid-19 no Estado. Tb anunciaremos o novo decreto c/ medidas para evitar a disseminação do #coronavírus no RS."
1250121517951844352,2020-04-14 17:59:30,116,2,"Também anunciamos a abertura, nos próximos dias, de 40 leitos clínicos no Hospital Regional de Santa Maria. A abertura já estava prevista, mas, agora, o funcionamento do hospital será direcionado ao atendimento do #coronavírus. Em breve tb serão abertos 10 leitos de UTI."
1250121379585941509,2020-04-14 17:58:57,55,1,"A segunda etapa da campanha de vacinação contra a gripe começa nesta quinta. A vacina não protege contra o #coronavírus, mas evita que a contaminação por gripe e a procura por hospitais. Na 1ª, 86% dos idosos gaúchos se vacinaram, assim como 84% dos profissionais de saúde."
1249761511771381762,2020-04-13 18:08:58,47,2,"Também anunciei que o Ministério da Saúde liberou R$ 260,8 milhões em recursos extras para o enfrentamento ao #coronavírus. Os municípios receberão R$ 181 milhões e, para o Estado, serão R$ 79,4 milhões."
1249761509066051585,2020-04-13 18:08:57,90,8,"O número de testes que será enviado vai variar de acordo com o a população total de cidade e do número de casos confirmados de #coronavírus. Para Porto Alegre, cidade com maior número de casos no RS, serão 183 caixas."
1248612705730101248,2020-04-10 14:04:01,3233,233,"Toda a população gaúcha está sendo afetada pelo #coronavírus. Projetamos queda de arrecadação que trará consequências econômicas e, por isso, reduzirei, nos próximos 3 meses, minha remuneração em 30%. A sociedade paga um custo alto, e é um momento que demanda sacrifícios pessoais"
1248376461079097345,2020-04-09 22:25:16,191,11,"Sancionei agora há pouco os quatro projetos de lei que alteram o quadro funcional do IPE Saúde e do IPE Prev. Agradeço, mais uma vez, a compreensão e o apoio dos nossos deputados, que entenderam a urgência da medida, inclusa no nosso rol de enfrentamento ao #coronavírus. https://t.co/FxjcSHrpUt"
1248314911538675712,2020-04-09 18:20:42,19,1,"Já os produtores afetados pelo coronavírus terão as dívidas de custeio e investimento prorrogadas até 15 de agosto, abertura de linha de crédito emergencial de R$ 20 mil para produtores do Pronaf e de R$ 40 mil para produtores do Pronamp"
1248314906849542152,2020-04-09 18:20:41,139,7,"O governo federal, por meio do @Mapa_Brasil, atendeu nosso apelo e anunciou medidas de socorro a agricultores gaúchos q/ tiveram perdas c/ a estiagem e em função do coronavírus. Ao lado do secretário @CovattiFilho, anunciei essas ações na nossa transmissão diária na internet"
1248250999774404610,2020-04-09 14:06:44,41,2,"Agradeço a compreensão e a parceria do Ministério Público, do Judiciário, da Assembleia Legislativa, da Defensoria Pública e do Tribunal de Contas no enfrentamento à pandemia. Precisaremos do esforço de todos, assim como também estamos demandando sacrifícios da sociedade civil."
1248250991251558402,2020-04-09 14:06:42,79,5,"Na manhã de hoje, me reuni com os chefes de Poderes para apresentar um panorama da estratégia que vem sendo adotada pelo Estado no combate ao #coronavírus. https://t.co/1RZJ4zrAke"
1248225710277345282,2020-04-09 12:26:14,790,49,"Em decreto publicado hoje, determinei que hospitais das redes pública e privada fiquem obrigados a registrar taxa de ocupação e o número de respiradores e de pacientes internados com suspeita ou confirmação de #coronavírus."
1247978512994185216,2020-04-08 20:03:58,38,6,"Projetos relacionados ao IPE Saúde e ao IPE Prev foram aprovados nesta tarde pela @AssembleiaRS. Agradeço mais uma vez aos deputados pela aprovação, de forma unânime, dessas iniciativas apresentadas dentro do rol de ações de enfrentamento ao #coronavírus https://t.co/wB91suwEv8"
1247971075792744449,2020-04-08 19:34:25,246,25,"Assinamos termo de cooperação com a @ufrgsnoticias para viabilizarmos a realização de mais 500 testes de coronavírus. Na medida que mais insumos forem adquiridos, o laboratório da universidade poderá chegar a realizar 160 testes diários https://t.co/mX5egVSjlX"
1247635491605958658,2020-04-07 21:20:55,184,13,"Recebemos, durante reunião diária do Gabinete de Crise, o prefeito @marchezan_ e a equipe da Saúde de POA para alinhar, entre Estado e Capital, medidas de enfrentamento ao #coronavírus. Importante reunião c/ troca de informação e discussão de cenários em torno do vírus https://t.co/Wd002P8res"
1247609924504387588,2020-04-07 19:39:20,81,6,"Assinamos nesta tarde o termo de compromisso com o @mp_rs p/ destinação de R$ 4,95 milhões do Fundo para Reconstituição de Bens Lesados (FRBL) p/ ações de enfrentamento ao #coronavírus no RS. Os recursos irão reforçar a estrutura da rede pública hospitalar em quatro regiões. https://t.co/4sDxL16WrG"
1247602269031456769,2020-04-07 19:08:54,55,3,"Estamos aprimorando nosso sistema de monitoramento e de apuração de dados. Por isso, precisamos da cooperação dos hospitais para que façam o controle do número de internações em UTI de casos graves de #coronavírus e atualizem diariamente o sistema."
1247602262538694657,2020-04-07 19:08:53,400,19,"Contratamos hoje 17 novos profissionais de saúde para reforçar a equipe do Laboratório Central do Estado (Lacen), responsável pela aplicação de testes de #coronavírus. São dois médicos, sete enfermeiros, quatro farmacêuticos e quatro biólogos."
1246174635386974209,2020-04-03 20:36:00,92,5,"Os resultados serão fundamentais para a definição de estratégias de enfrentamento à pandemia. Dos 48,9 mil testes disponibilizados pelo Ministério da Saúde, 20 mil estão sendo enviados para Pelotas."
1246174629137391616,2020-04-03 20:35:59,380,34,"Assinei, hoje, o convênio que oficializa a parceria entre o Estado e a @Ufpel para realizar, com outras quatro universidades federais (Ufpel, Ufsm, Ufrgs, Unipampa e UFCSPA), um estudo de amostragem para analisar a evolução do #coronavírus no Estado. https://t.co/VF3ft8g8nG"
1246085879170506753,2020-04-03 14:43:19,191,9,"Além das reuniões diárias do Gabinete de Crise que atua na coordenação das ações de enfrentamento ao #coronavírus, mantenho contato permanente com os comitês formados por especialistas de vários setores da sociedade para avaliar os cenários e tomar decisões. https://t.co/CNdzRX4n47"
1245785947607793667,2020-04-02 18:51:30,746,44,Conversei hoje com os demais governadores dos Estados que integram o Cosud (Sul e Sudeste) para elencarmos demandas ao governo federal para o enfrentamento ao #coronavírus. Queremos evitar o colapso nas contas públicas estaduais e municipais.
1245330487406624769,2020-04-01 12:41:39,330,30,"Responderei a perguntas da imprensa daqui a pouco, principalmente sobre o novo decreto, que restringe o funcionamento do comércio para evitar a propagação do #coronavírus no RS. https://t.co/dUUv6badjS"
1245156030214033409,2020-04-01 01:08:26,8084,1274,"Com base em evidências científicas e na evolução do contágio por coronavírus, determinei agora à noite o fechamento do comércio em todo o território estadual até o dia 15 de abril. A decisão será publicada amanhã em edição extra do Diário Oficial do Estado."
1245055679783731209,2020-03-31 18:29:40,549,47,"Não vemos, neste momento, a possibilidade de, durante o mês de abril, regredirmos em relação às regras de restrição de contato. Embora em muitos casos não desenvolvam a doença com maior gravidade, jovens e crianças podem transmitir o #coronavírus."
