id,postado_em:,numero_de_favoritos,numero_de_retweets,texto
1315050222159044608,2020-10-10 22:03:00,5112,177,Meu pensamento hoje está voltado para os familiares e amigos de cada um dos 150 mil brasileiros que perderam a vida para o coronavírus.
1310653771467436033,2020-09-28 18:53:04,2457,171,"TRANSPARÊNCIA E FOCO: O governo e o Congresso precisam enfrentar o desafio de regulamentar o teto de gastos JÁ. Essa indefinição pode provocar mais uma crise que vai impactar a vida dos brasileiros, adiando ainda mais a recuperação econômica provocada pela pandemia."
1305815047541854209,2020-09-15 10:25:42,2540,412,"O que elevou o preço ao consumidor foi o vergonhoso aumento de alguns planos de saúde no meio da pandemia. Em alguns planos, o reajuste chegou a 25%. https://t.co/QDR4DrxQtR"
1296959218906529793,2020-08-21 23:55:48,378,18,"E também parabenizo o senador @EduardoBraga_AM , que trouxe esse debate ao Senado, a deputada @jandira_feghali, que tem projeto semelhante, além de outros deputados. Os brasileiros já estão enfrentando muitas dificuldades nesta pandemia e esta foi a melhor decisão a ser tomada."
1296581818116866049,2020-08-20 22:56:09,18795,852,"Resgatamos hoje o princípio que adotamos no início da pandemia, o de proteger o gasto público em defesa do cidadão. A manutenção do veto ao aumento de salários dos servidores vai permitir o financiamento da máquina pública - inclusive o pagamento em dia dos funcionários públicos."
1292156380330233856,2020-08-08 17:51:02,3277,142,"Estamos convivendo diariamente com a pandemia, mas não podemos ficar anestesiados e tratar com naturalidade esses números. Cada vida é única e importa. Em nome da Câmara dos Deputados, presto mais uma vez solidariedade aos familiares e amigos das vítimas desta grande tragédia."
1291053396930310145,2020-08-05 16:48:11,531,23,"Recebi hoje a embaixadora do Canadá no Brasil, @canjenmay. Conversamos sobre as pautas da Câmara durante a pandemia e os esforços para a retomada da nossa economia, em especial a reforma tributária e a melhora da qualidade do gasto público. https://t.co/dKhv6YUGO7"
1288853844034822144,2020-07-30 15:07:56,273,11,"O que aprovamos na madrugada foi a criação de uma linha de crédito, também dentro do Pronampe, de até R$ 100 mil para profissionais liberais minimizarem as perdas financeiras causadas pela pandemia."
1288813592297562113,2020-07-30 12:28:00,4214,219,Aprovamos nesta madrugada o direcionamento de R$ 12 bilhões para fortalecer o caixa de micro e pequenas empresas. Certamente é uma das medidas mais importantes aprovada pela Câmara dos Deputados nesta pandemia.
1288257124448047104,2020-07-28 23:36:47,1776,79,"A sanção de mais um projeto da Câmara nesta pandemia vai garantir apoio às famílias mais vulneráveis, pois libera R$ 1,5 bilhão adicional para ações de assistência social."
1285696919956860928,2020-07-21 22:03:27,564,28,"Aprovamos a carência de 120 dias no empréstimo consignado para quem foi demitido e de 90 dias para empregados que tiveram redução de salário, contrato suspenso ou foram contaminados pelo coronavírus. Essas medidas foram incluídas na MP 936 pela Câmara dos Deputados."
1284951668690493444,2020-07-19 20:42:05,1749,147,"O projeto virou lei e permite que o governo prorrogue o pagamento dos 600 reais enquanto durar a pandemia. TODOS os deputados e deputadas votaram a favor do auxílio, inclusive o trecho que permite ao governo estender a ajuda. Esses são os fatos. O resto é fakenews covarde."
1281343139245064192,2020-07-09 21:43:05,147,3,"A pandemia afetou muito os pequenos negócios, que estão fechando as portas por falta de capital de giro e por não terem como pagar funcionários. O crédito disponível não chegava na ponta."
1279949408948420611,2020-07-06 01:24:54,236,10,Temos que fazer um debate amplo após a pandemia sobre a situação de milhões de brasileiros que ficarão sem renda por muito tempo. Um novo programa social deve ir além da transferência de renda.
1279949406431838208,2020-07-06 01:24:53,3291,137,Continuo defendendo uma reunião entre os Poderes para discutirmos as matérias mais importantes para o Brasil. Vivemos uma situação muito grave com o impacto desta pandemia na vida das famílias. Esse é o momento de estarmos unidos. #gnewsdebate
1278465846566965248,2020-07-01 23:09:45,2771,198,"Aprovamos o adiamento das eleições municipais para os dias 15 e 29 de novembro. Infelizmente, ainda vivemos um momento muito crítico da pandemia, com seu avanço para o interior do país. A eleição não poderia comprometer as ações que buscam salvar vidas e proteger as famílias."
1278091142173790212,2020-06-30 22:20:48,841,30,"Neste momento de crise, numa pandemia nunca vivenciada pela nossa população, o Congresso Nacional, dialogando com o governo, criou um auxílio emergencial que atende mais de 60 milhões de brasileiros."
1270474434504261632,2020-06-09 21:54:44,3052,91,"Nos próximos dias, vamos retomar os trabalhos da comissão da reforma tributária. Há consenso na Câmara de que não há espaço para aumento da carga tributária. Ninguém tem condições de pagar mais impostos, principalmente depois desta pandemia."
1270474433099116544,2020-06-09 21:54:43,2377,61,"Acredito que depois do momento mais crítico da pandemia teremos condições de, junto com o governo e a sociedade, definir as condições para que esse benefício continue atendendo à população mais vulnerável."
1270126811490455552,2020-06-08 22:53:24,715,25,"Não podemos achar normal que, num momento como este, haja omissão de dados sobre a pandemia no Brasil. Acredito que até amanhã teremos uma posição satisfatória."
1269643104656797697,2020-06-07 14:51:19,4131,510,"Artigo do Persio Arida precisa ser lido. Endosso suas palavras, nosso maior problema hoje é que os recursos não estão chegando principalmente às micro e pequenas empresas. A falta de apoio vai agravar o problema do endividamento pós-pandemia. https://t.co/q06x9fv7LD"
1269418297587576832,2020-06-06 23:58:01,3870,223,"“Sobre os dados e informações de óbitos pelo covid, é urgente que o governo restabeleça isso o quanto antes. Estados e municípios precisam de transparência e desses dados para planejarem suas ações no combate ao coronavírus”. #LiveMaiaeTico"
1269418292873068544,2020-06-06 23:58:00,1584,81,“Sigo defendendo o isolamento social e sou contra qualquer aglomeração neste momento de pandemia. E manifestações que defendam o fechamento das instituições são um ataque violento à nossa democracia. Esse radicalismo enfraquece o futuro de milhões de brasileiros”. #LiveMaiaeTico
1267565737268428800,2020-06-01 21:16:36,2374,126,"Vou continuar defendendo a importância da nossa democracia, da nossa liberdade, contra qualquer tipo de visão autoritária. E cobrando a união de todos os que detém o poder no esforço de combater a pandemia, salvar vidas e a nossa economia da recessão. https://t.co/oXcRrIPzJO"
1265418590334996485,2020-05-26 23:04:36,6396,388,"Aprovamos hoje a ajuda de R$ 3 bilhões ao setor cultural durante a crise causada pelo coronavírus. Parabenizo a inciativa dos autores do projeto. Um setor tão importante para o futuro do nosso país, como é a cultura brasileira, não pode ser esquecido nesta pandemia. https://t.co/gtcTVbASry"
1265357048319016962,2020-05-26 19:00:04,1126,48,"Vivemos hoje um momento muito grave da nossa história. A voz dessa Casa de leis deve traduzir a voz da maioria dos brasileiros para unidos vencermos o grande desafio: derrotar o coronavírus, vencer a grave crise econômica que está à nossa frente, preservando a nossa democracia."
1265357040354017280,2020-05-26 19:00:02,4789,169,"A Câmara dos Deputados traz uma palavra de solidariedade às famílias que perderam seus entes queridos em razão do coronavírus. Dirijo-me também aos verdadeiros heróis, os que sacrificam as próprias vidas e o convívio familiar, fazendo o impossível para salvar os enfermos."
1263637489706729473,2020-05-22 01:07:09,721,22,"A indenização também é devida às famílias desses profissionais no caso de morte pela doença. Sabemos que nada substitui a dor pela perda de um ente querido, mas acreditamos que esta ação pode ajudar na reestruturação das famílias que sofrem com a pandemia."
1263637487970369536,2020-05-22 01:07:09,2365,95,Outra medida muito importante aprovada hoje pelos deputados prevê o pagamento de compensação financeira de R$ 50 mil aos profissionais e trabalhadores de saúde que ficaram permanentemente incapacitados por terem se contaminado atuando na linha de frente do combate ao coronavírus.
1263614546570289154,2020-05-21 23:35:59,577,23,"Aprovamos hoje medidas muito importantes para prevenir a disseminação do coronavírus entre os povos indígenas e quilombolas, grupos de extrema vulnerabilidade. https://t.co/NFU9kFfvC3"
1263483863080275968,2020-05-21 14:56:42,888,27,"Essa unidade vai criar, com certeza, todas as condições para que, em um segundo momento, possamos tratar a pós-pandemia, a nossa recuperação econômica e a recuperação dos empregos dos brasileiros."
1263483860068839427,2020-05-21 14:56:41,5857,225,Muito importante a reunião hoje com o Presidente da República para a sanção do projeto de socorro a Estados e municípios nesta pandemia. A união de todos para o enfrentamento ao coronavírus é a sinalização mais importante.
1263212870571044875,2020-05-20 20:59:52,22762,915,"O adiamento do Enem é uma vitória da mobilização da comunidade da educação, principalmente estudantes e professores da rede pública. Agora, teremos mais tempo para reduzir as enormes desigualdades no ensino trazidas pela pandemia."
1260226716338917381,2020-05-12 15:13:57,6845,255,"Hoje o mundo comemora o Dia Internacional da Enfermagem. 
Em nome da Câmara dos Deputados, presto as maiores homenagens a esses profissionais que estão na linha de frente do combate desta pandemia, se expondo diariamente ao risco de contaminação e da incompreensão de alguns."
1259160840529420289,2020-05-09 16:38:33,11464,846,O Congresso Nacional decretou luto oficial por três dias em homenagem aos mortos pelo coronavírus. Perdemos mais de 10 mil brasileiros durante a pandemia. https://t.co/RfxY4eukKx
1258804962676609026,2020-05-08 17:04:25,15738,626,"Hoje, recebi o nosso ex-ministro da Saúde, @lhmandetta. Tratamos sobre a grave situação que o país enfrenta, as nossas dificuldades no combate ao coronavírus e a importância de considerar as medidas de prevenção e o isolamento. https://t.co/qZkSb4JV33"
1257027691649343491,2020-05-03 19:22:10,21866,1711,"No Brasil, infelizmente, lutamos contra o coronavírus e o vírus do extremismo, cujo pior efeito é ignorar a ciência e negar a realidade. O caminho será mais duro, mas a democracia e os brasileiros que querem paz vencerão."
1256203049594490881,2020-05-01 12:45:20,8789,327,"Hoje, a celebração do Dia Trabalho será bem diferente para milhares de pessoas que estão na linha de frente do combate à pandemia. Minha homenagem especial a todos os profissionais que têm defendido com tantas dificuldades a nossa população."
1255170645593403392,2020-04-28 16:22:56,3496,170,"1,5 bilhão de estudantes em todo o mundo estão com as aulas suspensas e sofrendo com o impacto do novo coronavírus. Hoje, data em que a Unesco comemora o Dia da Educação, mais do que nunca destacamos a importância da educação como caminho principal para enfrentar os desafios. https://t.co/dFiSKQq19x"
1252661109997404160,2020-04-21 18:10:56,565,17,"É uma prova de que a experiência da Câmara está contribuindo para a reflexão sobre os limites e possibilidades para que os Parlamentos continuem abertos e atuantes, independentemente das dificuldades e restrições como as impostas pela pandemia à sociedade."
1252661104502804481,2020-04-21 18:10:55,1776,129,"A atuação da Câmara, que desde o início da crise do coronavírus implementou um sistema com votações virtuais, tem servido como base para reflexões importantes num momento em que foi necessário nos adaptarmos rapidamente para o exercício de nossas funções. https://t.co/p2UqUNYHWE"
1251997329999179778,2020-04-19 22:13:19,158622,17136,"O mundo inteiro está unido contra o coronavírus. No Brasil, temos de lutar contra o corona e o vírus do autoritarismo. É mais trabalhoso, mas venceremos. Em nome da Câmara dos Deputados, repudio todo e qualquer ato que defenda a ditadura, atentando contra a Constituição."
1250887446704898048,2020-04-16 20:43:02,6984,282,"Sua dedicação, seu trabalho, sua competência, sua capacidade de compreensão do problema que enfrentamos, sua busca por soluções a partir do diálogo com toda a sociedade e com o Parlamento trouxeram segurança com a condução da área, especialmente neste período de pandemia."
1249863737311444993,2020-04-14 00:55:10,5258,476,"Aprovamos hoje, com 431 votos, o projeto emergencial, um seguro, que vai ajudar estados e municípios a passarem pela crise, compensando a perda de arrecadação de ICMS e ISS por conta da pandemia do coronavírus. https://t.co/6IpmE0PSs6"
1247691293054074880,2020-04-08 01:02:39,747,37,"A decisão tomada com apoio da Mesa Diretora e dos líderes demonstra que a Câmara sempre dará a sua contribuição, não só com projetos, mas também com atos que fortalecem o combate à pandemia do coronavírus."
1247621338514284547,2020-04-07 20:24:41,1866,86,"A decisão tomada com apoio dos líderes demonstra que a Câmara sempre dará a sua contribuição, não só com projetos, mas também com atos que fortalecem o combate à pandemia do coronavírus."
1246915976576319490,2020-04-05 21:41:50,3316,312,"O Congresso aprovou um Orçamento de Guerra, garantindo recursos para a Saúde e para quem ficou sem renda nesta pandemia. Assista e compartilhe. https://t.co/jX2VADQHRj"
1245361198784294913,2020-04-01 14:43:42,1092,26,"Se estamos hoje aprovando tantos projetos importantes para combater o coronavírus, por meio do plenário virtual, é graças ao empenho deles."
1244047570936217607,2020-03-28 23:43:48,46221,3241,". @BolsonaroSP, bem-vindo ao gabinete da sensatez. Viu como é possível ter uma rede orgânica e sem ódio? Acompanhe o meu perfil. Não tenho robôs. Aqui eu procuro contribuir para um Brasil mais justo e quero que passemos por essa pandemia com o menor número de mortes possível. https://t.co/00OvFGQByw"
1243334401473286146,2020-03-27 00:29:56,70781,7071,"Aprovamos projeto que garante R$ 1.200 por família que tenha dois ou mais adultos trabalhadores e para mães chefes de família. O governo concordou com a nossa proposta. Com isso, autônomos, MEIs e desempregados vão ter mais fôlego para atravessar a crise imposta pelo coronavírus."
1243001939287252992,2020-03-26 02:28:50,3731,184,"Aprovamos, há pouco, o projeto que garante a oferta de merenda escolar para alunos da educação básica enquanto as aulas estiverem suspensas em decorrência do estado de calamidade pública por causa do coronavírus."
1242627209963212801,2020-03-25 01:39:48,17725,1042,O Congresso está atento e votará medidas importantes para conter a pandemia e ajudar os empresários e trabalhadores. Precisamos de paz para vencer este desafio.
1242219964804841473,2020-03-23 22:41:33,4112,194,Isso garantirá mais tranquilidade para a área técnica discutir o gasto público. O governo deve usar todo o caixa existente para o enfrentamento da crise do coronavírus.
1242219963416481794,2020-03-23 22:41:33,18918,1094,"Estamos sob o risco de ter milhões de desempregados por conta da crise do coronavírus, e precisamos criar soluções para o enfrentamento do problema. Estou propondo ao governo uma emenda que vai segregar o orçamento, criar um regime extraordinário fiscal de contratações exclusivo."
1240408359020494850,2020-03-18 22:42:53,660,28,"As reformas são importantes no médio e no longo prazos. A preocupação imediata, repito, é tentar amenizar o impacto da pandemia na vida dos brasileiros."
1240033513480630272,2020-03-17 21:53:22,550,21,A Câmara vai continuar funcionando com a presença de líderes e da maioria da Mesa Diretora e com a participação do restante dos deputados de seus estados. O enfrentamento à pandemia de coronavírus e as medidas para amenizar o impacto econômico são nossas prioridades.
1240033511425409025,2020-03-17 21:53:22,2441,167,Hoje nos reunimos para definir a pauta nos próximos dias em função do coronavírus. Vamos criar um aplicativo para permitir votações à distância e a participação de todos. https://t.co/oFDdQWJSyy
1239326115505811456,2020-03-15 23:02:26,33879,5509,"Por aqui, o Presidente da República ignora e desautoriza o seu ministro da Saúde e os técnicos do ministério, fazendo pouco caso da pandemia e encorajando as pessoas a sair às ruas. Isso é um atentado à saúde pública que contraria as orientações do seu próprio governo."
1238579534594822151,2020-03-13 21:35:47,5481,269,"Quero desmentir boatos que estão criando sobre o coronavírus. Diferentemente do que foi divulgado, não tenho nenhum sintoma e por isso não fiz o teste."
1238512580664180737,2020-03-13 17:09:44,2623,303,"À Veja Paulo Guedes diz: “com 3, 4 ou 5 bilhões de reais a gente aniquila o coronavírus”. https://t.co/CCm7N6jYw4"
1237934526006992896,2020-03-12 02:52:45,230,13,Falamos também sobre os impactos esperados na economia. O ministro Paulo Guedes informou que o governo  já está olhando com cuidado alguns setores — como o de aviação e o de serviços — para minimizar os efeitos da pandemia sobre nosso crescimento econômico.
1237934522840334336,2020-03-12 02:52:44,208,7,"É fundamental que, neste momento, haja uma aproximação entre o Parlamento e os ministérios diretamente envolvidos neste problema, para enfrentarmos juntos essa pandemia."
1237934520336183296,2020-03-12 02:52:44,1215,85,"Nos reunimos hoje no Congresso com os ministros Paulo Guedes e @lhmandetta e com o presidente do Banco Central, Roberto Campos Neto, para debater o impacto que a epidemia de #coronavírus terá no Brasil. https://t.co/GadwdGw5cV"
