id,postado_em:,numero_de_favoritos,numero_de_retweets,texto
1243130166408359936,2020-03-26 10:58:22,1187,236,"A Faculdade Ruy Barbosa ofereceu o campus do Rio Vermelho para cuidarmos dos infectados do novo #coronavírus. Serão 2.000 leitos para pacientes carentes, que precisam se isolar de seus familiares e não vivem em condições ideais. https://t.co/vfWFbqG5LQ"
1242942855238352897,2020-03-25 22:34:04,284,32,"A guerra contra a #covid19 só será vencida com serenidade, equilíbrio, união e solidariedade. Todos contra o coronavírus!!!"
1242942851522203650,2020-03-25 22:34:03,737,110,"Na reunião online com os governadores de todo o país, deixei claro minha opinião: defendo uma ação forte do Governo Federal para garantir renda para os mais pobres. São eles que mais precisam. O desafio principal é o de salvar vidas e manter o emprego. É um desafio. #coronavirus https://t.co/e00sClRmZy"
1242898528797700097,2020-03-25 19:37:55,321,61,"É um momento de união, de esquecer diferenças políticas e partidárias. Vivemos no Brasil um momento gravíssimo, estamos em guerra contra o #coronavírus e vamos vencer! #FiqueEmCasa #ConsórcioNordeste"
1242631628041654272,2020-03-25 01:57:21,11295,2228,Não é gripezinha. Vou continuar trabalhando em defesa da vida. Olhar nos olhos das pessoas e dizer: estamos numa guerra. ACORDA. Temos que vencê-la. Chega de discurso vazio e delírios. Vamos trabalhar mais e mais. Responsabilidade. Todos contra o coronavírus. #FiqueEmCasa
1242542527141548032,2020-03-24 20:03:18,171,27,Pedi a eles que reforcem a importância das pessoas ficarem em casa neste momento. Agradeço aqueles que já colocaram suas emendas para reforçar o combate ao novo #coronavirus. Todos juntos contra o coronavírus! #FiqueEmCasa
1242462091044368385,2020-03-24 14:43:40,271,26,"Lá, funciona uma maternidade da UFBA. Pedimos ao reitor da universidade para levá-la para o Hospital das Clínicas e isso já está sendo feito.  Hoje devemos concluir a negociação para o Estado fechar totalmente o hospital, que é particular, para os casos de coronavírus."
1242462089295298562,2020-03-24 14:43:40,866,130,"Queremos hospitais exclusivos para cuidar de infectados do #coronavírus, assim evitamos a infecção de pacientes com outras doenças. Há uma negociação com o Hospital Salvador, da rede privada, para realizar esse atendimento pelo Estado."
1242429524278738945,2020-03-24 12:34:16,1510,331,"Ontem, realizamos a compra de 600 respiradores com uma empresa chinesa. 400 são para a #Bahia e 200 para o Ceará. A FIEB irá doar outros 100 respiradores para o Estado. Os aparelhos vão equipar as unidades especiais de combate ao novo #coronavírus, como o Hospital Espanhol. https://t.co/eyDq5AZjlK"
1242398492913524741,2020-03-24 10:30:58,586,86,"Uma boa notícia para começar bem o dia. O @STF_oficial decidiu suspender por 180 dias o pagamento de parcelas da dívida do Estado com a União. Com a diminuição da nossa receita por conta do novo #coronavírus, ganhamos esse prazo para aplicar mais recursos no combate à #Covid19."
1242393863354036226,2020-03-24 10:12:34,155,13,"Bom dia. Daqui a pouco, estou ao vivo no estúdio da @RecordTVItapoan para falar sobre as ações do Estado na prevenção e no combate ao novo coronavírus. #Covid19"
1242246626376323074,2020-03-24 00:27:30,824,198,"Mais do que nunca, é preciso ficar em casa! #FiqueEmCasa #coronavirus #covid19 https://t.co/lAnhOaVq9x"
1242239762532048897,2020-03-24 00:00:13,248,32,"Aqui na Bahia, adotamos a estratégia de não misturar pacientes de #coronavírus com outros pacientes, para evitar contaminações. Já iniciamos adaptações no antigo Hospital Espanhol e em outras instalações."
1242121582396542977,2020-03-23 16:10:37,165,24,"23 rodoviárias estão sem funcionar na #Bahia, além do Terminal de Bom Despacho, em Itaparica. O @governodabahia está adotando todas as medidas possíveis para combater a #Covid19. #coronavirus"
1241788180082372608,2020-03-22 18:05:48,970,162,"Assinei há pouco, na Governadoria, novo decreto com mais uma ação do Estado na luta contra a #covid19. Desta vez, requisitamos o prédio do antigo hospital Santa Clara, em Salvador, para atender pacientes que estão identificados como suspeitos de serem portadores do coronavírus. https://t.co/mAqpt6mQsM"
1241744296174407682,2020-03-22 15:11:25,2767,606,"Quero reafirmar que, na Bahia e no Nordeste, vamos continuar realizando ações de suspensão do transporte intermunicipal e implantando barreiras sanitárias nas nossas estradas para controlar a disseminação do novo #coronavírus. https://t.co/lOjDlm4XxX"
1241510747697446913,2020-03-21 23:43:23,2101,372,"Estão a todo vapor as intervenções para recuperar o Hospital Espanhol. É um investimento que estamos fazendo para atender pacientes com #COVID19. Muito trabalho, muita fé em Deus. Tá sendo duro, mas vamos vencer. Todos contra o #coronavírus! https://t.co/b8RWxpIoGY"
1241485947340042243,2020-03-21 22:04:50,628,108,"Tem notícia boa aqui também. Graças a 1 doação importante de usinas sucroalcooleiras que operam na Bahia, o sistema público de #saúde do estado receberá 260 mil litros de álcool 70%, para auxiliar na higienização hospitalar e combate ao #coronavirus. Muito obrigado! #covid19"
1241485925097639941,2020-03-21 22:04:44,556,74,"Ampliamos neste sábado a suspensão de transporte intermunicipal em mais cinco municípios: Luís Eduardo Magalhães, Barreiras, Bom Jesus da Lapa, Guanambi e Vitória da Conquista. #covid19 #coronavirus"
1241373944608952320,2020-03-21 14:39:46,248,31,"Vamos cuidar uns dos outros e passar por esse momento tão complicado. Reforço mais uma vez meu pedido para evitarem aglomerações. Faça a sua parte, a prevenção está em nossas mãos. Todos juntos contra o coronavírus!"
1241373941547118592,2020-03-21 14:39:45,609,146,Já decretamos uma série de medidas que estão em andamento para combater a propagação do COVID-19 aqui na #Bahia. É de extrema importância que todos nós adotemos alguns cuidados e práticas para prevenir o contágio do novo coronavírus. https://t.co/I6q3svMCNU
1241146806823763969,2020-03-20 23:37:12,3105,262,Sempre respeitamos o povo chinês e passamos a admirá-los ainda mais após ver como eles enfrentaram esse momento difícil. Estamos à disposição para estreitar os laços entre nossos povos. O cuidado com nossa população é a prioridade. Todos juntos contra o coronavírus. Vamos vencer!
1241146803740868608,2020-03-20 23:37:12,15030,2845,"Nós, governadores do #ConsórcioNordeste, oficializamos ao Embaixador Chinês, @WanmingYang, um importante pedido de ajuda para o combate ao novo #coronavírus no #Nordeste. Eles passaram por um momento semelhante ao que estamos vivendo agora e enfrentaram com sucesso a #COVID19. https://t.co/wpWtrN8ILB"
1240999696077934595,2020-03-20 13:52:38,111,16,"O Governo do Estado @governodabahia está mobilizado, tomando todas as medidas para prevenir a propagação do COVID-19 e proteger o povo baiano. Faça sua parte! #coronavirus #COVID19"
1240780812867579906,2020-03-19 23:22:53,383,43,Agradeço ao presidente Guilherme Bellintani pelo seu gesto de solidariedade. Baianos e baianas unidos na guerra contra o coronavírus. @gcbellintani @ECBahia
1240757348001615872,2020-03-19 21:49:38,444,41,Quero mais uma vez agradecer à Justiça Federal pela decisão. Foram sensíveis a uma causa que é de toda a sociedade baiana e brasileira. Temos que estar todos juntos nesta guerra contra o coronavírus. #COVID19 #coronavirus
1240757344042090497,2020-03-19 21:49:37,2312,419,Imagens de agora há pouco das equipes medindo a temperatura e fazendo o controle de passageiros que chegam à Bahia em voos oriundos de São Paulo e Rio de Janeiro. Conseguimos e já iniciamos o trabalho! #COVID19 #coronavirus https://t.co/LkZyFHBRdh
1240734964599095297,2020-03-19 20:20:41,217,32,"Também foram suspensas as atividades letivas, nas unidades de ensino, públicas e particulares, a serem compensadas nos dias reservados para os recessos futuros. Suspensos também abertura e funcionamento de zoológicos, museus, teatros e afins.

 #coronavirus"
1240734962548125696,2020-03-19 20:20:41,1067,203,"O decreto que proíbe aglomerações e eventos com mais de 50 pessoas vale agora para TODOS os municípios baianos, não só aqueles com casos confirmados de #coronavirus. Mais uma medida com o intuito de proteger o povo baiano. Conto com vocês."
1240702142567952384,2020-03-19 18:10:16,787,84,A Justiça foi sensível a uma causa que é de toda a sociedade baiana e brasileira. Temos que estar todos juntos nesta guerra contra o coronavírus. #COVID19
1240700549520977920,2020-03-19 18:03:56,1089,162,Agradeço ao presidente Guilherme Bellintani pelo seu gesto de solidariedade. Baianos e baianas unidos na guerra contra o coronavírus. @ECBahia @gcbellintani
1240580913827844096,2020-03-19 10:08:33,181,15,Bom dia! Já estou no estúdio da TV Bahia para uma entrevista no Jornal da Manhã. Vamos falar sobre as últimas medidas para prevenir e combater a propagação do novo coronavírus na Bahia. #VCnoJM
1240371673544699904,2020-03-18 20:17:06,96,8,"Todas elas são relacionadas ao momento do coronavírus. A Bahia é muito grande. São 417 cidades. É importante que estejamos juntos, independente de diferenças políticas e partidárias."
1240265992946757632,2020-03-18 13:17:10,2783,606,Acabo de sair do prédio onde funcionava o Hospital Espanhol onde concluímos com nossos técnicos a vistoria das áreas que vamos utilizar. Aqui vamos instalar 160 leitos para receber pacientes do novo coronavírus COVID-19. https://t.co/nAdVTS4u8y
1240254657886334977,2020-03-18 12:32:07,214,52,"Além disso, será suspenso também todo o transporte intermunicipal para as quatro cidades baianas com casos do novo coronavírus. Esta suspensão terá inicialmente a duração de 10 dias para evitar a movimentação de pessoas entre esses locais."
1240005284229242883,2020-03-17 20:01:12,1117,277,"Atenção! Conseguimos, via PGE, liminar favorável da Justiça Federal ao pedido do @governodabahia de ocupação temporária do imóvel onde funcionava o Hospital Espanhol, para utilização no tratamento de pacientes contaminados pelo coronavírus. https://t.co/uMa6wgt4Qs"
1239920969277493248,2020-03-17 14:26:10,170,48,"Entreguei agora a Central Integrada de Comando e Controle da Saúde da Bahia, onde serão monitoradas todas as unidades do estado. Aqui funcionam o Centro de Operações de Emergência em Saúde, responsável pelas ações de combate ao novo coronavírus e a Central Estadual de Regulação. https://t.co/Fna9i7fjIS"
1239676348236529665,2020-03-16 22:14:08,89,23,"Edição especial do #PapoCorreria sobre coronavírus (COVID-19). Decretamos hoje uma série de medidas de prevenção e vamos agora tirar dúvidas com a participação do secretário estadual da Saúde, Fábio Vilas-Boas, e do infectologista Antônio Bandeira. https://t.co/ZXRbgXRzZu"
1239662962836738049,2020-03-16 21:20:56,407,135,"⚠️Assinei há pouco um decreto com novas medidas para prevenir e combater a propagação do novo coronavírus na Bahia.

1) Higienização especial para todos os transportes públicos dentro do estado. Municipal, intermunicipal, interestadual e escolares, sejam privados ou públicos; https://t.co/WHDtA9w2Mm"
1239580805485211654,2020-03-16 15:54:28,48,9,"Por falar em prevenção, lembro que logo mais, às 19h, temos #PapoCorreria especial com o secretário de saúde justamente para falar sobre nossas ações de prevenção ao coronavirus COVID-19."
1239289226837004289,2020-03-15 20:35:51,75,19,"Atenção pessoal! Edição especial do #PapoCorreria nesta segunda-feira, ao vivo às 19h, com participação do secretário da Saúde, Fábio Vilas-Boas. Sei que muitos estão preocupados com o novo coronavírus e vamos fazer um programa dedicado ao assunto pra tirar todas as suas dúvidas. https://t.co/4bRFTQDzwO"
