id,postado_em:,numero_de_favoritos,numero_de_retweets,texto
1314320766360584193,2020-10-08 21:44:24,35,6,"Com a pandemia e o distanciamento social, a interação virtual se tornou necessária e ampliou a necessidade da população ficar conectada. Por isso o #FalaBahia segue cumprindo com seu objetivo de levar telefonia móvel para localidades de diferentes regiões do estado."
1313864516917223426,2020-10-07 15:31:25,24,6,Realizando uma gestão firme é que nos tornamos o estado que mais investiu em #saúde no #Brasil. Estamos enfrentando a pandemia e não vamos parar com os investimentos. Os baianos e baianas merecem! #Bahia
1313864508834709504,2020-10-07 15:31:23,64,13,"Mesmo na pandemia, nós seguimos investindo cerca de R$ 500 milhões em mais de 200 obras de construção, ampliação e reformas na área da #saúde. Hoje, entregamos a ampliação e reforma do Hospital Municipal Dilton Bispo de Santana, em #DiasDÁvila. #Bahia https://t.co/vSLuvcZWxo"
1313548256702590976,2020-10-06 18:34:43,87,20,"Apesar dos impactos da pandemia na economia, o segmento de chocolates especiais na #Bahia vem crescendo com o apoio do @governadabahia! As marcas Bahia Cacau e Natucoa, empresas de #agriculturafamiliar do sul do estado, tiveram um bom desempenho durante esse momento de crise. https://t.co/gusqCr6JTg"
1312457875982176256,2020-10-03 18:21:56,119,22,"Diariamente recebo muitos comentários questionando sobre os gastos em #saúde para o combate ao #coronavírus. É como venho dizendo: o vírus não foi embora, mas é inegável que os investimentos vão beneficiar permanentemente os baianos, mesmo após a pandemia. #Bahia https://t.co/srT4eDDqY3"
1311271045614235650,2020-09-30 11:45:54,144,29,"Com uma gestão firme e eficiente, nos tornamos o estado que mais investiu em saúde no #Brasil e assim temos enfrentado o novo coronavírus e tantos outros desafios diante da maior crise sanitária e econômica que o país já enfrentou. #Bahia https://t.co/ZgngLbMUcC"
1308094478226468870,2020-09-21 17:23:21,27,8,"Já que a pandemia ainda tem nos obrigado a manter o distanciamento social, a visita no ambiente virtual é uma oportunidade de conhecer um pouco da história geológica do nosso estado e este patrimônio cultural baiano. Acessem https://t.co/6E0DyfUKNd e saibam mais! #Bahia"
1308043993012469760,2020-09-21 14:02:44,45,5,"Aproveitei a visita à cidade para vistoriar o campus da Uneb, que, por causa da pandemia, segue fechado. Todos nós, governo, sociedade e, sobretudo, as famílias, precisamos estar unidos em prol da valorização da educação e da cultura. #Ipiaú #Bahia https://t.co/yyjZ3m9Akp"
1306689430619594761,2020-09-17 20:20:12,75,9,Vamos encaminhar ao @trebahia informações técnicas e sugerir protocolos sanitários para assegurar que a campanha eleitoral e a votação deste ano não provoquem o avanço da pandemia do novo #coronavírus na #Bahia.
1306550433478045698,2020-09-17 11:07:52,43,4,"Já poderia ter conquistado essa marca antes, mas por causa da pandemia, precisamos interromper as viagens e o contato com as pessoas que eu tanto gosto. #Bahia"
1305825211372232704,2020-09-15 11:06:06,53,6,"A foto sem máscara e com abraço é antiga, antes da pandemia, portanto os cuidados continuam. #UseMascara e nada de aglomerações! #Bahia"
1304845724606238720,2020-09-12 18:13:58,170,34,"Com a pandemia, cuidar da mente também é essencial, principalmente a dos pacientes com #Covid19 e dos profissionais da linha de frente. Durante o #SetembroAmarelo, a Equipe de Psicologia do Hospital Espanhol realiza a ação ""Setembro Transforma Dor"", com três frentes de atuação. https://t.co/rigUduwce0"
1304425054558720003,2020-09-11 14:22:22,38,11,"Após inauguração do novo Hospital do Câncer em #Juazeiro, estou ao vivo falando sobre investimentos na área da #saúde e ações para enfrentamento da pandemia de #Covid19 em coletiva de imprensa. Acompanhe no #Facebook: https://t.co/1MPhf5Mxrb"
1304343856645890049,2020-09-11 08:59:43,1241,249,"Bom dia! A sexta-feira começa com a oficialização de uma ótima notícia! A #Bahia assinou um acordo de cooperação com o fundo soberano da #Rússia, o RDIF, para o fornecimento de 50 milhões de doses da vacina Sputnik V, a primeira contra #coronavírus registrada em todo o mundo."
1303741565119221760,2020-09-09 17:06:26,184,34,"O mundo inteiro está debruçado em encontrar uma vacina eficaz contra o coronavírus e que seja segura para todos. Faz parte da pesquisa científica o sucesso e, às vezes, o insucesso em determinados testes. #saúde #Bahia https://t.co/JMuYCIQKJB"
1302300844365361153,2020-09-05 17:41:31,47,11,"Acredito na seriedade e comprometimento das equipes científicas que vêm trabalhando em todo o planeta e, com fé em Deus, juntos vencermos a guerra contra o coronavírus. #saúde"
1301974508870524931,2020-09-04 20:04:47,32,5,"É uma alternativa fácil, rápida e com comodidade na prestação deste serviço, ainda mais neste período de pandemia que ainda estamos vivendo e que, dentro do possível, precisamos ainda manter o distanciamento social. #RGExpresso #SACDigital #Bahia"
1301625658402054145,2020-09-03 20:58:34,79,11,"Mesmo que a situação aparente que está de volta à normalidade, nós ainda estamos em pandemia. Nossas decisões são pautadas em critérios técnicos com especialistas para salvarmos vidas humanas. É este o meu compromisso para vencermos a guerra contra este vírus. Obrigado, Dráuzio!"
1301625656137134087,2020-09-03 20:58:34,298,71,"Fico muito feliz com as considerações do dr. Drauzio Varella, que colocou a #Bahia como um grande exemplo para o país no combate ao #coronavírus. Aqui, optei por tomar decisões e medidas em diálogo e consonância com os prefeitos, independente de partido e ideologia. #saúde https://t.co/qNO2sc8HtW"
1300213747508805632,2020-08-30 23:28:08,146,22,"Atenção, estudantes, professores e funcionários dos colégios estaduais do #SubúrbioFerroviário de #Salvador! Amanhã começa a convocação para testagem para o #coronavírus nas unidades escolares. Ao todo serão 12 escolas testadas até o dia 23 de setembro, realizando exames RT-PCR. https://t.co/DCp2DMpQ7F"
1300043550852288512,2020-08-30 12:11:50,71,8,"Durante a pandemia, o estoque de bolsas de sangue do #Hemoba atingiu nível crítico em todas as unidades de coleta da #Bahia. Atitudes como essas, além de divertidas, são inspiradoras. Bom domingo a todos!"
1299069375140564995,2020-08-27 19:40:49,32,11,"Essa é uma obra de grande impacto positivo pra região da #ChapadaDiamantina, vai promover segurança e renda para 233 mil habitantes e ajudar na retomada da atividade turistíca após esse período de pandemia da #covid19."
1298005182752739329,2020-08-24 21:12:05,77,16,"Na próxima semana 20 novos leitos serão abertos no Hospital Regional de #Juazeiro para pacientes com #Covid19. Ao todo, serão 94 leitos estaduais dedicados exclusivamente ao #coronavírus no município. Na região norte, alcançaremos a marca de 186 leitos contra a Covid-19. #Bahia https://t.co/937cTeM9Ha"
1297880923078365185,2020-08-24 12:58:20,212,27,"A mensagem do papa Francisco é de ontem, mas vale destacar no início de mais uma semana. A pandemia do novo coronavírus não acabou. Precisamos tomar todos os cuidados. Usar máscara é imprescindível. Só saia de casa se for necessário e nada de aglomerações. Bom dia! #Bahia https://t.co/DM0AJzDZ6t"
1297238839019397127,2020-08-22 18:26:55,329,45,"Junto com o fim de semana, chega a vontade de ir para uma festa, ver os familiares e amigos... Mas precisamos lembrar que a pandemia ainda não acabou! Estamos registrando denúncias e casos de festas e aglomeração, com pessoas sem usar a máscara de proteção. https://t.co/DyFvZrLl3K"
1296515994085666818,2020-08-20 18:34:35,207,44,"Bons ventos para a #Bahia: mesmo com a pandemia, será implantado o primeiro complexo eólico do estado nos municípios de #Tucano, #Araci e #Biritinga. São cerca de R$ 1,3 bilhão em investimentos na construção da primeira fase do parque eólico no nordeste da Bahia. #AquiÉTrabalho https://t.co/6m5hILVpoB"
1294984714172936193,2020-08-16 13:09:50,156,20,"Mesmo durante a pandemia, o Programa de Desenvolvimento do Turismo segue em andamento na #Bahia. São cerca de R$ 400 milhões em recursos investidos para melhorar a infraestrutura turística e fortalecer a cadeia produtiva no nosso estado. https://t.co/lQukz3n4o5"
1294311575965270018,2020-08-14 16:35:01,116,16,"Cheguei em #MiguelCalmon já checando a minha temperatura. Só assim liberaram minha entrada na cidade! É rápido, indolor e beneficia todo mundo. Todos os devidos cuidados estão sendo tomados durante esse período da pandemia de #covid19. https://t.co/gXRDQPs2Z6"
1293610441214758914,2020-08-12 18:08:57,58,12,"Também estamos entregando a revitalização do entorno da Lagoa de #CampoFormoso, que agora conta com uma ciclovia, quadra poliesportiva, quiosques e praça. Um bom espaço de lazer para os campo-formosenses aproveitarem após o período de pandemia. #Bahia https://t.co/nZ00KaYWG1"
1293513335359410177,2020-08-12 11:43:06,97,12,"Bom dia, #CampoFormoso! Logo mais estarei nessa cidade linda para entregar novo colégio. Infelizmente, por conta da pandemia da #covid19 mais uma vez nossa entrega não será do jeito que gosto: com muita gente, abraços e selfies. A prioridade continua sendo a #saúde do nosso povo. https://t.co/jCVxIx8OKW"
1293215760723189768,2020-08-11 16:00:38,174,34,Mais 10 novos leitos de UTI para pacientes graves de #covid19 começam a funcionar hoje em #PortoSeguro. Eles estão localizados no hospital Neuroccor e fazem parte do nosso trabalho de descentralizar o atendimento para pacientes do #coronavirus. https://t.co/gPmeiAt53Q
1293145221346328577,2020-08-11 11:20:20,84,16,"Neste #DiaDoEstudante, recebi um depoimento muito especial no instagram: Noemi, estudante do nono ano da rede estadual de ensino. Desde o início da pandemia nós temos realizado algumas ações para garantir que os alunos estudem dentro de casa, mesmo com o distanciamento social. https://t.co/xrH7WMVaQs"
1292155779743703041,2020-08-08 17:48:39,531,91,Atingimos a marca de 100 mil brasileiros e brasileiras vítimas fatais do #coronavírus. São milhares de famílias despedaçadas. Meus sentimentos a todas estas pessoas que perderam seus parentes e amigos nesta guerra contra a pandemia.
1291843911451848706,2020-08-07 21:09:24,44,11,Esse é mais um passo que damos para vencer essa guerra contra o #coronavírus! #Bahia #AquiÉTrabalho
1291087560765247489,2020-08-05 19:03:56,58,15,"Falta menos de um mês para encerrar as inscrições do Edital da Década Afrodescendente! O Vamos apoiar iniciativas de prevenção e enfrentamento aos efeitos da pandemia, nas áreas de sustentabilidade e geração de renda para a população negra, povos e comunidades tradicionais. https://t.co/74p3Dee4YM"
1290965906114347010,2020-08-05 11:00:31,60,8,"Aqui na #Bahia priorizamos realizar investimentos permanentes, por isso não iremos desmontar esses equipamentos após a pandemia. #AquiÉTrabalho"
1290699545601552389,2020-08-04 17:22:06,116,15,"O projeto foi criado pela nossa gestão e encaminhado para a Assembleia Legislativa desde maio para dar segurança a estes trabalhadores e as suas famílias. São os esforços e cuidados para dar assistência aos baianos nesta pandemia. Com trabalho e união, vamos vencer esta guerra!"
1289908430119960577,2020-08-02 12:58:29,78,9,"Em breve irei até a comunidade para realizar esta entrega, mas, infelizmente, ainda sem muita gente por conta da pandemia. Estamos estudando para que o retorno das aulas seja feito da maneira mais segura possível para todos, alunos, professores e demais profissionais da educação."
1289282496790757376,2020-07-31 19:31:15,113,16,"Julho foi mais um mês #correria! Mesmo em meio à pandemia, seguimos trabalhando e realizando importantes entregas. Começamos entregando a Ponte do Pontal, em #Ilhéus. Em #FeiradeSantana a população agora conta com um hospital de primeiro mundo, o Clériston Andrade 2. #Bahia https://t.co/b40bEZXxx4"
1288980429060681731,2020-07-30 23:30:57,871,103,"Respeito a ciência, mas infelizmente o uso de alguns medicamentos virou parte da pré-campanha de muitos candidatos. Esses políticos deveriam propor ações contra o coronavírus, q já matou mais de 90 mil no Brasil. Chega de demagogia eleitoreira. É uma guerra. Precisamos trabalhar."
1288561164214050816,2020-07-29 19:44:56,15,2,"As próximas vamos inaugurar com muita gente, abraço e selfie, com fé em Deus! Com os devidos cuidados por conta da pandemia, o nosso trabalho continua para melhorar a vida do povo baiano."
1288490318296473600,2020-07-29 15:03:25,9,1,"Além desses investimentos, durante a pandemia, também lançamos um edital de R$ 15 milhões para essa área que é responsável por grande parte da alimentação que consumimos. https://t.co/qvzw6Y9zGG"
1287816304527900674,2020-07-27 18:25:08,46,5,"Ele aproveitou a celebração para benzer o Clériston Andrade 2, hospital que entregamos recentemente e, enquanto durar a pandemia, vai atender pacientes da #covid19. Com fé em Deus e com as bênçãos de Senhora Sant'Ana vamos vencer essa guerra contra o #coronavirus."
1287816302460100608,2020-07-27 18:25:07,93,12,"Ontem em #FeiradeSantana seria o dia da tradicional procissão em homenagem a Senhora Sant'Ana, padroeira da cidade. Devido a pandemia, a procissão não pôde ser realizada, mas foi substituída por uma carreata com a presença do Arcebispo Dom Zanoni Castro. https://t.co/xXgjmkDt7n"
1287723682027143169,2020-07-27 12:17:05,193,33,"O nosso trabalho não para! Agora, com os devidos cuidados que a pandemia exige. Investimos na #saúde para combater a #covid19, mas também investimos em obras que vão mudar a vida de diversos baianos e baianas, como a ponte entre #Barra e #XiqueXique. https://t.co/mWSMky7rqg"
1287089611156660224,2020-07-25 18:17:30,66,12,"Gosto muito de ir às feiras, conversar com esses produtores, escutá-los. Essa foto foi antes da pandemia, mas as feiras seguem em espaços mais abertos, com todos os cuidados necessário para seguir mantendo essa atividade econômica."
1287089609105641472,2020-07-25 18:17:30,222,31,"Hoje é o Dia da Agricultura Familiar! Mesmo em plena pandemia, conseguimos lançar um edital de R$15 milhões para essa área. Fazemos isso porque sabemos que com ela, movimentamos a economia e garantimos renda de muitas famílias. https://t.co/TkWPRD7GhM"
1286762192189165569,2020-07-24 20:36:28,532,82,"É a primeira vez que nós, gestores brasileiros, estamos lindando com uma pandemia desta proporção. Estou enfrentando esse desafio de cabeça erguida, pois meu maior objetivo é cuidar de gente. Eu não tenho medo de tomar decisões quando se trata de salvar vidas humanas. https://t.co/CnkjSiL6yv"
1286268900569755650,2020-07-23 11:56:18,258,24,"Testei negativo para o coronavírus. No #PapoCorreria de ontem, comentei sobre o resultado do teste que fiz na última semana, mas isso não quer dizer que posso relaxar, muito pelo contrário. https://t.co/g4tj9JtmXZ"
1285911790724014081,2020-07-22 12:17:16,51,11,"Atualmente 1.806 profissionais já receberam treinamento para lidar com o #coronavírus. O HGCA é pioneiro na Bahia em capacitação para combate e enfrentamento da #covid19. A todos os profissionais, que se dedicam diariamente a salvar vidas humanas, o meu muito obrigado."
1285549158112333828,2020-07-21 12:16:18,728,162,"Além de governar um estado em plena pandemia, todos os dias tenho que lidar com uma enxurrada de fake news correndo pelo zap e pelas redes sociais... não é fácil. Mas sigo meu trabalho.

⚠️ Político não é médico pra passar remédio.

⚠️ Não compartilhe fake news. Verifique. https://t.co/ztlRFz81TJ"
1285285338659934210,2020-07-20 18:47:58,41,8,Aqui na cidade também entregamos a ampliação do Sistema de Abastecimento de #Água de #Igrapiúna. Em tempos de pandemia esse é um investimento importantíssimo: água tratada dentro de casa com regularidade e sem interrupção.  #AquiÉTrabalho https://t.co/OhbbzdI8H4
1285230018650615809,2020-07-20 15:08:09,9,0,"Também foram entregues 150 novas barracas de feira e logo mais vamos entregar kits-feirantes, que contém máscaras de proteção, álcool gel e outros itens. Todo cuidado para os feirantes exercerem seu trabalho com melhores condições nesse período de pandemia da #covid19. https://t.co/MdME0ff2fW"
1285194489452265478,2020-07-20 12:46:58,31,6,"Mais tarde, também estarei em #Igrapiúna, fazendo a última vistoria das obras de ampliação do sistema de abastecimento de água da cidade. Infelizmente, seguimos realizando entregas sem aglomerações por conta da pandemia de #covid19, mas acredito que em breve estaremos juntos."
1284650492833017856,2020-07-19 00:45:19,111,14,"A gente sabe que não está sendo fácil enfrentar esta pandemia, mas precisamos ter firmeza para vencer a guerra contra a #Covid19. A prorrogação do decreto 19.826 será publicada em edição extra do Diário Oficial do Estado de amanhã, e eu peço a compreensão e colaboração de todos."
1284650490865876992,2020-07-19 00:45:19,408,65,"As medidas de proteção que adotamos em municípios da Região Metropolitana de Salvador e em outras cidades do interior serão prorrogadas até o dia 26 de julho. O objetivo é conter o avanço do novo #coronavírus, ou seja, SALVAR VIDAS de baianas e baianos."
1284612941380300802,2020-07-18 22:16:06,92,7,"Em breve, vamos comemorar a geração de mais empregos com a abertura das novas lojas em Valença, São Caetano, Canabrava, Candeias e São Joaquim. Mas não se esqueça que estamos em uma pandemia. Se precisar sair, use máscara e nada de aglomerações."
1284612919779631105,2020-07-18 22:16:01,431,57,"Em plena pandemia, 250 empregos diretos foram gerados com a abertura da 40ª loja da Cesta do Povo, inaugurada hoje na Sete Portas, em #Salvador. Até 2021, serão 50 lojas e 3.000 empregos. https://t.co/8r35hQRNG0"
1284489909168898049,2020-07-18 14:07:13,29,2,"Começou! Estou ao vivo com @MajorDenice e Aldacy Ribeiro, diretora de Enfermagem do Hospital Roberto Santos, falando sobre mulheres e a pandemia de #Covid19 na #Bahia. 

Assista no YouTube:
https://t.co/tLJzDhVynA"
1283395469117358081,2020-07-15 13:38:18,43,10,Só com muito trabalho melhoramos a vida das pessoas e a Bahia enfrenta com mais preparo a pandemia porque fizemos o maior investimento em #saúde pública do Brasil nos últimos anos! #AquiÉTrabalho https://t.co/kTDxUt141I
1283362020939751428,2020-07-15 11:25:24,59,10,"E vai continuar sendo uma referência em #saúde para toda a região mesmo após a pandemia. Acompanhe ao vivo aqui nas redes sociais a vistoria que faremos, logo mais, no novo Clériston 2."
1283362013331283973,2020-07-15 11:25:22,58,15,"Inicialmente, vamos destinar 40 novos leitos de UTI a pacientes com #Covid19, mas esse investimento vai muito além do enfrentamento ao novo #coronavírus. A nova unidade tem o maior centro cirúrgico do interior do estado."
1283117918591561730,2020-07-14 19:15:25,44,5,"Estou ao vivo agora com a @revistaistoe para falar sobre as nossas ações contra o #coronavírus aqui na #Bahia. Acompanhe através das minhas redes sociais.

https://t.co/i5qQgBqlPr"
1283030477667000321,2020-07-14 13:27:58,92,14,"Olha como ficou a ponte sobre o Rio Baetantã e os acessos às rodovias BR-420 e BA-534. Daqui a pouco vou entregá-las em #Maragogipe. Infelizmente, mais uma vez sem o povo de perto, por conta da pandemia da #Covid19, mas a #segurança e #saúde dos baianos são nossa prioridade. https://t.co/3CbZWFeVqv"
1282757526287785988,2020-07-13 19:23:21,155,28,"Precisou sair de casa? Então não esqueça sua máscara! Ainda vejo algumas pessoas nas ruas utilizando de forma errada e por isso quero reforçar: saiu, coloque sua máscara e use da forma correta, sempre cobrindo a boca e o nariz. Ainda não vencemos a guerra contra o #coronavírus. https://t.co/0ZXeiYr2iA"
1282683527566438401,2020-07-13 14:29:18,33,4,"O Centro Comunitário conta com rádio comunitária, sala de informática, cozinha e salão multiuso. Tudo pensado para trazer mais oportunidades para a população. Após a pandemia, o centro e a praça já estarão prontos pra receber o povo e serão ótimos espaços pra convivência. https://t.co/4e9SEO6jbA"
1282294930791071744,2020-07-12 12:45:10,1400,166,O Brasil está no epicentro da pandemia e ainda tem gente priorizando política partidária. Não é hora disso. Temos que trabalhar mais e mais. É uma guerra. Vamos lutar para salvar vidas. Todos contra o coronavírus.
1281724424878796801,2020-07-10 22:58:10,41,11,"Estou ao vivo para conversar sobre as novas informações a respeito do combate ao #coronavírus. Hoje trago novidades para o interior. Acompanhe:

IG: https://t.co/GkSes1iDcB
FB: https://t.co/zUuWZTYKv5"
1281716253443457028,2020-07-10 22:25:42,49,13,"Em instantes, tem live no Facebook e Instagram. Na pauta, novas ações contra o #coronavírus em algumas cidades do interior que chamam atenção pelos altos números de casos. https://t.co/LiCKLxvhOv"
1281643721830936579,2020-07-10 17:37:29,63,14,"Nossos esforços contra o #coronavírus não param. Nos próximos dias, abriremos novos leitos em #FeiraDeSantana, #Jequié e #Valença. Queremos derrotar este inimigo, mas também contamos com você para isso. Evite aglomerações, #FiqueEmCasa e #UseMáscara."
1281414385324490753,2020-07-10 02:26:11,434,72,"O @NEOJIBA é um projeto social do @governodabahia que já transformou, e continua transformando, a vida de milhares de jovens pela música. A pandemia não interrompeu os sonhos desses baianos, e hoje eles usaram as janelas de suas casas para levar música às comunidades onde moram. https://t.co/xJDHw3vWRi"
1280983947850194947,2020-07-08 21:55:47,71,10,"O momento é de trabalhar para conter o avanço da pandemia nas cidades baianas. Temos que estar juntos: governador, prefeitos e a população. Todos juntos contra o coronavírus."
1280983944515772421,2020-07-08 21:55:46,271,32,"Hoje, não teremos a nossa live de final do dia. Neste momento, estou reunido com mais 17 prefeitos e prefeitas baianos. Mais cedo, foram 14. Até sexta-feira, devo me reunir com cerca de 100. Não vou parar a luta para salvar vidas.  A pauta é a guerra contra o #coronavírus. https://t.co/FMTaQaZn8p"
1280897692504330243,2020-07-08 16:13:02,225,24,"Vistoria e entrega de obras com distanciamento social, viu? Já avisei ao pessoal aqui. 😂 O importante é não deixar de trabalhar pela melhoria de vida das pessoas, especialmente neste período difícil de pandemia. https://t.co/IvtcYeFFp9"
1280866516167254017,2020-07-08 14:09:09,3,0,"Um investimento de mais de R$ 18 milhões para desenvolver a região. Aqui tem um grande atrativo turístico e após o fim da pandemia, a estrada vai ser bastante utilizada pra impulsionar a economia local. Mais segurança e renda pro povo daqui."
1280245947424018432,2020-07-06 21:03:14,40,6,"Começou! Estou ao vivo no Facebook e Instagram para falar sobre o início de mais uma semana de muito trabalho para enfrentar a pandemia do novo #coronavírus na #Bahia. Assista agora!

Instagram: https://t.co/GkSes1iDcB
Facebook: https://t.co/tciDCIvQSS"
1280119446355562497,2020-07-06 12:40:34,64,10,"Sinto falta das inaugurações e de estar rodeado de gente, mas precisamos evitar as aglomerações para o bem de todos. Em breve, quando essa pandemia de #covid19 passar, nossas entregas serão com abraços e muito bate papo com a população sobre as próximas."
1279927767006613504,2020-07-05 23:58:54,403,32,"Domingo de notícias tristes em meio à pandemia que já nos entristece tanto. Em Cabaceiras do Paraguaçu,os Bombeiros concluíram a busca das vítimas do acidente no Rio Paraguaçu. A tragédia nos entristeceu profundamente. 5 mortos, sendo 4 crianças q tinham vida inteira pela frente."
1279524570006007812,2020-07-04 21:16:44,576,63,"Perdemos ontem a enfermeira Maria Conceição de Jesus, diretora da Maternidade Albert Sabin. Vítima da #Covid19, ela foi uma heroína no enfrentamento da pandemia na #Bahia. Nossa homenagem a esta guerreira com 30 anos de dedicação ao SUS. Meus sentimentos a familiares e amigos! https://t.co/YyZyxNPcSV"
1279476985673244672,2020-07-04 18:07:39,547,95,"Vai ter toque de recolher e restrição mais forte no comércio em municípios da Região Metropolitana a partir deste domingo, dia 5 de julho. A medida está publicada no Diário Oficial de hoje e tem como objetivo conter o avanço do novo coronavírus para SALVAR VIDAS. https://t.co/Zatp63QjTx"
1279074446561751048,2020-07-03 15:28:06,48,7,Também entregamos a requalificação do Entorno do Estádio Caldeirão que agora conta com uma praça de lazer e de atividades físicas. Os candeenses poderão aproveitar o espaço após o fim da pandemia de #covid19. https://t.co/lKDuARDu7y
1278865974465302528,2020-07-03 01:39:43,1204,82,"Em tempos de pandemia, esta é uma das formas de se cumprimentar com segurança. Vamos manter o distanciamento social e seguir firmes na guerra contra o coronavírus. Boa noite! https://t.co/vMmBfgd5tV"
1278767414734397440,2020-07-02 19:08:04,45,9,Ligue 180. Também devemos combater este vírus da violência contra a mulher. Lave as mãos contra o #coronavírus. Contra a violência doméstica não.
1278767384392806405,2020-07-02 19:07:57,186,39,"Infelizmente ainda precisamos nos preocupar com outras tragédias. Em maio de 2020 houve um aumento de 150% em casos de feminicídio na #Bahia em relação a maio de 2019. Durante a pandemia, também houve uma queda no número de denúncias de violência contra mulheres nas delegacias. https://t.co/jOceLsUsGJ"
