id,postado_em:,numero_de_favoritos,numero_de_retweets,texto
1255190358184648704,2020-04-28 17:41:16,144,16,"A pandemia tem deixado muitas dúvidas. A gente responde algumas e logo surgem novas. Por isso, tenho reforçado meu contato aqui com vocês em lives diárias e o #PapoCorreria, para responder aos questionamentos dos cidadãos baianos. Não perca! É hoje, 18h30. Mande sua pergunta! https://t.co/YR55qnOj2i"
1255135269147140098,2020-04-28 14:02:22,198,27,"Estamos preparando #Barreiras, #PauloAfonso, #VitóriaDaConquista, #PortoSeguro e #Jequié para testagem do #coronavírus. Também temos enviado aeronaves do @governodabahia para toda #Bahia, acelerando a coleta de material para testes em #Salvador.  Hoje, às 18h, no #PapoCorreria. https://t.co/He2YrlzXMb"
1254907501243400200,2020-04-27 22:57:18,138,24,"Nesta segunda começou a funcionar uma Unidade de Atendimento #Covid19 24h no Centro de Convenções de #Ilhéus com 22 leitos para acolher, estabilizar e encaminhar pacientes suspeitos de infecção pelo novo #coronavírus na região sul. https://t.co/f8dd7PxxVX"
1254907483040239616,2020-04-27 22:57:13,1166,206,"Determinei hoje um endurecimento das ações de prevenção ao novo #coronavírus e do isolamento social na região sul da #Bahia, especialmente em #Ilhéus e #Itabuna. É de coração aberto que peço a compreensão de vocês. Estamos nesta guerra para salvar vidas! #FiqueEmCasa #UseMáscara"
1254889688009187328,2020-04-27 21:46:31,248,34,"Daqui a pouco estarei ao vivo no Instagram (ruicostaoficial) e no Facebook para nosso #BoletimNoturno com atualizações desta segunda-feira no combate ao novo #coronavírus na #Bahia. Repito: o isolamento é ruim, mas pior é perder as pessoas que amamos para a #covid19. #FiqueEmCasa"
1254718986882822144,2020-04-27 10:28:12,447,65,"Bom dia! Já começaram a ser entregues 6 tomógrafos que compramos para ajudar no combate ao novo #coronavírus no interior e na capital. O primeiro deles chegou ao hospital de campanha da @itaipavaarenafn. #Caetité, #PauloAfonso e outras unidades de #Salvador serão contempladas. https://t.co/ToIBsoJfNI"
1254563055117139968,2020-04-27 00:08:35,298,50,"Pra gente vencer a guerra contra o #coronavírus, além de profissionais dedicados e leitos hospitalares, precisamos que você #FiqueEmCasa. Só assim teremos condições de continuar atendendo com qualidade pacientes com #Covid19 na #Bahia."
1254518284772356097,2020-04-26 21:10:41,1008,124,O ex-ministro saiu atirando. É grave interferir nas investigações da Polícia Federal. É uma denúncia que precisa ser apurada com máximo rigor e agilidade. Nada disso pode desviar do foco principal: salvar vidas. Estamos em guerra. Todos contra o #coronavírus.
1254392139603214338,2020-04-26 12:49:26,250,23,"Este serviço também conta com um call center com a participação de 45 funcionários do SAC, fazendo a recepção das ligações e transferindo para nossos estudantes. Anote o número e entre em contato para saber como enfrentar a guerra contra o coronavírus. #TeleCoronavírus #Covid19"
1254068086434652161,2020-04-25 15:21:45,211,35,"Hoje à noite, estarei no Band Entrevista pra falar sobre todos os nossos esforços no combate ao novo #coronavírus na #Bahia. Fique em casa e ligado na #Band, a partir das 18h50. Juntos no sábado à noite e no combate à #covid19. #BahiaBahia #BandEntrevista #FiqueEmCasa https://t.co/wm4Thv0ae6"
1254046406869946368,2020-04-25 13:55:37,809,163,É desumano enfrentar todos os dias as #fakenews. Cansa! Ainda mais quando estamos nesta guerra contra o #coronavírus. Use as redes sociais para salvar vidas. Basta de mentiras! https://t.co/c6b0UOW9pl
1253981835023048705,2020-04-25 09:39:01,518,60,Foco é salvar vidas. Todos contra o #coronavírus! https://t.co/59XRJqByQU
1253849312745918474,2020-04-25 00:52:26,1626,218,"Por que interferir nas investigações da PF? O ""motivo para a troca"" do superintendente eram investigações de aliados?
Por que o medo? Fake News? Por que não focar na guerra para salvar vidas? Será que somos o único país do mundo que enfrentamos 2 guerras? A política e a pandemia?"
1253710281445904390,2020-04-24 15:39:58,61,12,"Mais um #PapoCorreria no ar! Vamos te atualizar com todas as informações sobre o combate ao novo #coronavírus. Tem alguma dúvida? Manda pra gente, junto com o nome de sua cidade.  https://t.co/IFHtGFFnAT"
1253657210921668609,2020-04-24 12:09:05,295,48,"Emocionante a fala e a atitude de D. Anatilde, jacuipense de 86 anos, em plena guerra contra o #coronavírus. Como diz ela, #FiqueEmCasa e se sair, #UseMáscara! Estamos viabilizando a distribuição de máscaras para todos se protegerem. Saiba mais hoje, às 12h30, no #PapoCorreria. https://t.co/kODiAVYZjg"
1253506292406259713,2020-04-24 02:09:23,501,114,"Convocação feita! Obrigado, Nicolelis. É uma honra ter um dos cientistas mais respeitados do país coordenando o comitê científico do #ConsórcioNordeste. É com base na ciência que vamos continuar enfrentando a guerra contra o #coronavírus. https://t.co/XV3XQAA4ho"
1253361892741074952,2020-04-23 16:35:36,1787,272,"O que me causa mais indignação neste momento é a falta de união do país na guerra contra o #coronavírus. Confesso que vejo com certa inveja o comportamento em outros países do mundo, onde políticos de diferentes partidos se uniram a favor da vida."
1253143807014719488,2020-04-23 02:09:00,2210,550,"A guerra da #Bahia contra o #coronavírus já tem o reforço do Hospital Espanhol. A unidade entrou em funcionamento hoje com um túnel de desinfecção desenvolvido no #senaiCimatec, que garante mais proteção a nossos profissionais de saúde. Veja matéria exibida no #JornalNacional. https://t.co/q2lBOPtJeU"
1253075373560139782,2020-04-22 21:37:04,79,10,"Logo mais, às 19h30, estarei #AoVivo no Instagram e no Facebook para o nosso #BoletimNoturno com o balanço de mais um dia de luta contra o #coronavírus."
1253070009934524418,2020-04-22 21:15:45,172,52,"A @saudegovba está recebendo doações para ações de combate ao novo #coronavírus: ligue para 71 3115-8302 ou envie e-mail para doacoes@saude.ba.gov.br. O mundo não será o mesmo depois da #covid19, mas espero de coração que se torne mais humano e solidário! Fala aí, @ivetesangalo! https://t.co/rmim5P8hia"
1253036986098683906,2020-04-22 19:04:32,75,6,"A mudança chega em hora oportuna, em meio à pandemia do #coronavírus, já que é de extrema importância que a gente reduza ao máximo nosso contato com outras pessoas. Em breve, traremos mais detalhes sobre a versão eletrônica do CRLV."
1252908274380345344,2020-04-22 10:33:05,186,25,"Bom dia! Daqui a pouco, concedo entrevista ao vivo para Jessica Smetak no Bahia no Ar, da @recordtvitapoan. O programa já está no ar. Vamos falar sobre nossas ações na guerra da #Bahia contra o #coronavírus. #FiqueEmCasa #UseMáscara"
1252675091973976064,2020-04-21 19:06:30,403,67,"Em reunião com prefeitos do Sul da #Bahia, pedi há pouco que seja reforçada a divulgação dos nossos canais para esclarecer dúvidas e monitorar a pandemia: o telefone 155 e o aplicativo Monitora Covid-19. Por falar nisso, você já baixou o app em seu celular?  #Covid19 #FiqueEmCasa https://t.co/TyJAbiLidN"
1252608918926344192,2020-04-21 14:43:33,811,155,"Bom dia! Agora há pouco, fiz uma última visita ao Hospital Espanhol antes de sua abertura para atender pacientes com #coronavírus. Amanhã, a unidade entra em fincionamento. Nossa guerra contra a #covid19 continua, mas precisamos de você. #UseMáscara e #FiqueEmCasa https://t.co/aeCuRM73jW"
1252307529721425920,2020-04-20 18:45:56,1145,137,"Agora, em reunião com o prefeito ACM Neto e os secretários de Saúde da #Bahia e de #Salvador. Aqui todos concordam: isolamento social é o melhor caminho p/ evitar o colapso na saúde. O endurecimento de medidas restritivas nesta guerra contra o #coronavírus é uma das pautas aqui. https://t.co/KO1d50hLYp"
1251825452974510081,2020-04-19 10:50:20,879,111,"Bom dia! Neste momento de guerra contra o #coronavírus, quero fazer um apelo aos baianos do Sul do estado, especialmente aos moradores de #Itabuna e #Ilhéus: fiquem em casa. Em breve, vocês poderão aproveitar essa belíssima obra que é a ponte do Pontal. #Covid19 #FiqueEmCasa https://t.co/4E5guv7FAV"
1251639617251684352,2020-04-18 22:31:53,841,141,"A #Bahia manterá medidas duras contra o #coronavírus, fortalecendo isolamento social pra salvar vidas. O Brasil registrou 206 mortes em 24h. Na Bahia,  já são 39 mortes desde o início da pandemia. Muita tristeza! Precisamos trabalhar com seriedade, equilíbrio e responsabilidade. https://t.co/qR4B4mEWWc"
1251158717464055811,2020-04-17 14:40:58,25,6,Acompanhe agora entrevista ao vivo no programa QVP da TV Aratu! https://t.co/eB3szYtOOS #covid19 #coronavírus #FiqueEmCasa
1251121877738758145,2020-04-17 12:14:35,605,86,"Bom dia! Seguimos em obras para finalizar o espaço na Arena Fonte Nova onde teremos 240 leitos dedicados a pacientes da #covid19.  Com muita determinação e fé em Deus, todos contra o #coronavírus! #FiqueEmCasa #UseMáscara https://t.co/ddrN3kpXTX"
1250894463901282306,2020-04-16 21:10:55,346,46,"Oi, gente. Sei que há muita expectativa em relação aos últimos acontecimentos, então quero convidar vocês a acompanhar daqui a pouco, às 19h, uma live no meu Facebook e Instagram. #Covid19 #coronavírus"
1250805855282487296,2020-04-16 15:18:49,296,50,"Nossos esforços estão concentrados em amparar os baianos na guerra contra o #coronavírus. Medidas de segurança na #saúde e proteção social têm sido adotadas, em união com gestores públicos, entidades, empresários, sociedade civil e todos que estão lutando para salvar vidas. https://t.co/wy2qGuILNJ"
1250756045380751360,2020-04-16 12:00:53,833,94,"Agradeço em nome do #ConsórcioNordeste. Solidário, todo o #Nordeste se uniu nesta guerra para salvar vidas. Estamos trabalhando muito. Todos contra o #coronavírus! https://t.co/rpwxhMNcDA"
1250738635646828544,2020-04-16 10:51:42,378,67,"É difícil sim, mas é a forma mais eficaz de enfrentar a pandemia. #FiqueEmCasa e entre na guerra contra o novo #coronavírus. Bom dia!!! https://t.co/MB6ED57ub5"
1250597560449982464,2020-04-16 01:31:08,749,99,"Parabéns ao @STF_oficial! Estados e Municípios estão na linha de frente na guerra contra o #coronavírus e têm a capacidade de determinar regras de isolamento, quarentena e restrição de transporte nas rodovias. Acertada a decisão! Juntos, vamos trabalhar para vencer esta guerra!!!"
1250589207921414146,2020-04-16 00:57:56,1333,201,"Ministro fica. Ministro sai. Quase 1.800 mortes nesta guerra contra o #coronavírus no Brasil e ainda encontram tempo pra isso. País precisa vencer esta guerra! Acorda aí, gente."
1250527582791053314,2020-04-15 20:53:04,315,74,"Todo mundo junto e separado! Se a gente se unir agora contra o #coronavírus, em breve poderemos voltar a ficar perto de quem amamos. Proteja-se e proteja sua família  seus amigos. A Bahia está unida contra a #covid19. #UseMáscara e #FiqueEmCasa meu irmão! https://t.co/1FT7qJYec7"
1250486476938280962,2020-04-15 18:09:43,99,33,"Baixe já o aplicativo Monitora Covid-19. Através dele você poderá tirar dúvidas, ter orientações sobre cuidados e ser monitorado pelo Estado em sua própria casa. Já está disponível na loja de aplicativos do seu celular Android. Juntos contra o #coronavírus. #covid19 https://t.co/TTIrNvJ6qo"
1250471037805920256,2020-04-15 17:08:22,347,62,"Presto minha solidariedade aos governadores diagnosticados com #covid19. Sair de casa todos os dias é um risco, uma angústia para a família. Mas cumprimos nosso dever de trabalhar para salvar vidas. Por aqui uso sempre máscara e reforço a quem puder: #FiqueEmCasa! #coronavirus https://t.co/yIhKlgGapF"
1250169314440884224,2020-04-14 21:09:26,47,7,Hoje o #PapoCorreria está no ar mais cedo! Trago mais informações sobre nosso combate ao novo #coronavírus. Mande sua pergunta junto com o nome de sua cidade. Assista: https://t.co/roEEFsPhjH
1249871552763564032,2020-04-14 01:26:14,717,93,"Compramos mais 60 mil testes para #coronavírus do tipo RTPCR (melhor referência). Em 30 dias, foram mais de 10 mil testes. Em ampliação, o Lacen já funciona de domingo a domingo 24h por dia. Outras máquinas para teste foram compradas e irão para cidades do interior da #Bahia."
1249716330758123520,2020-04-13 15:09:26,45,7,Novidades sobre a guerra contra o #coronavirus na #Bahia. Dou entrevista daqui a pouco para a Record TV Cabrália. Acompanhe #aovivo: https://t.co/FPUgANd0wY
1249267863111774208,2020-04-12 09:27:23,1019,65,"Nesta Páscoa minhas orações vão para que esta pandemia acabe em breve e que logo possamos nos reunir com quem amamos. Vamos rezar pelos que perderam a vida, pelos que perderam entes queridos e por todos que sofrem as consequências desta guerra contra o #coronavírus. https://t.co/3EOYPFoCGS"
1249124789198958592,2020-04-11 23:58:52,865,123,"Oficialmente este sábado, 11 de abril, é dia do médico infectologista. Porém, em meio a esta pandemia de #Coronavírus, TODOS OS DIAS têm sido deles. Deixo meu parabéns e meu muito obrigado aos infectologistas e profissionais da #saúde que têm sido verdadeiros heróis nesta guerra."
1249056504998703110,2020-04-11 19:27:31,628,121,"Lamentável! Estou indignado com o CRIME DE RACISMO contra @DepValmir, chamado de macaco por defender a instalação de leitos de UTI em #Itamaraju, extremo sul da #Bahia, na guerra contra o #coronavírus. O caso já está na SSP.  A #Covid19 não escolheu partido, raça e credo."
1248985066543423490,2020-04-11 14:43:39,1256,197,Nosso Projeto de Lei que obriga empresas em funcionamento a fornecerem máscaras aos funcionários para proteção contra a #covid19 foi aprovado. Agradeço aos deputados estaduais pela votação em pleno sábado. Precisamos de união na guerra contra o #coronavírus! #UseMáscara
1248949996097060876,2020-04-11 12:24:18,452,116,"Bom dia. Lançamos um aplicativo que vai te ajudar a ficar menos tempo na rua em tempos de quarentena. Baixe o aplicativo #PreçoDaHora Bahia e compare preços pelo celular, sem sair de casa. E na hora de comprar o produto você já sabe: #UseMáscara. Todos contra o #coronavírus! https://t.co/EH3ypeYUrc"
1248775508558577665,2020-04-11 00:50:57,1459,248,"Sexta-feira Santa muito abençoada, graças a Deus!! Já estão na Bahia os novos testes para #coronavírus que adquirimos. Tivemos que mandar um um avião nosso a SP para assegurar a chegada da carga. Vamos continuar trabalhando na guerra contra a #covid19. #UseMáscara #FiqueEmCasa https://t.co/XxgPKY94Fd"
1248426412819664896,2020-04-10 01:43:46,1171,215,Fique em casa e se precisar sair use máscara. A guerra está apenas começando. #Covid19 #FiqueEmCasa #UseMascara #coronavírus https://t.co/nngZJSAbzL
1248185843803619331,2020-04-09 09:47:49,2254,312,"Acertada a decisão do @STF_oficial, que deu autonomia aos Estados e Municípios para determinarem o isolamento social. Que seja o fim desta guerra judicial. Que seja feito o que é recomendado pela #OMS. Agora, vamos focar na única guerra que interessa, que é contra o #coronavírus."
1248044944599777281,2020-04-09 00:27:57,1487,234,"Não bastasse a guerra contra o #coronavírus, Tedros Adhanom, diretor da OMS, sofreu ameaças de morte e racismo. Revoltante. A #covid19 parece ter revelado o que há de pior em alguns seres humanos. Por sorte, também revelou o que há de melhor em outros. E é nesses que acredito."
1247684165170073602,2020-04-08 00:34:20,3309,628,O país está em perigo e precisa acordar do berço esplêndido. São 114 mortes em 24 horas. O coronavírus já matou 667 brasileiros. A guerra está apenas no início. Fique em casa e evite o colapso na saúde e o caos social.  Todos contra o coronavírus!!!
1247543485655207937,2020-04-07 15:15:19,74,9,#PapoCorreria especial #covid19 já está no ar! Temos novidades sobre nossa luta contra o #coronavírus e também sobre obras de mobilidade urbana. Mande sua pergunta junto com o nome de sua cidade. https://t.co/KBYq4TQbiI
1247289079781363712,2020-04-06 22:24:24,1806,220,"O Brasil caminhando para 600 mortes. É o coronavírus impiedoso, criando um quadro dramático. Não vou desesperar, com muito trabalho vamos sair mais fortes dessa tristeza. Fé e equilíbrio. #FiqueEmCasa"
1247197628447756292,2020-04-06 16:21:01,1937,322,"Na guerra contra o #coronavírus, tem gente que continua usando redes sociais para agredir, xingar, disseminar ódio... e ainda tem quem encontre tempo para criar fake news. Deveriam se perguntar: o que posso fazer para ajudar o próximo? Apesar dessa gente, o Brasil vai vencer."
1246976144563408896,2020-04-06 01:40:55,3388,442,"Não é hora de ameaçar usar o poder da caneta. Não é hora de política partidária. É momento de trabalhar para salva vidas e evitar o caos social. Vivemos todos no mundo uma situação dramática. União, fé, força e trabalho. Todos contra o coronavírus!!!"
1246774006411341826,2020-04-05 12:17:41,3619,489,"Lamentáveis as declarações de Trump. O mundo precisa de respiradores e outros insumos nesta guerra contra o coronavírus. Deixa o capitalismo selvagem de lado e seja solidário. Na Bahia e no Nordeste, vamos continuar trabalhando incansavelmente e buscando alternativas no mercado."
1246530245806698496,2020-04-04 20:09:04,282,31,"Em nome do povo baiano, muito obrigado!! Vamos vencer essa guerra com ciência, tecnologia e solidariedade. #covid19 #coronavírus"
1246384234333450240,2020-04-04 10:28:52,1072,167,"Bom dia. Determinei que seja prorrogado até o dia 15 de abril a suspensão de ônibus interestaduais em todo o território da Bahia e de ônibus intermunicipais em 49 cidades. São medidas duras, mas estamos em guerra contra o #coronavírus e não vamos medir esforços para vencer! https://t.co/ua7UtIZall"
1246080953509912577,2020-04-03 14:23:45,246,24,"Tô ao vivo agora no programa QVP, com Casemiro Neto, na TV Aratu. Vamos falar sobre as nossas ações na guerra contra o novo #coronavírus."
1246024583922188289,2020-04-03 10:39:45,447,72,"Bom dia! Primeiro Emprego, Mais Futuro, Partiu Estágio e Mais Estudo garantidos! Manter esses programas voltados à juventude significa distribuir renda a quem mais precisa, minimizando os efeitos da crise da pandemia do #coronavírus. É guerra e estamos trabalhando para vencê-la. https://t.co/WZDOfRSVXc"
1245891103397687309,2020-04-03 01:49:21,1993,301,"São quase 300 mortes no Brasil. Momento de profunda tristeza. Nossos passos devem ser norteados pela ciência. País deve estar unido para salvar vidas. Trabalho, equilíbrio, sem bravatas, sem política partidária. Fé. Todos contra o coronavírus!!!"
1245750685540507650,2020-04-02 16:31:23,2014,309,"Indignação. Estão aumentando produtos que podem salvar vidas, a exemplo de máscaras e respiradores. Esta guerra contra coronavírus deveria unir mais e reduzir as ambições por dinheiro. Solidariedade. #Covid19"
1245366730614091777,2020-04-01 15:05:41,147,25,Serão 22 centros de triagem para #coronavírus no interior da Bahia. Assista agora ao #PapoCorreria e tire suas dúvidas! https://t.co/a5dUdjNXiC
1245345702617776129,2020-04-01 13:42:07,250,44,"Vamos apresentar todos os detalhes dos centros de atendimento para #covid19 no interior e em Salvador. Hoje, ao meio-dia tem #PapoCorreria ao vivo nas minhas redes sociais pra você se informar e tirar todas as suas dúvidas! A Bahia contra o #coronavírus!! https://t.co/wyAeoHTABG"
1245320782823260160,2020-04-01 12:03:06,137,13,"Logo mais, ao meio-dia, tem mais informações sobre nossas ações de combate à doença no #PapoCorreria. Vamos vencer essa guerra, com fé em Deus e a colaboração de cada um. Todos contra o #coronavírus! https://t.co/cfXdwZYqaJ"
1245320769300766721,2020-04-01 12:03:02,442,61,"O Hospital Fazendão não vai atender pacientes com #Covid-19, mas faz parte da nossa estratégia contra o #coronavírus. O local, com 44 leitos, já está em funcionamento para atender pacientes de baixa complexidade, deixando leitos disponíveis em nossos hospitais. https://t.co/1hDyuMD5Nu"
1245068739185262592,2020-03-31 19:21:34,195,17,Muito bonito como estão transformando isolamento social em oportunidade de ajudar o próximo. Nossa união é essencial para vencer essa guerra contra a #covid19. Juntos contra o #coronavírus. https://t.co/B5mTaVnYv5
1245032800073498624,2020-03-31 16:58:45,748,151,"Reunimos pela primeira vez hoje o Comitê Científico do #ConsórcioNordeste, um grupo de especialistas sob a coordenação de @MiguelNicolelis que fornecerá  diariamente boletins com sugestões e orientações para enfrentamento ao novo #coronavírus. https://t.co/tBFtoRXiLM"
1244939632967589888,2020-03-31 10:48:33,733,133,"Chegamos, na Bahia, ao último dia de março, com esses registros de #coronavírus. Nossos esforços para enfrentar esta guerra vão aumentar a cada dia. Bom senso, equilíbrio, solidariedade e trabalho. #FiqueEmCasa. Todos contra o coronavírus!!! https://t.co/nyc9kj9yPG"
1244771789928095744,2020-03-30 23:41:36,429,53,Importante medida aprovada pelo Senado em favor daqueles que mais precisam. Os trabalhadores informais e autônomos certamente serão os mais afetados nesta guerra contra o coronavírus e o Governo Federal precisa assegurar esse auxílio. Parabéns aos senadores! #coronavoucher https://t.co/cMVXQlh4MA
1244731169532522498,2020-03-30 21:00:11,1233,227,"Na Fórum, chamei a atenção: País caminha para caos. Governo Federal tem que promover a união, coordenar ações e integrar os Estados. Tem que ser rápido. Tem que ter equilíbrio e bom senso. ESQUECER POLÍTICA PARTIDÁRIA. Nordeste aberto ao diálogo nesta guerra contra o coronavírus. https://t.co/rzeOaZ5hLb"
1244591718999248899,2020-03-30 11:46:03,2869,466,"Bom dia! Começo a semana com notícia boa. Detentos de conjuntos penais baianos já produziram mais de 8,3 mil máscaras para profissionais da saúde. Um reforço importante contra o novo coronavírus, fruto do trabalho de quem está em processo de ressocialização. #Covid19 https://t.co/4iYNXiLNk8"
1244450458636337153,2020-03-30 02:24:44,2851,353,Twitter diz que expandiu regras para controlar conteúdos que possam colocar as pessoas em maior risco de transmitir coronavírus. Bom senso. É guerra. É salvar vidas. Todos contra o coronavírus!!!
1244305136350101505,2020-03-29 16:47:17,2247,281,Lamento provocações e atos contra a vida. Indignação! Irrestrita solidariedade às famílias que choram vítimas do coronavírus.  Prioridade é a vida das pessoas. Bom senso e trabalho para vencer a guerra. #Covid19
1244280611340075009,2020-03-29 15:09:50,3401,387,"TRISTE. A Bahia registrou o 1° óbito por coronavírus. Um homem de 74 anos q estava intubado há vários dias faleceu em hospital particular. Meus sentimentos de pesar aos familiares e amigos. Tenho repetido: É guerra dura e cruel. Vamos vencê-la com união, solidariedade e trabalho."
1244054849676869641,2020-03-29 00:12:44,1022,120,"Os governadores do #Nordeste reafirmaram o compromisso de unidade e integração. Pelo bem do Brasil, continuamos esperando uma coordenação e bom senso do Governo Federal. Todos contra o coronavírus!!!"
1244054847680327680,2020-03-29 00:12:43,5551,817,"Mais de 100 mortes. Quase 4 mil casos de coronavírus. Esta é realidade do Brasil. Dá pra entender? Precisa ser mais claro? É guerra. Temos que lutar contra o caos. É uma guerra que precisa ser vencida com bom senso, equilíbrio, união e muito trabalho."
1243651345766326274,2020-03-27 21:29:21,4201,751,"A favor da vida. Nós, governadores do #Nordeste, estamos unidos nesta guerra contra o #coronavírus. Trabalho, seriedade e bom senso. https://t.co/WiLbR1IL40"
1243555754470248450,2020-03-27 15:09:30,232,46,"Estou ao vivo agora para tirar todas as suas dúvidas sobre as medidas que estamos adotando para combater o #coronavírus. A vida das pessoas vem em primeiro lugar. Mande sua pergunta, compartilhe com seus amigos e se puder, #FiqueEmCasa! https://t.co/ElkInyqYLB"
1243536436818780160,2020-03-27 13:52:44,363,48,"Não perca. Ótima oportunidade para esclarecer dúvidas. A guerra é dura e não pode ser vencida com politicagem. Tem que ser vencida com seriedade e trabalho. Meio-dia, no #PapoCorreria, todos contra o #coronavírus. #Covid19 https://t.co/vN1S1Axsxk"
1243470390338490371,2020-03-27 09:30:18,1107,218,"Na Bahia, a prioridade é cuidar das pessoas. Estamos trabalhando para salvar vidas. É guerra. Todos contra o #coronavírus. https://t.co/Xiwlik1ab7"
1243366966657560578,2020-03-27 02:39:20,779,87,Renda básica sim! Parabéns ao Brasil por esta vitória. Parabéns à Câmara dos Deputados pela aprovação. A solução para a economia não é arriscar a vida das pessoas e sim proteger! Essa é uma vitória do povo brasileiro. Todos juntos contra o coronavírus!
1243366041347969024,2020-03-27 02:35:39,2425,384,Basta de politicagem. Gente: RESPONSABILIDADE e EQUILÍBRIO. Esse é um apelo pelas nossas vidas. Salvar vidas é a prioridade máxima. Vamos sim administrar a economia. Vamos manter a coerência e pensar nas pessoas. Pensar no Brasil. Guerra contra o coronavírus!! #FiqueEmCasa
1243212762777616384,2020-03-26 16:26:35,185,17,Obrigado a todos eles que estão lutando nesta guerra contra o coronavírus. Juntos somos mais fortes para vencer o adversário. Todos contra o #coronavírus!!! #Covid19
1243170586098089984,2020-03-26 13:38:59,181,21,Já estou no ar para mais uma conversa sobre o novo #coronavírus com os prefeitos de várias regiões da #Bahia. Acompanhe ao vivo: https://t.co/KLGF6tE1zs #covid19
1243130469836894208,2020-03-26 10:59:34,120,26,"Caso queira participar, acesse o site https://t.co/UpGJKnWegK. Agradeço ao apoio de todos neste momento tão complicado. Todos juntos contra o coronavírus! #covid19"
