id,postado_em:,numero_de_favoritos,numero_de_retweets,texto
1248777831989104641,2020-04-11 01:00:10,572,73,"Como fazer quarentena sem um teto? Projeto do @PSOL50 faz o Estado assumir sua responsabilidade com populações mais vulneráveis em tempo de pandemia.

https://t.co/dX6M0q2RFY"
1248262961132703744,2020-04-09 14:54:16,3734,597,"Número de ""novos"" óbitos por coronavírus inclui pessoas que faleceram há vários dias, mas resultados dos testes só saíram ontem. Não sabemos sequer quantas pessoas são testadas por dia. O fato é que os números oficiais são só uma pequena amostra da dimensão da pandemia no país."
1247956714852438018,2020-04-08 18:37:21,5453,939,"O coronavírus escancarou a crise civilizatória da hegemonia neoliberal: o Estado tem que acabar, privatiza tudo. Gente que um mês atrás debochava quando falávamos do SUS... Agora a saúde pública virou um consenso mundial. A pandemia mostrou a falência desse modelo de sociedade."
1247613505412501504,2020-04-07 19:53:33,2636,499,"Defender a saúde pública é  defender seu financiamento. Não adianta só aplaudir os profissionais de saúde na pandemia, mas não garantir políticas públicas pra que possam trabalhar dignamente. Defender a saúde pública é por fim ao Teto de Gastos que tirou R$9 bi do SUS só em 2019."
1247267337478328320,2020-04-06 20:58:01,4217,353,"Coletiva de imprensa sobre o coronavírus acontece nesse momento sem a presença do Ministro da Saúde. As definições de ""desgoverno"" foram mais uma vez atualizadas..."
1247182566039437313,2020-04-06 15:21:09,12491,1788,"Os livros de História vão contar que enquanto o mundo combatia o coronavírus, o presidente do Brasil declarou contra guerra contra a OMS, os infectologistas e o seu próprio Ministro da Saúde."
1246515859838906370,2020-04-04 19:11:54,772,121,"A irresponsabilidade custa vidas! Difusão da desinformação e a falta de ajuda do Governo Bolsonaro dificultam o combate à pandemia no Brasil. 
https://t.co/11MVBn1LS5"
1245845875579965440,2020-04-02 22:49:38,13316,2244,"Bolsonaro acaba de dizer em entrevista que vai pedir 1 dia de jejum ao povo brasileiro na luta contra o coronavírus. Na verdade serão vários dias de jejum pra milhões de brasileiros se ele não pagar logo a Renda Básica de R$600, aprovada pelo Congresso. Toma vergonha e paga logo!"
1245818500079386625,2020-04-02 21:00:51,206,27,"Recebemos a notícia de que o @jockeyclubdesp mantém as corridas de cavalo, mesmo durante a pandemia de Coronavirus. Esse não me parece um serviço essencial. Todos devem estar conscientes da importância do isolamento nesse momento.

#enfrentandocoronaperiferia https://t.co/4xEHOT5eZk"
1245495421474148353,2020-04-01 23:37:03,3994,1270,"ESCANDALOSO! Secretaria municipal de Saúde de São Paulo orienta não notificar casos de Coronavírus em postos da cidade. Isso é fraude, que engana a população sobre a dimensão da pandemia. A prefeitura tem que afastar os responsaveis imediatamente!
https://t.co/0iuz0HqnHS"
1245003140258238467,2020-03-31 15:00:54,180,42,"Desde o início da crise do Coronavirus temos insistido na necessidade de assegurar os empregos durante a pandemia. Esse áudio traz a denúncia de um funcionário da @voudemarisa que foi demitido em João Pessoa.

#EnfrentandoCoronaPeriferia https://t.co/CAxQCbRCuQ"
1244281162643714048,2020-03-29 15:12:01,12494,1658,"Ontem, o Ministro da Saúde voltou a defender a quarentena e medidas de isolamento. Hoje seu chefe saiu pela cidade, sem máscara e sem mostrar o exame negativo para coronavirus. Bolsonaro é um problema de Saúde Pública."
1244233487621726208,2020-03-29 12:02:34,2177,252,"""A solidariedade vai ser aliada do combate à pandemia. Vamos fazer a nossa parte e garantir que pessoas ao nosso redor tenham o que comer em casa."" | Cozinha comunitária organizada pelo @mtst em São Gonçalo.
 https://t.co/548UvyIFkF"
1243632742602080256,2020-03-27 20:15:26,3408,497,"De fato, o Brasil não pode parar diante da pandemia. Então diga @jairbolsonaro:

-Quantos novos leitos de UTI serão abertos?

-Por que o resultado dos testes demoram mais de 10 dias?

-Quantos médicos e enfermeiros serão contratados emergencialmente?"
1243533943103787010,2020-03-27 13:42:50,14856,3489,"Campanha do governo Bolsonaro contra a quarentena vai custar R$4,8 milhões. Enquanto países de todo o mundo investem no combate ao coronavirus, o Brasil investe na propagação. Vergonha!"
1243237410827309061,2020-03-26 18:04:31,10231,1606,"General Heleno rompeu a quarentena e trabalha sem máscara no Planalto. Bolsonaro se recusa a mostrar seu exame de coronavirus. Mais de 20 pessoas foram contaminadas pela comitiva presidencial. Ao invés de combate, o Governo virou um centro de disseminação da doença!"
1243213226634096640,2020-03-26 16:28:25,24678,3391,"Segurança de Bolsonaro, de 39 anos de idade, está com coronavírus e internado em estado grave. Até quando ele vai chamar a pandemia de gripezinha?"
1243145866120253440,2020-03-26 12:00:45,757,85,"Segundo estimativas de entidades patronais, até 5 milhões de pessoas podem perder o emprego só no comércio devido a pandemia do Coronavirus.
Por isso é urgente a suspensão das demissões, para garantia de renda aos trabalhadores, e o apoio a micro e pequenas empresas. https://t.co/sCwiIMwb1B"
1242597485002010625,2020-03-24 23:41:41,46348,11809,"Bolsonaro acaba de fazer um pronunciamento sem apresentar NENHUMA nova medida e culpando a imprensa pelo coronavírus. O Brasil é governado por um homem perturbado com teorias da conspiração, mas que agora ameaça criminosamente a vida de milhões de pessoas. #ForaBolsonaro"
1242472902982852608,2020-03-24 15:26:38,30514,4699,"Hospital que atendeu Bolsonaro revelou que há 2 pessoas contaminadas por coronavirus mas que o resultado é ""sigiloso"". 

O teste dele deu positivo? 
Por que ele não mostrou o exame? Se for positivo, quantas pessoas ele já infectou de forma irresponsável?

O Brasil precisa saber!"
1242419583388127232,2020-03-24 11:54:46,8967,1575,A decisão de revogar o confisco salarial também suspendeu a Lei de Acesso à Informação. O que isso tem a ver com o coronavírus? Qual o interesse em diminuir ainda mais a transparência do poder público nesse momento?
1242136580250361856,2020-03-23 17:10:13,7242,957,A pressão foi vitoriosa e forçou Bolsonaro a recuar! Agora tem que ir além: proibir demissões durante a pandemia! https://t.co/7ZfuIwulVx
1242112946551095298,2020-03-23 15:36:18,4644,1145,"Cortando salários e deixando milhões de brasileiros na miséria, Bolsonaro parece decidido a transformar o coronavírus em uma ""gripezinha"" comparada ao genocídio social que quer fazer no Brasil. #BolsonaroGenocida"
1241854669837742084,2020-03-22 22:30:00,3110,351,"Médicos cubanos sendo recebidos com aplausos na Itália para o combate ao Coronavírus. Aqui, Bolsonaro rompeu o convênio do Mais Médicos em 2019 e deixou o Brasil com 10 mil profissionais a menos. Médicos que poderiam estar agora na linha de frente contra a pandemia... https://t.co/4ngcEDeHZO"
1241422500074074114,2020-03-21 17:52:43,2263,274,"Defendi em entrevista na @CNNBrasil a anistia das contas de água, luz e gás durante a pandemia do Coronavírus. https://t.co/exBIpCPsck"
1240756165665009666,2020-03-19 21:44:56,4398,648,"Para ""conter coronavírus"", Prefeitura de São Paulo vai retirar ambulantes das ruas com GCM a partir de amanhã.

E vai dar comida às famílias desses trabalhadores? Uma renda básica emergencial?

É preciso combater a pandemia, mas é desumano deixar as pessoas à própria sorte."
1240078281300480001,2020-03-18 00:51:16,4604,789,"Perguntas do dia:

Quantos testes de coronavírus serão disponibilizados pelo governo?

Por que apenas casos graves estão sendo testados?

Quantos leitos de UTI serão abertos no SUS?

Com a saturação do SUS, o governo vai fazer como a Espanha e usar hospitais particulares?"
1239955950301335552,2020-03-17 16:45:10,20927,4186,"5 medidas para enfrentar a crise do Coronavírus:

1. Revogar o Teto de Gastos.

2. Suspender os despejos durante a pandemia.

3. Plano de garantia de emprego dos trabalhadores formais.

4. Benefício emergencial para os informais.

5. Anistia de contas de água, luz e gás na crise."
1239693795039555584,2020-03-16 23:23:27,8018,1569,Pacote do governo para enfrentar o coronavírus não tem nenhuma medida específica para quem trabalha sem carteira assinada. Temos 40 milhões de brasileiros na informalidade. Não dá pra pedir confinamento se essas pessoas não puderem comprar comida e pagar aluguel no fim do mês...
1239632869707993089,2020-03-16 19:21:22,6062,978,"O controle de coronavírus no mundo tem sido feito com o maior número de testes em pacientes sintomáticos e com isolamento. 
 
Por que aqui os testes serão apenas para casos graves?

Por que não planejaram um aumento de fabricação via Fiocruz?

Essas respostas são urgentes."
1239371757825544197,2020-03-16 02:03:48,7396,986,"Fronteiras fechadas.
Milhares de vôos cancelados.
Países literalmente parados.

E Bolsonaro chamou coronavírus de ""histeria"" e incentivou aglomerações e estádios lotados.

 ""Primeiro temos que desconstruir muita coisa aqui"": a frase dita por ele em 2019 nunca fez tanto sentido."
1239156856658038784,2020-03-15 11:49:51,8269,1318,"O Brasil tem 47 mil leitos de UTI. Metade é reservada aos planos de saúde e não atende os mais de 150 milhões de pessoas que dependem apenas do SUS.

O enfrentamento ao coronavírus vai ter que encarar esse absurdo. E mostra à sociedade a importância de investir na saúde pública."
1238950714879156227,2020-03-14 22:10:43,15972,3028,"Perguntas que o governo tem que responder imediatamente:

-Quantos testes de coronavírus o Brasil dispõe no momento?
-Quantos leitos de UTI do SUS serão abertos?
-Qual auxílio será dado para trabalhadores informais?

Não adianta apenas orientar lavar as mãos e usar álcool gel..."
1238560669450014721,2020-03-13 20:20:49,10950,1753,"AVISO IMPORTANTE: as manifestações do dia 18 em defesa dos direitos e da democracia foram canceladas pelas Frentes Povo Sem Medo, Brasil Popular e centrais sindicais por causa da evolução do coronavirus no país. Assim que a situação permitir, anunciaremos a nova data de atos."
1238499993138401286,2020-03-13 16:19:43,620,40,"Com a evolução do coronavirus e as novas indicações de autoridades sanitárias, defenderei o adiamento das prévias do @psol50 à Prefeitura de SP. Nossa pré-candidatura, com @luizaerundina, seguirá debatendo com a base do PSOL e a sociedade na construção de um projeto pra mudar SP."
1238472968549908481,2020-03-13 14:32:20,5134,686,"""Dólar a R$5 é responsabilidade de todos nós""

""Momento é de reformas: acabar com estabilidade de servidor público e com a CLT""

""Com 3, 4, 5 bilhões a gente aniquila o coronavírus""

O oportunismo de Paulo Guedes não tem fim."
1238210745759862784,2020-03-12 21:10:21,6153,705,"Uma correção: o medicamento cubano utilizado com êxito contra o coronavirus na China não é uma vacina, mas sim um antiviral, voltado para tratamento, não prevenção. Algumas reportagens falaram indevidamente em vacina, induzindo ao erro."
1238184144825434112,2020-03-12 19:24:39,10613,1578,"Uma pandemia atinge 127 mil pessoas e causa 4 mil mortes pelo mundo.

E Guedes diz que se a população ""mudar sua rotina"", a economia brasileira vai afundar.

A vida de 210 milhões de brasileiros depende desse tipo de governo?"
1238105106681344000,2020-03-12 14:10:34,9023,1743,"Em vez de investir no SUS, Paulo Guedes quer usar o coronavírus para aprovar leis antipopulares a toque de caixa. Falar em fim da CLT, independência do Banco Central e privatizações nesse momento não é apenas cinismo, é criminoso."
1238081207671422977,2020-03-12 12:35:37,74600,10872,"Vacina contra o coronavirus utilizada na China foi produzida em Cuba. De tanto gritarem ""vai pra Cuba"" acabarão indo todos..."
1237836282816069635,2020-03-11 20:22:22,9315,1507,"Ontem, Bolsonaro disse que coronavírus era ""mais fantasia"" e não era ""isso tudo"" que propagavam. Hoje, a Organização Mundial de Saúde declarou estado de pandemia.

Bolsonaro sempre foi uma vergonha, mas a cada dia se transforma em uma ameaça para o Brasil."
