id,postado_em:,numero_de_favoritos,numero_de_retweets,texto
1317120010544947200,2020-10-16 15:07:36,2382,256,"Faltando um mês pras eleições, Covas diz que vai pagar uma renda emergencial pra SP. Durante quase sete meses de pandemia, nenhuma palavra sobre isso, enquanto a fome e o desespero batiam à porta. É muita hipocrisia!"
1316851722904535045,2020-10-15 21:21:31,7960,1038,"Muita gente já viu o vídeo do Russomanno humilhando uma jovem trabalhadora, caixa de supermercado. Pois bem, ele fez outro parecido há poucas semanas, já na pandemia. É assim que ele ""cuida"" das pessoas? https://t.co/QB66T2pw4k"
1316719723573370882,2020-10-15 12:37:00,6096,676,"Com a pandemia, 42 maiores bilionários brasileiros aumentaram patrimônio em R$ 200 bilhões.

800 mil pessoas em SP podem chegar à extrema pobreza e viver com renda menor do que R$89 quando acabar o auxílio emergencial.

Entendeu por que uma renda solidária em SP é tão urgente?"
1316670055619481605,2020-10-15 09:19:38,1612,125,Os motoristas de transporte escolar ficaram abandonados na pandemia. A prefeitura não garantiu auxílio e Bolsonaro vetou o projeto federal. Me reuni com eles pra assumir nosso compromisso com a universalização do Transporte Escolar Gratuito em SP. #ViraSP50 https://t.co/dPPWtnNuIJ
1316463893829619712,2020-10-14 19:40:25,3231,356,ABSURDO! Desde ontem temos demissões coletivas no Metrô de SP. Um serviço fundamental que vem sendo destruído e sucateado há anos. Trabalhadores que colocaram sua vida em risco durante a pandemia agora são demitidos. BolsoDória segue atacando os trabalhadores!
1316047023339077634,2020-10-13 16:03:55,6544,697,"EFEITO BOLSONARO:

Pesquisa mostra que quanto mais eleitores bolsonaristas nas cidades, mais houve contaminados e mortos durante a pandemia.

Esse é o preço de ter um presidente ""e daí, não sou coveiro"" e ""é só uma gripezinha""."
1315777711474905090,2020-10-12 22:13:47,57549,6966,"“Record grava seis produtos durante a pandemia, incluindo reality shows, novelas e programas. E tem A Fazenda ao vivo.”

“Record cancela debate entre candidatos a prefeito em SP. Diz que é impossível seguir protocolos sanitários.""

Faz sentido pra você?

#QueremosDebate"
1315072778110930944,2020-10-10 23:32:37,3472,332,"150 mil mortos no Brasil. 

Desemprego recorde de 13,8%. 

Minha solidariedade a cada uma das famílias que teve que enfrentar a dor e o terror dessa pandemia. 

Como prefeito, vou evitar que essa tragédia se perpetue na maior cidade do país. Saiba mais em https://t.co/bIFJkN35cQ."
1314948186176397312,2020-10-10 15:17:32,13244,1082,"O programa de saúde de Russomanno é bolsonarista raiz: simplesmente não cita o coronavírus e a pandemia. Faltou só colocar um ""E daí? Não sou coveiro!"""
1314947870668271616,2020-10-10 15:16:17,52,2,"@dequinhabraga Desde o início da pandemia, defendemos o isolamento social,  uma renda solidária para garanti-lo de forma ampla e testagem em massa e monitoramento em tempo real da doença. Teve um Café Com Boulos especial sobre o tema: https://t.co/QwGTpJ2fAp"
1314918749909258240,2020-10-10 13:20:34,4132,372,"Pesquisa mostra que desempregados, trabalhadores de lojas, mercados serviços como telemarketing são quem mais se infectou pela covid durante a pandemia em São Paulo. Justamente as pessoas que, sem outra opção, passavam o dia na rua ouvindo Covas e Dória falando ""fique em casa""."
1314631452580081666,2020-10-09 18:18:57,476,47,“O pós pandemia vai ser uma tragédia em São Paulo se o poder público se omitir. Podemos ter uma convulsão social se não tivermos um programa da prefeitura pra garantir o básico pra que as pessoas possam sobreviver.” #ViradaComBoulos50 #RendaSolidária
1314624927144783874,2020-10-09 17:53:01,734,64,"“Quem mais se deu mal com tudo isso que tá acontecendo no país foram as mulheres. Elas foram as mais prejudicadas pela pandemia, pela reforma trabalhista e por todas as ações desse desgoverno.” #ViradaComBoulos50"
1314198698289704961,2020-10-08 13:39:20,2009,178,"Pesquisa mostra que 82% dos paulistanos defendem que as aulas deveriam voltar somente ano que vem ou depois da vacina. Ninguém confia na capacidade dos governantes de monitorar e cuidar da população frente ao coronavírus. Esse é o preço do abandono de Covas, Dória e Bolsonaro."
1313956184525811718,2020-10-07 21:35:41,669,83,"“Quando eu decidi ser candidato, fui conversar com auditores, presidente do tribunal de contas, chamei economistas. Tive que olhar umas 5 vezes pra planilha pra acreditar que, em plena pandemia, São Paulo tem 17 bilhões de reais PARADOS em caixa.” #BoulosNaForum #Eleicoes2020"
1313902944740429824,2020-10-07 18:04:07,36893,5890,"“Eu não sabia nem o que era o SUS."" Essa frase foi dita HOJE pelo atual Ministro da Saúde do governo Bolsonaro, no meio de uma pandemia. Entendeu por que estamos entre os piores países do mundo no combate ao coronavírus?"
1313873169242034177,2020-10-07 16:05:48,833,69,"SP é capital mundial do desemprego e aqui no Capão, na Zona Sul, a situação também se agravou com o desastre de Bolsonaro, Doria e Covas na pandemia. Por isso vamos implantar o Programa de Recuperação Econômica, com Renda Solidaria, Frentes de Trabalho e linhas de microcrédito. https://t.co/gOWTlmMHb5"
1313847918940631052,2020-10-07 14:25:28,315,26,"""SP é a 2ª cidade do mundo com mais mortes por coronavírus. E a prefeitura deixou hospitais fechados! É uma situação inacreditável. Na maior crise sanitária do século, você tinha o Hospital Sorocabana funcionando só o 1º andar, o da Brasilândia com 12% dos leitos!"" #BoulosNoIG"
1313615671167680512,2020-10-06 23:02:36,702,71,"“O caixa da cidade de SP é de 17 bilhões de reais que estão parados, no meio de uma pandemia. Isso daria pra garantir uma renda solidária por 5 anos. Essa turma do Dória trata a prefeitura como se fosse banco.” #Boulos50NaGazeta"
1313169262996004864,2020-10-05 17:28:44,4228,433,"Em tempos de pandemia é ainda mais importante receber esse apoio de mais de 400 médicos. A onda está crescendo. Vamos virar o jogo em SP! ✌❤
https://t.co/EnGQWx3LJg"
1313124342935498752,2020-10-05 14:30:14,1661,220,"Neste momento, mais de 80.000 pessoas estão ameaçadas de despejo no Brasil. A suspensão imediata dos despejos é mais que necessária na atual crise social e econômica provocada pela pandemia. Tem de ser implementada já! #DespejoZero #DiaMundialdoHabitat"
1312027447605563392,2020-10-02 13:51:34,994,101,"“Na pandemia, nós tivemos no Brasil um cenário surreal: o Bolsonaro disse que queria salvar os empregos e o Dória e o Bruno Covas diziam que iam salvar vidas. A verdade é que não salvaram nem vidas nem empregos.” #boulosnodatena"
1311844835314237440,2020-10-02 01:45:56,2093,262,"""SP é a 2ª cidade do mundo onde mais morreu gente por coronavírus e é a capital mundial do desemprego. Nós vamos criar uma renda solidária pra garantir que na cidade mais rica do Brasil ninguém passe fome ou revire comida do lixo."" #BoulosNaBand #BouloseErundina50"
1311665115255562248,2020-10-01 13:51:47,5114,757,"O deputado federal Russomanno votou contra a prorrogação do auxílio emergencial durante a pandemia. O candidato Russomanno agora fala em um ""auxílio paulistano"". É muita cara de pau! Eu e @luizaerundina falamos em uma renda solidária para SP desde o primeiro dia da pandemia."
1311633914801381378,2020-10-01 11:47:48,18126,3303,"Governo Bolsonaro repassou a programa de Michelle R$ 7,5 milhões doados para testes de Covid. Desviavam dinheiro de assessor fantasma no Rio de Janeiro, agora desviam dinheiro que salvaria vidas no meio de uma pandemia!"
1311344485801119746,2020-09-30 16:37:43,768,89,"Para enfrentar a crise econômica causada pela pandemia, vamos criar uma Renda Solidária de cerca de R$ 350 para as famílias mais pobres de São Paulo. Foi o que falei ontem em Guaianases. É possível e vamos fazer! #bouloserundina50 #virasp50 https://t.co/EpIRgEPrCt"
1309147900186963970,2020-09-24 15:09:16,5002,703,"O Banco Santander lucrou quase R$ 6 bi no 1º semestre deste ano. Mesmo assim, demitiu mais de 800 pessoas nos últimos quatro meses. Não é crise, é uma total falta de respeito com o trabalhador em plena pandemia. #SantanderPareAsDemissoes"
1308521696408805376,2020-09-22 21:40:58,5927,469,"Todo mundo sabe que nenhum brasileiro recebeu mil dólares de auxílio na pandemia. Na cidade mais rica do país, temos o dever moral de garantir que ninguém tenha que escolher entre pagar o aluguel ou comprar comida. Por isso, defendo uma Renda Solidária."
1308508425006059520,2020-09-22 20:48:14,921,64,"86% dos moradores da comunidade de Heliópolis, na Zona Sul de SP, se sentem deprimidos por conta da pandemia. No Setembro Amarelo, precisamos acordar pra importância dos cuidados com a saúde mental. Só assim deixaremos de ter um suicídio a cada 40 segundos."
1308126571182665729,2020-09-21 19:30:53,15907,1607,"Se a promessa do PSDB sobre a vacina for igual a do metrô, a pandemia em SP só vai acabar em 2040."
1307422033396064258,2020-09-19 20:51:18,7531,1154,"Hj o SUS completa 30 anos. Com o Teto de Gastos, perdeu R$ 20 bilhões em 2019 e continuará sendo sucatedo. 70% dos brasileiros dependem do SUS. Graças a ele, a pandemia não fez ainda mais vítimas. #DefendaoSUS"
1307385413917642752,2020-09-19 18:25:47,499,43,"Chega de abandono! Reabertura do Hospital Sorocabana já!
O Hospital Sorocabana está fechado desde 2010. Só o térreo foi reaberto esse ano, para funcionamento de uma AMA e depois alguns leitos por causa da pandemia. https://t.co/EK47m6jwc3"
1307381869151956996,2020-09-19 18:11:42,146,12,"O hospital inteiro fica fechado, e só o térreo e mezanino estavam em funcionamento com uma AMA até o início da pandemia. Depois, abriram 33 leitos de enfermaria para COVID, nenhum deles de UTI! É muito pouco!"
1306938550504615938,2020-09-18 12:50:06,941,147,Preço dos mercados já está fazendo com que muita gente na periferia de São Paulo fique sem itens básicos em casa. Há muitos pedidos desesperados de doações de cestas básicas. O abandono faz com as famílias mais pobres paguem a conta da pandemia e da crise. https://t.co/nYyIGLHUWb
1306691185818378264,2020-09-17 20:27:10,47,2,"7/ As obras deveriam ter começado em maio, mas o DER congelou gastos à época por causa da pandemia. O novo prazo agora é novembro."
1306578436148924416,2020-09-17 12:59:08,2928,346,O país ficou sem ministro da saúde por 4 meses e uma cidade do tamanho de SP até hoje não fez um programa municipal de testes e monitoramento em tempo real da pandemia. Mas agora a culpa é dos pais e professores que não se sentem seguros para a volta às aulas nesse momento.
1306553971126022144,2020-09-17 11:21:55,9403,1263,"INACREDITÁVEL! O governo Bolsonaro decidiu ""economizar"".  6 milhões de famílias serão cortadas do auxílio emergencial e não vão receber nem os R$300. Uma canetada que pode significar fome e desespero para quem mais sofreu com a pandemia."
1306228285597155330,2020-09-16 13:47:46,1633,266,"URGENTE! Acabamos de acionar o Ministério Público contra a entrega da educação de São Paulo para as OSs. Depois de desviarem dinheiro de hospital de campanha e respirador no meio da pandemia, agora querem entregar os CEUs para as máfias! https://t.co/bds8ZlstRV"
1306186954355113988,2020-09-16 11:03:32,4977,389,"A pandemia mostrou que a internet deve ser tratada como um direito, não um privilégio de quem pode pagar. Vamos lutar por isso em SP!
https://t.co/GuHsALcrLg"
1305993197571715073,2020-09-15 22:13:37,5768,836,"Hoje a tarde, dezenas de pessoas saquearam um supermercado em São Gonçalo, no RJ. Na pandemia, Bolsonaro não salvou nem as vidas nem a economia. Com a disparada dos preços dos alimentos e o corte no auxílio emergencial, está nos colocando à beira de uma convulsão social."
1304753327306166274,2020-09-12 12:06:49,9714,950,"Quantas pessoas morreram com coronavírus na última semana? Qual a posição do Ministério da Saúde? Quais critérios o MEC acha razoáveis para a volta às aulas? O que tem feito o Ministro da Educação? O desgoverno virou parte da nossa paisagem, infelizmente."
1304419899507437570,2020-09-11 14:01:53,207,9,"Precarizado, lento e caro, o transporte é uma das maiores questões para quem vive em Cidade Tiradentes. Os ônibus da linha 3789 enchem em apenas três paradas e seguem lotados por todo o trajeto. Na pandemia, os ônibus continuaram lotados. https://t.co/16sLnJJLAr"
1304397695461871616,2020-09-11 12:33:39,20514,4603,"Documento assinado pelo ministério de Damares mostra que ela pediu diretamente a Bolsonaro que negasse leitos de UTI, produtos de limpeza e materiais informativos sobre o coronavírus para indígenas. Entendeu por que chamamos este governo de genocida?"
1303733300930973696,2020-09-09 16:33:35,172,18,"""A acessibilidade digital em SP é uma vergonha. O ensino à distância durante a pandemia escancarou isso. Crianças que dependiam do acesso 3g para fazer aula."" #BoulosNoElPais"
1303334250071154688,2020-09-08 14:07:54,206,32,"Não dá pra aceitar que na cidade mais rica da América Latina, médico e enfermeiro tenha que comprar sua própria máscara para vir trabalhar e tentar salvar vidas. A pandemia revelou o abismo social e o abandono do serviço público em São Paulo. https://t.co/SfjDptHyFA [...]"
1303333966917840897,2020-09-08 14:06:47,180,15,"Essa situação do hospital escancara o descaso e abandono da Prefeitura com a periferia. Funcionários não tinham nem acesso a máscara, luva e avental. No início da pandemia, tiveram a cara de pau de fornecer capas de chuva como ""proteção""!"
1303333646078816256,2020-09-08 14:05:30,163,8,A zona leste foi um dos piores lugares da pandemia. Sapopemba lidera pelo terceiro mês seguido o ranking de bairros com mais mortes. São mais de 500 mortos. É como se caíssem 5 aviões lotados!
1303333248551079937,2020-09-08 14:03:55,227,34,"A verdade é que a pandemia mostrou os 2 mundos que São Paulo esconde. Na Zona Leste, a idade média ao morrer na Mooca é de 76 anos, São Miguel, 67 e Cidade Tiradentes 57. Quem anda 30 km, perde 20 anos de vida. https://t.co/YxgROonyez"
1303332314672508928,2020-09-08 14:00:13,810,85,"Hoje estive no Hospital Tide Setúbal, aqui em São Miguel, periferia da Zona Leste de São Paulo. Um símbolo trágico da pandemia da desigualdadade na cidade. Segue o fio 👇"
1302971909869645825,2020-09-07 14:08:06,1686,217,A crueldade do governo Bolsonaro não tem limites! Quem perdeu o emprego durante a pandemia não pode mais solicitar auxílio emergencial. Quem recebia mais de 2 salários mínimos em 2019 vai ser cortado.
1302338710789386240,2020-09-05 20:11:59,333,56,"""A mortalidade por coronavírus em um hospital no Zona Leste chegou a 90%. No Einstein, sobreviviam 80% dos pacientes. A vida de um morador de São Miguel Paulista não pode valer menos que a de um morador do Morumbi."" #BouloseErundina"
1302236842964721664,2020-09-05 13:27:12,302,14,"2/ Decidimos não fazer a convenção partidária em nenhum saguão de hotel ou auditório, mas no campo de futebol do Morro da Lua, comunidade que fica na zona sul da cidade, tomando todas as medidas sanitárias em relação ao coronavírus."
1301676211257716737,2020-09-04 00:19:27,917,91,"Você já reparou que tem algumas calçadas sendo destruídas em SP pra reformas? Pois é, concordo que as calçadas são importantes. Mas destruir trechos que estavam bons só pra cidade ficar com cara de canteiro de obras beira ao absurdo… Isso em ano eleitoral e de pandemia."
1301500940273553409,2020-09-03 12:42:59,455,29,"8/ Não há previsão para qualquer tipo de retomada da crise. O teto de gastos segue vigente, o governo não enfrentou a pandemia com responsabilidade e tampouco criou algum plano econômico que garantisse a sobrevivência de empregos e pequenos comércios."
1301500938952290304,2020-09-03 12:42:59,438,21,7/ Uma pesquisa de maio da Rede Nossa SP mostrou que 64% dos paulistanos já tinham perdido parte de suas rendas por causa da pandemia. Quantos deles não receberam auxílio emergencial?
1301500937702383619,2020-09-03 12:42:58,468,26,"6/ Para piorar, o Brasil perdeu durante a pandemia quase 9 milhões de postos de trabalho. Nossa taxa de desemprego só não está maior ainda porque muita gente simplesmente desistiu de procurar trabalho durante a pandemia"
1301224186246049792,2020-09-02 18:23:16,4666,714,"Quanto custa ""maquiar"" 120 mil corpos? Governo Bolsonaro gastou só 1/3 da verba destinada ao controle da pandemia. Agora quer triplicar verba de publicidade oficial em 2021. Vergonha!"
1301135503673171968,2020-09-02 12:30:52,3859,539,"Sem emprego e renda, inquilinos em São Paulo estão devolvendo imóveis na pandemia e voltando a morar na casa de parentes. Quem não tem pra onde ir, acaba em abrigos ou até na rua. A crise transforma o drama da moradia em tragédia!"
1300597640632176641,2020-09-01 00:53:36,1138,181,"Toda força ao cacique Raoni, internado com coronavírus. Já foi acusado por Bolsonaro de ser “peça de manobra de governos estrangeiros para avançar seus interesses na Amazônia.” Documentário sobre Davos mostrou quem realmente quer vender a Amazônia aos estrangeiros... https://t.co/68KNg52kPz"
1300406422140846080,2020-08-31 12:13:46,525,43,"O Bolsonaro dizia que o coronavírus era só uma ""gripezinha"". Mas prefeitos e governadores como os de São Paulo apenas disseram ""fique em casa"". Governante não pode ser consultor de autoajuda. Quem tem a caneta na mão tem que fazer muito mais. #BoulosNaBand"
1300405823101960194,2020-08-31 12:11:23,412,62,O hospital Tide Setúbal na Zona Leste chegou a ter mortalidade por covid de 90%. Quanto foi a mortalidade em hospitais de luxo como o Sírio Libanês? A pandemia escancarou nossa desigualdade. #BoulosNaBand
1300405037978595330,2020-08-31 12:08:16,352,32,"Essas eleições são uma oportunidade para mostrar a importância da defesa da vida, no meio de uma pandemia e da talvez maior crise de saúde da nossa história. #BoulosNaBand"
1299367456323112960,2020-08-28 15:25:17,1374,125,Neste momento mães e familiares de presos fazem uma manifestação no Palácio dos Bandeirantes para exigir condições sanitárias básicas e tratamento digno nos presídios durante a pandemia. Os relatos de abusos e humilhações são inaceitáveis. É uma questão de humanidade!
1298626400111534080,2020-08-26 14:20:35,2354,293,"A Covid segue exterminando nossa população negra. 

A mortalidade pela doença é 60% maior entre os paulistanos negros que entre os brancos. A pandemia escancara o Racismo Estrutural.

O que a prefeitura de SP está fazendo pra estancar esse genocídio?"
1297519804623073280,2020-08-23 13:03:22,4866,539,"Mais um registro da pandemia do consumismo. Agosto, 2020, Rio de Janeiro. 1200 mortos/dia por Covid. https://t.co/0K0odN0Nl4"
1297251928032841729,2020-08-22 19:18:56,7033,861,"A pandemia do consumismo! Rio de Janeiro, agosto de 2020, em meio à tragédia da Covid-19. https://t.co/YFNxy0Ts34"
1297179852840329217,2020-08-22 14:32:32,195,27,"25 MIL PESSOAS NA RUA, 150 QUARTOS E 28 MORTES
Em julho, Bruno Covas anunciou a abertura de 150 quartos de hotel para quem vive na Rua. É muito pouco. Pelo menos 28 pessoas em situação de rua já morreram durante a pandemia, fora os casos não registrados. 
https://t.co/NtG91N3pWO"
1297179849950404608,2020-08-22 14:32:31,203,30,"O MUNDO TODO ABRIGOU OS SEM-TETO NA PANDEMIA
Parece óbvio, mas por aqui não é. Durante a pandemia, 16 cidades no mundo reservaram mais de 40 mil quartos de hotéis para a população sem-teto durante a pandemia do coronavírus. 
https://t.co/oHuyrdQuR3"
1296598469268910086,2020-08-21 00:02:19,6734,989,"Governo Bolsonaro e maioria do Congresso se uniram para vetar reajuste de salários a enfermeiras, professores, garis e médicos.

No Brasil, os verdadeiros heróis da pandemia são tratados como vilões."
1296131669754339329,2020-08-19 17:07:25,2647,378,"Quase 100 trabalhadores dos Correios já morreram de Covid. Eles desempenham um papel essencial na pandemia, mas sofrem com falta de EPIs e retirada de direitos trabalhistas. Chega de sucatear pra privatizar! #EuApoioAGreveDosCorreios #NãoAPrivatizaçãoDosCorreios"
1296114622416719872,2020-08-19 15:59:41,3983,514,"Este ano Bolsonaro gastou menos com a saúde indígena do que no mesmo período do ano passado, quando não existia pandemia. Não é descaso. É um projeto de genocídio dos povos indígenas."
1295699022724902913,2020-08-18 12:28:14,1094,97,"A Prefeitura de São Paulo pagou R$3,3 milhões para a SPDM para ""gestão"" de uma UPA que está fechada! Exemplo da farra e falta de transparência das Organizações Sociais de Saúde (OSS), em plena pandemia."
1295468865003061249,2020-08-17 21:13:40,1285,153,"Bruno Covas aumentou em R$25 milhões os gastos com propaganda da prefeitura. No meio de uma pandemia, a cidade abandonada e a prioridade é propaganda..."
1295072187913773067,2020-08-16 18:57:25,495,59,"Na última sexta, a Prefeitura de SP fez um desmonte na Vigilância em Saúde na calada da noite e sem consulta ao setor. A COVISA, que tem papel fundamental na pandemia, perdeu sua autonomia técnica, administrativa e financeira. A quem isso interessa? #bouloseerundina"
1294240610556223489,2020-08-14 11:53:02,913,116,"VITÓRIA! Após marcha do @mtst, governo de São Paulo promete não realizar mais despejos durante a pandemia.
https://t.co/x8fbXNSnOk"
1294071098091470848,2020-08-14 00:39:27,1044,185,"PM de MG ameaça despejar o acampamento Quilombo Campo Grande na cidade de Campo do Meio, sul de Minas. A tropa de choque incendiou as plantações da ocupação e demoliu uma escola. Em plena pandemia, realizar um despejo com esse nível de violência é  uma desumanidade sem limites."
1294013770927411200,2020-08-13 20:51:39,565,91,"Não vão intimidar a luta do povo com violência! Chega de despejos na pandemia!
https://t.co/9PF3NGZcst"
1293993921261993984,2020-08-13 19:32:46,1130,191,"O @mtst está agora com milhares de pessoas no Palácio dos Bandeirantes em São Paulo. Doria, chega de despejos na pandemia!
https://t.co/P1M3ssmKth"
1293956555935752195,2020-08-13 17:04:18,1688,189,Paulistanos tem que passar mais de duas horas na fila pra falar com a Enel e tentar resolver a lambança que a concessionária de energia fez durante a pandemia. E ainda tem gente que acha que a solução pra tudo é privatizar...
1293556101649248258,2020-08-12 14:33:02,4755,677,A pandemia mostrou que o Estado mínimo é uma mentira. A mão invisível do mercado não vai salvar vidas e recuperar a economia. O melhor que essa equipe econômica faz é debandar mesmo. Que levem Guedes e Bolsonaro junto!
1293343710248394752,2020-08-12 00:29:04,7210,1202,Tribunal de Justiça de SP vai dar prêmio de R$100 mil para desembargadores julgarem mais processos durante pandemia. Eles já ganham R$35 mil. Um gari ganha R$1500 e uma professora R$2500. Adivinha quem vai ser mais afetado com a reforma administrativa de Bolsonaro e Guedes?
1292217607865741312,2020-08-08 21:54:20,405,68,"Seguem os despejos em São Paulo no meio da pandemia. É criminoso e desumano!
https://t.co/WHXIShwwA9"
1292157777041907712,2020-08-08 17:56:35,2420,897,"Sem plano para a crise, sem ministro da saúde, sem se preocupar com o povo. Foi assim que Bolsonaro nos levou ao trágico número de #100milmortos. Toda a nossa solidariedade às famílias que perderam entes queridos na pandemia. #Bolsonaro100Mil 

Créditos: @crisvector,@donrodrigone https://t.co/XvpLLX667h"
1292138920227090433,2020-08-08 16:41:40,479,119,Absurdo! Reintegração de posse na Comunidade Renascer em Piracicaba. O governo Doria segue despejando o povo na pandemia. #despejozero https://t.co/JPNgpgfJYf
1291724003120480258,2020-08-07 13:12:56,5100,835,VERGONHA! O mesmo PSDB que roubou o dinheiro da merenda agora demitiu 4 mil merendeiras da rede municipal e estadual de ensino em São Paulo. Quatro mil mulheres jogadas à própria sorte no meio da pandemia.
1290704393034174468,2020-08-04 17:41:22,8679,1056,"Apagão na Educação! O MEC simplesmente não sabe quantos alunos estão fazendo aulas remotas. Junto com a Saúde, disputa o troféu de pior ministério na gestão da pandemia."
1290683361758007300,2020-08-04 16:17:47,4575,772,"Mortalidade por Covid na UTI do hospital municipal Tide Setúbal, na zona leste de SP, chegou a 90%.

Já o Einstein, no Morumbi, desativou mais da metade dos leitos de covid.

Há duas pandemias, uma de cada lado da ponte."
1290620858130669569,2020-08-04 12:09:25,21729,3814,"Bolsonaro VETOU a lei que previa auxílio financeiro para as famílias de profissionais de saúde que morreram durante a pandemia. Para torturadores e milicianos, homenagem. Para os heróis da linha de frente do combate ao coronavírus, nada."
1290059395275960320,2020-08-02 22:58:22,164,23,NOVO EPISÓDIO #CaféComBoulos - Os heróis e os vilões da pandemia. Assista no Youtube: https://t.co/fAYUkMA2NP https://t.co/sxrtJJ6gSV
1290003250440101889,2020-08-02 19:15:16,10187,967,Dezenas de americanos estão tentando cruzar a fronteira com o Canadá de barco pra fugir da pandemia. Será que os canadenses cogitam construir um muro?
1289947529900183553,2020-08-02 15:33:51,323,69,"Veja como a ocupação Vila Nova Palestina, que reúne 2 mil pessoas na luta por moradia, está enfrentando a pandemia. Vamos vencer a doença com organização e unidade popular. https://t.co/AyQTDTstwh"
1289929421923598336,2020-08-02 14:21:54,4545,557,Líder de seita na Coreia do Sul foi preso depois de organizar reuniões escondidas para esconder casos de Covid. A Coreia tem 50 milhões de habitantes e apenas 300 mortos pela pandemia. No Brasil o líder da seita está na Presidência da República. O resultado: 93 mil mortes.
