id,postado_em:,numero_de_favoritos,numero_de_retweets,texto
1313839575232643073,2020-10-07 13:52:19,9,1,"Comandar dois hospitais de ensino no meio de uma pandemia não foi nada fácil. Mas, mesmo com a covid-19,  deu pra inovar e promover uma maior interação entre unidades de saúde e academia. Muita coisa mudou no Complexo Hospitalar da UFC no último ano. Segue o fio. https://t.co/05EqtHObdy"
1310619905763545089,2020-09-28 16:38:30,11,2,"Com muitas ilustrações e linguagem clara e objetiva, e-book ""Saúde da mulher e covid-19"" oferece desde orientações mais gerais sobre o autocuidado que as mulheres devem ter durante a pandemia a questões bem específicas sobre a saúde feminina https://t.co/qXROCrGnI6 https://t.co/R2954DIEVr"
1309181006033948672,2020-09-24 17:20:49,5,0,"Atenção, estudantes e professores da graduação da UFC: será a oportunidade de opinar formalmente sobre a qualidade de seus cursos e, especialmente neste ano, avaliar o desenvolvimento das disciplinas ofertadas remotamente, devido à pandemia de covid-19 https://t.co/zbY7qoqjWU https://t.co/0kdBApfA5p"
1308122952148418561,2020-09-21 19:16:30,2,1,"As três primeiras lives vão tratar sobre práticas de meditação, perdas na pandemia de covid-19, e aprendizagem e virtualidade. Embora voltados aos estudantes da UFC, os encontros também podem ser apreciados pelo público externo. Saiba mais: https://t.co/k1A5uTPbIw https://t.co/BUR3gDbiGW"
1308080900698189825,2020-09-21 16:29:24,4,1,"Agende-se! Na próxima quinta-feira (24), às 17h, o Colégio de Estudos Avançados da UFC realizará a live 2 da série Grandes Temas Avançados, discutindo os ""Desafios pedagógicos em tempos de pandemia"". Acesse no dia e hora do evento pelo link: https://t.co/DCZemcWDsl. https://t.co/XcLClyqsCw"
1304451070807216129,2020-09-11 16:05:45,0,0,"@davicrisostomos @progradufc Boa tarde, Davi. O edital de transferência de outras instituições de ensino superior para a UFC segue suspenso por tempo indeterminado, em razão da necessidade de redimensionamento e adequação das turmas às novas regras sanitárias decorrentes da pandemia de covid-19."
1303744467757871106,2020-09-09 17:17:58,6,1,"Após a implementação do Plano Pedagógico de Emergência (PPE), em virtude da pandemia de covid-19, o Calendário Universitário 2020 mudou. Acesse o link a seguir e confira as mudanças: https://t.co/4rgmyuw2OB https://t.co/3HXV98cpxU"
1300798156637175808,2020-09-01 14:10:22,45,10,O calendário universitário da UFC foi alterado devido à pandemia de covid-19. A proposta aprovada estabelece a data referencial de 23 de novembro para o início do período letivo 2020.2 e de 10 de abril para a conclusão. Veja detalhes: https://t.co/jaLYMJB3Dq https://t.co/OnbqSmciYu
1300782270664638464,2020-09-01 13:07:15,7,1,"A Biblioteca Universitária da UFC informa que, dando prosseguimento às medidas para combater a disseminação do novo coronavírus, foi prorrogado, por mais 30 dias, o prazo de devolução dos materiais que estavam previstos para serem devolvidos em setembro. https://t.co/AiNvhIr3bV https://t.co/mQ7RfgbTuI"
1300466950242480128,2020-08-31 16:14:17,4,2,"Última semana de inscrições! Por conta da pandemia de covid-19, o processo seletivo será integralmente realizado a distância, em três etapas https://t.co/YahgmpSfrF https://t.co/XVjbqN5n4a"
1298594949987008512,2020-08-26 12:15:37,4,0,"Bom dia com utilidade pública! O projeto de extensão Inspira Ação, do Hospital Universitário, traz vídeos baseados nos manuais do programa de tratamento do tabagismo e na relação entre tabagismo e coronavírus. Conheça: https://t.co/z9BTSeW2E7 https://t.co/VzKbXs4Y1N"
1296477944995614721,2020-08-20 16:03:24,4,0,"Daqui a pouco, às 15h, tem lançamento de um e-book super caprichado com orientações sobre a lida na pandemia. Participem pelo Instagram da Pró-Reitoria de Assuntos Estudantis da UFC: https://t.co/Q42Dbkg5C0 https://t.co/1du6IBwLNx"
1296452248848015366,2020-08-20 14:21:17,6,0,"Compartilhemos =) Em alusão à campanha Agosto Dourado, a Pró-Reitoria de Gestão de Pessoas da UFC lançou uma cartilha sobre aleitamento materno na pandemia, com orientações voltadas à saúde do bebê e da lactante e recomendações para a prevenção de doenças. https://t.co/fBcVc8BKnX https://t.co/N29WAozJf5"
1293239576560009216,2020-08-11 17:35:16,58,7,"É a primeira vez no mundo que uma pesquisa, desenvolvida em parceria com o Departamento de Bioquímica e Biologia Molecular da UFC, utiliza peptídeos sintéticos para tentar bloquear a infecção por coronavírus. Confira detalhes: https://t.co/AudtN6Kws7 https://t.co/Re2A7iPZKf"
1291783870933803008,2020-08-07 17:10:49,7,1,"Saiu a primeira edição de 2020 da ""Revista Aval"", publicação da Pós-Graduação em Avaliação de Políticas Públicas da UFC, com possíveis horizontes para a agenda da avaliação das políticas públicas em saúde no contexto da pandemia da covid-19. Confira: https://t.co/Oi9uslSHEU https://t.co/cF1BnC9c2T"
1290395671388991489,2020-08-03 21:14:37,6,0,"Orientações para uma amamentação adequada, manutenção da amamentação no contexto da pandemia de covid-19 e direitos da mulher que amamenta, entre outros, são assuntos levantados pela Maternidade-Escola na Semana Mundial do Aleitamento Materno. Saiba mais: https://t.co/fzTmNXEKQy https://t.co/kmrZsSD6Yl"
1290348984062619655,2020-08-03 18:09:05,5,1,"Desde o início da pandemia, a Administração Superior da UFC garantiu que criaria todos os mecanismos necessários à inclusão da comunidade estudantil nas atividades de conclusão do semestre 2020.1. Confira a íntegra da nota em nosso portal: https://t.co/iCLJkzo4PO https://t.co/sQchkdGTYB"
1289928824411455490,2020-08-02 14:19:32,130,21,"Cearense de Quixeramobim, ex-aluno de Farmácia da UFC, foi destaque internacional nesta semana com pesquisas sobre o novo coronavírus na Universidade de Oxford. Conversamos com Darlan Cândido e adoramos sua história. Assista! https://t.co/dcj4pyjzUf https://t.co/K2Fyl8K3zI"
1289184689937436675,2020-07-31 13:02:36,10,2,Um estudo mapeou os bairros de Fortaleza com maiores taxas de casos suspeitos ou confirmados da doença e ouviu a opinião das pessoas sobre isolamento social; o outro verificou as principais medidas adotadas pelas instituições religiosas em meio à pandemia https://t.co/mfUGz7GeRp https://t.co/qXgi32Yl5F
1287849676784492545,2020-07-27 20:37:44,10,0,"Utilizada a partir da segunda quinzena de março para receber apenas estudantes que porventura adoecessem por contaminação pelo novo coronavírus, a residência universitária 140, no Campus do Benfica, voltou ao seu funcionamento regular https://t.co/Xk1uPPhVo0 https://t.co/R2JaLmVy4c"
1285277228662759424,2020-07-20 18:15:45,5,0,"Liga Acadêmica em Doenças Estigmatizantes da UFC produz vídeos sobre medidas de autocuidado em hanseníase, para auxiliar pessoas acometidas pela doença a ter uma melhor qualidade de vida durante a pandemia de covid-19. Vale a pena assistir! Confira: https://t.co/V4XbLAbb8h https://t.co/n4Fdb4PNq9"
1285210158352805894,2020-07-20 13:49:14,15,2,"Nesta segunda-feira, começou a entrega dos chips de Internet para estudantes dos campi de Fortaleza, na Reitoria. A ação é parte do Plano de Inclusão Digital da UFC no contexto da pandemia. Veja como está sendo o procedimento: https://t.co/VHlQLiNcVB https://t.co/vWhHUA6Myd"
1284200979878105088,2020-07-17 18:59:07,0,0,"@enoughabastard Oie! É o de graduação? Devido à pandemia, o diploma físico só vai estar disponível para entrega após o retorno presencial das atividades administrativas. Enquanto isso, você pode solicitar a certidão de colação de grau, via SIGAA."
1281571601302028288,2020-07-10 12:50:54,22,1,"Atenção, usuários da Biblioteca Universitária: como mais uma medida para auxiliá-los em face à pandemia, não haverá cobrança de multas na devolução das obras atrasadas, considerando o período de janeiro de 2020 até o retorno das atividades presenciais. https://t.co/y8ehFn9vFy https://t.co/j1njv3mwzP"
1281239520495763459,2020-07-09 14:51:20,23,1,"Pesquisa fresquinha na área de comunicação. Em parceria com a USP, o grupo de pesquisa PraxisJor, da UFC, apresentará no dia 14 os resultados de estudo sobre as condições de trabalho entre profissionais de comunicação durante a pandemia. https://t.co/1NCOUMvA1Q https://t.co/1Rxsv2GhAy"
1280479241235304449,2020-07-07 12:30:15,5,1,"Começa nesta terça-feira (7) mais um ciclo de formações on-line com foco nos servidores docentes da UFC. As atividades fazem parte do Plano de Formação Emergencial, elaborado em resposta à pandemia de covid-19. https://t.co/0oTUyAU1AR https://t.co/qMgOH852ER"
1280473836513890306,2020-07-07 12:08:47,14,1,"Projeto de extensão Rede Surdos – CE, da UFC, produz material informativo sobre a pandemia em libras. A ideia é tornar informações de prevenção e cuidados acessíveis ao público surdo. https://t.co/M2GJsDIFiF https://t.co/mFwrvMdi5C"
1280230385696362503,2020-07-06 20:01:24,4,1,"A UFC promove, durante o mês de julho, atividades de formação on-line, no âmbito do Plano de Formação Emergencial do Programa de Apoio e Acompanhamento Pedagógico (PAAP), elaborado em resposta à pandemia de covid-19. https://t.co/0oTUyAU1AR https://t.co/qwJ44bPSMr"
1279122418280337411,2020-07-03 18:38:44,18,2,"Fisioterapeuta registra em fotos as emoções diárias de quem combate o coronavírus no Hospital Universitário Walter Cantídio. Veja as histórias retratadas pelas lentes de Marília Quinderé, que atua há 4 anos no HU. https://t.co/1ctTF7AtWX https://t.co/8dUdOZlKjU"
1278330118251954176,2020-07-01 14:10:25,9,0,"Hoje tem mais um encontro do LivesJor, iniciativa do Curso de Jornalismo da UFC que tem discutido questões da comunicação em meio à pandemia. A transmissão será pelo Youtube. https://t.co/AcIULFvoKU https://t.co/83nt3hBNVk"
1277779397488058373,2020-06-30 01:42:03,54,2,"NOVA PORTARIA: A Pró-Reitoria de Gestão de Pessoas (PROGEP) da UFC informa que apresentará nova proposta de retorno às atividades administrativas presenciais da Instituição, no contexto da pandemia de covid-19. (+)"
1275159353415393282,2020-06-22 20:10:55,9,4,"O Projeto de extensão Movimento, do Departamento de Fisioterapia da UFC, está atendendo, via telefone, pacientes com dores musculoesqueléticas crônicas durante a pandemia de covid-19. O atendimento é aberto ao público. Saiba mais em https://t.co/yKRrOUdpoh https://t.co/YBRgbcVDzr"
1275146964758380544,2020-06-22 19:21:42,1,0,"@giubatista_ Por enquanto não há previsão, diante do cenário da pandemia de covid-19. Quando os programas lançarem os editais, faremos ampla divulgação."
1272664880148107269,2020-06-15 22:58:47,29,4,"Processo seletivo de inclusão digital inscreve até 21 de junho; 6 mil chips de internet móvel serão distribuídos nos campi da UFC na Capital e no Interior
https://t.co/ujITg19DWg
#ufcevocêcontraocoronavírus https://t.co/b5oKurJoeZ"
1272611683119304705,2020-06-15 19:27:23,22,3,"O novo tipo de exame para covid-19 está em andamento e obteve bons resultados em testes-piloto. Os pesquisadores analisaram a nova metodologia em amostras contendo fragmentos de RNA do novo coronavírus, e os resultados foram os mesmos do RT-qPCRA. https://t.co/4muu6tsalg https://t.co/kDePulwmgX"
1271101172078850048,2020-06-11 15:25:09,46,7,É do Ceará pro mundo! Artigo de professora da Biblioteconomia da UFC integra edição especial de periódico canadense sobre coronavírus. https://t.co/j3cnRjiMd1 https://t.co/x4GvfXelq6
1270775063575433219,2020-06-10 17:49:19,7,1,"""Planos de retorno na pandemia: informações, decisões e efeitos"" é o tema da semana de mais uma conferência on-line do projeto Encontros OPP Saúde. Será nesta quinta-feira (11), às 18h30min. Participe! https://t.co/bbO0TMYSfR https://t.co/9erE2B8xHq"
1270446773983641603,2020-06-09 20:04:49,12,0,"UFC no combate ao coronavírus: pesquisadores da Faculdade de Medicina da UFC integrarão uma rede de cientistas brasileiros que avalia a eficácia do fumarato de tenofovir desoproxila no combate à covid-19.
Saiba mais sobre a pesquisa em:https://t.co/LwWe1aFVpE https://t.co/FzqPDQVg1c"
1270364934363394049,2020-06-09 14:39:37,3,1,"Das 12h às 13h desta terça-feira, a Sociedade Brasileira para o Progresso da Ciência (SBPC) realiza a Marcha Virtual pela Vida, em alusão à pandemia da COVID-19 no Brasil. Saiba como participar: https://t.co/wlJNZ4v3QK https://t.co/bCVHj6Y9o2"
1270350057628413952,2020-06-09 13:40:30,4,1,Começa hoje (9) a Jornada Odontológica Integrada dos Acadêmicos (JOIA) da UFC! Serão 4 palestras: marketing digital na odonto; riscos da automedicação; como receber pacientes em clínicas; e pandemia e dores musculoesqueléticas.  O grupo incentiva doações. https://t.co/F46lUX6spM https://t.co/CVU0SjxkQL
1270082929042034688,2020-06-08 19:59:01,34,8,"Sistema de previsão da COVID-19 criado na UFC indica estabilização da curva de óbitos em julho; pressão sobre hospitais poderá diminuir na Capital cearense https://t.co/0X11QuPeSH
#ufcevocêcontraocoronavírus https://t.co/Uq9YlUREUI"
1270048875726999552,2020-06-08 17:43:42,15,4,"Informe importante, pessoal. Diante do contexto de pandemia de COVID-19, foi adiado o cronograma do SISU 2020 na UFC. Saiba mais: https://t.co/0Pf02LwYae https://t.co/3DbRlZoKPI"
1268188761814454273,2020-06-03 14:32:17,5,0,"O câncer é a terceira principal causa de afastamento de servidores na UFC. Por conta disso, nesses tempos de pandemia, a Universidade abriu um canal de comunicação com quem enfrenta dois momentos difíceis ao mesmo tempo. Confira em reportagem da UFCTV: https://t.co/8IOFwrVXf7 https://t.co/rVXdoZDTob"
1268160500522790912,2020-06-03 12:39:59,11,1,UFC divulga resultados das pesquisas sobre a situação da comunidade universitária na pandemia. https://t.co/m2ga3KIfbY https://t.co/LWfTimGh3t
1267571854870482945,2020-06-01 21:40:55,9,1,O desafio imposto pelo novo coronavírus colocou pesquisadores de várias áreas diferentes no centro do debate público. No #UFCTalks desta semana discute qual o papel da ciência num cenário pós-Covid19. Para ler a entrevista completa acesse: https://t.co/uZp3nrtdbe https://t.co/kzPZsaJCro
1267548551669780481,2020-06-01 20:08:19,5,0,"Uma medida que várias cidades do Brasil têm adotado no combate à disseminação do novo coronavírus é a instalação de ""túneis higienizadores"". Mas é seguro? Que tal entender mais sobre os cuidados que devemos ter ao usar produtos desinfetantes? https://t.co/D13zuLutrJ"
1267540181252481024,2020-06-01 19:35:03,7,1,"Com apoio da UFC, live nesta quarta-feira (3) discutirá sobre meio ambiente e a pandemia de COVID-19 https://t.co/ucA2JhT698"
1267470408518979584,2020-06-01 14:57:48,8,1,"Alô, galera da Comunicação! Projeto LivesJor, do Curso de Jornalismo, promove discussões sobre comunicação em tempos de pandemia. Hoje já tem atividade. Confira a programação completa: https://t.co/UsFeKr665l https://t.co/4hK2BRbWDb"
1266447820892102657,2020-05-29 19:14:24,9,0,"Seguem discussões coletivas rumo à Proposta Pedagógica de Emergência, documento que trará mecanismos para a reposição de aulas e para a conclusão do semestre letivo 2020.1 na UFC, no contexto da pandemia de COVID-19. https://t.co/vCeIZBVvBU https://t.co/5VCyyaBY5l"
1266426789091594247,2020-05-29 17:50:50,8,0,Monitoramento da qualidade do ar de Fortaleza feito por UFC e SEUMA revela redução de poluentes durante pandemia. Confira em mais um vídeo da UFCTV: https://t.co/0F2zpxMyNn
1265708037509132289,2020-05-27 18:14:46,8,2,"Algumas pesquisas da UFC foram iniciadas em plena pandemia do novo coronavírus. Mas muitos estudos, já em andamento, precisaram ser tocados da casa dos pesquisadores. A UFCTV reuniu alguns desses casos e você confere no vídeo: https://t.co/hrhuvcFjti"
1265399918077845506,2020-05-26 21:50:25,6,1,Agendem aí: GTEL celebra 20 anos com videoconferências sobre telecomunicações em tempos de pandemia. Evento ocorre na próxima semana: https://t.co/gHKvZP5UiH https://t.co/5ul0uQIZZ8
1265276263498825731,2020-05-26 13:39:03,10,1,Pesquisa institucional mapeia situação de estudantes e servidores da UFC durante a pandemia de COVID-19; prazo para responder segue até 31/05. https://t.co/srParlaCFq https://t.co/qk8dET2P0K
1265256941477036034,2020-05-26 12:22:16,8,2,"Novo episódio do programa ""Papo de Quarentena"", do Curso de Jornalismo da UFC, aborda a situação de pessoas que estão fora de seus países de origem durante a pandemia de COVID-19. O programa está disponível no Spotify, Deezer, Youtube e no link: https://t.co/f8zvyzhamD. https://t.co/Tv7igKYg8z"
1265017203843379200,2020-05-25 20:29:38,7,3,"Qual o impacto do novo #coronavírus para o Meio Ambiente? O professor Marcelo Soares, um dos maiores especialistas em Geociências no Estado, analisa a questão no #ufctalks e traça cenários para o pós-epidemia. Acompanhe em https://t.co/r0yi8SPeLQ  

#ufcevocêcontraocoronavírus https://t.co/usj5jzmOM9"
1263940515877322752,2020-05-22 21:11:16,10,0,"Pandemia do novo coronavírus revelou que o Brasil não avançou como deveria na infraestrutura de Internet e na formação das pessoas para a utilização dessas ferramentas, destaca André Lemos no encerramento dos EU 2019. Veja detalhes da palestra em https://t.co/hGinvMD4Po https://t.co/8nGFEmdi1g"
1263617697046245376,2020-05-21 23:48:30,15,0,"País está ficando mais pobre, e pandemia revela ineficiência do Estado, afirma Marcos Lisboa no 2º dia dos Encontros Universitários 2019. Veja esse e outros pontos abordados pelo economista. https://t.co/z7qTZ0iAN4 https://t.co/tffb4mr7MF"
1263568314141417473,2020-05-21 20:32:16,4,0,"Programas de pós-graduação do Centro de Ciências Agrárias da UFC promovem, na segunda-feira (25), às 18h, a palestra virtual ""Saúde mental em tempos de pandemia"", no perfil @ppgeaufc no Instagram. O convidado é o Prof. Érico Vieira, da UFJ https://t.co/BMxlzuRl8q https://t.co/l5r0zW8Q7r"
1263196929858641920,2020-05-20 19:56:31,11,1,"Encontros Universitários 2019 em Fortaleza tem início com palestra sobre pandemia e saúde coletiva, com a Profª Marcia Castro, da Universidade de Harvard (EUA); confira a íntegra da videoconferência https://t.co/LizCd1aXHf https://t.co/IMRuR7seWh"
1262750229364830211,2020-05-19 14:21:30,10,6,Curso de extensão da UFC abordará múltiplos contextos de vulnerabilidade social em tempos de pandemia de Covid-19. São ofertadas 150 vagas e as inscrições estão abertas até dia 21 de maio. https://t.co/9I0qGkPTnz
1262562879313715204,2020-05-19 01:57:02,12,3,"O novo coronavírus mexe com a saúde física e mental, mas também com a saúde financeira das famílias. Escute as dicas do Prof. Érico Veras Marques, especialista em finanças pessoais, na terceira entrevista da série UFC Talks e veja a íntegra em https://t.co/J4BOpTJVxT #ufctalks https://t.co/eUSIe6Q9Ay"
1262444171488624644,2020-05-18 18:05:20,11,1,"Pesquisa vai mapear situação de estudantes e servidores da UFC durante a pandemia; comunidade universitária pode participar até 25 de maio, pelo SIGAA e SIGPRH. https://t.co/B1dm2VPssg https://t.co/B6whiTmina"
1261370653002719232,2020-05-15 18:59:33,9,0,"Webconferência discute logo mais, às 18h30min, saúde do povo quilombola na atual pandemia; iniciativa é promovida por comitê da Faculdade de Medicina da UFC. Saiba como participar: https://t.co/NQtGt7eXTZ https://t.co/fHsuMTTcW6"
1261330471763488768,2020-05-15 16:19:53,8,2,"Vamos conversar sobre segurança alimentar e educação nutricional em tempos de pandemia? Esse é o tema da live que o Laboratório de Produção Cultural do Instituto de Cultura e Arte (ICA) da UFC promoverá na segunda-feira (18), às 15h. Saiba mais: https://t.co/Dm00W3x42X https://t.co/sCQ0bvqGAc"
1260677561123852290,2020-05-13 21:05:27,55,16,"Pesquisadores do Centro de Tecnologia da UFC investigam dinâmicas de contágio da COVID-19 em Fortaleza; modelo prevê que pico da pandemia ocorrerá ainda em maio 
https://t.co/aagC2zzk2V
#ufcevocêcontraocoronavírus #COVID19 https://t.co/PGry4Ozpph"
1260616113853005827,2020-05-13 17:01:17,46,15,"A UFC está ofertando plantão psicológico on-line e gratuito a toda a comunidade para tratar de problemas relacionados ao contexto da pandemia. A iniciativa é do Laboratório de Estudos em Psicoterapia, Fenomenologia e Sociedade (LAPFES). Saiba mais em: https://t.co/mWwSXwQv8j https://t.co/AdBYr4ER6e"
1259965045422919685,2020-05-11 21:54:10,23,1,"Em mais uma ação dentro do compromisso de atuar no enfrentamento da pandemia, a UFC iniciou hoje a aplicação de testes rápidos para a COVID-19 em policiais rodoviários federais em atividade no Ceará. Saiba mais em: https://t.co/sQKPgt54Gj https://t.co/xpYx8VOC88"
1258870308855074816,2020-05-08 21:24:04,11,2,O #BuzzUFC de hoje traz dicas de ouro que valem mais que dinheiro e podem ajudar a atravessar este período de pandemia com os boletos em dia. Veja a lista completa em https://t.co/0aJe9Qh13G e marque aquele(a) amigo(a) que está comprando online como se não houvesse amanhã! 💸🙌🏽 https://t.co/zHc5NBw4Lm
1258851282053406720,2020-05-08 20:08:28,3,0,Grupo de trabalho (GT) com representação estudantil e docente discute medidas de reposição de aulas e atividades para o período pós-pandemia. Leia a notícia completa em nosso portal: https://t.co/knNZAhZqZE https://t.co/0KIUumG0OB
1258776348916621312,2020-05-08 15:10:43,8,2,Uma conversão tão difícil quanto necessária. PET Psicologia discutirá as mudanças nos ritos fúnebres durante a pandemia. https://t.co/hsPN0oKp7g https://t.co/4yxegHrX3B
1258125923389505536,2020-05-06 20:06:09,34,6,Força-tarefa cearense finaliza testes com protótipo do capacete de respiração assistida. O equipamento é uma promessa para desafogar as UTIs saturadas com pacientes diagnosticados com a COVID-19. https://t.co/bthU5OYLmP #ufcevocêcontraocoronavírus https://t.co/lqQKW5Q3os
1258064182232088581,2020-05-06 16:00:49,15,6,"Projeto de extensão da UFC lança o boletim sonoro Minuto CACCO, com informações sobre a pandemia para rádios comunitárias; iniciativa tem o objetivo de colaborar com a cobertura jornalística de rádios comunitárias do Ceará https://t.co/O5pcpXf6CR https://t.co/CklTKgb2al"
1257772379545178116,2020-05-05 20:41:18,10,0,Motivo de #orgulho sim! A Plataforma Colaborativa #ufcevocecontraocoronavirus e o capacete de respiração assistida foram incluídos em observatório nacional de ações de enfrentamento à COVID-19. Saiba mais em: https://t.co/ItJ9cpZbGd https://t.co/yDkbpG2tlm
1257765343646420993,2020-05-05 20:13:20,12,1,"Avanços nas pesquisas de #COVID19  na UFC! Um estudo desenvolvido do Campus de Sobral investiga uma alternativa para o diagnóstico de coronavírus a partir da análise de tomografias de pulmão feitas em pacientes com suspeita da doença. 
Saiba mais em https://t.co/NMjuKwlTM8 https://t.co/s01d5Cp2Q6"
1257676801058447363,2020-05-05 14:21:30,11,2,"Programe-se: nesta quarta-feira (6), o LABOMAR da UFC vai discutir como anda a qualidade do ar na Capital em tempos de pandemia. Será que melhorou? A transmissão ao vivo será no Youtube: https://t.co/zrl9hEYYqe https://t.co/ZSFYYEUx26"
1257436837330771971,2020-05-04 22:27:58,5,0,Divulgadas orientações para formandos de Medicina e Fisioterapia que colam grau antecipadamente na próxima quinta-feira (7). https://t.co/JDh7yqq3Xw #ufcevocecontraocoronavirus https://t.co/SUySoop3rU
1257369290241703947,2020-05-04 17:59:34,4,0,"Pesquisadores da UFC, acompanhando a tendência mundial, montam estratégias para monitorar o avanço da COVID-19 no Ceará. São iniciativas de laboratórios, pesquisadores e até mesmo de estudantes. Confira na reportagem: https://t.co/gz6JxT4gl4 #coronavirus #COVIDー19"
1255903570223923203,2020-04-30 16:55:19,8,0,Webconferência discute saúde da população em situação de rua durante a pandemia. Saiba mais em: https://t.co/3g4G7nEi4T https://t.co/TTDNKMbPts
1255511064378302469,2020-04-29 14:55:38,27,12,"Quer ajudar, mas não sabe como? Conheça o Mapa Solidário, plataforma de divulgação das campanhas de solidariedade que ocorrem neste período de pandemia de COVID-19. A linda iniciativa é de alunos de Arquitetura e Urbanismo da UFC: https://t.co/VtdrtWOzQ7 https://t.co/diGPPxIAZ6"
1254869519044149256,2020-04-27 20:26:22,17,0,Um novo lote de 130 máscaras de proteção facial produzidas pela UFC começou a ser distribuído para unidades de saúde do Ceará. Já são 1.230 máscaras entregues no enfrentamento à pandemia de #COVID19. Confira a matéria completa. https://t.co/ceTmnamutX #ufcevocecontraocoronavirus https://t.co/kV06rYn5o3
1254860377449357312,2020-04-27 19:50:02,8,5,A UFC criou uma plataforma colaborativa para reunir as ações de enfrentamento ao coronavírus que estão sendo realizadas por membros da Instituição. Lá é possível cadastrar uma atividade ou ajudar uma iniciativa já existente. Acesse https://t.co/GV0MUMJqwC. #coronavirus #COVID19 https://t.co/f2LFl6Sobb
1254841694106931207,2020-04-27 18:35:48,16,2,"A Pró-Reitoria de Extensão (PREX) realiza, de 27 a 30 de abril e de 4 a 7 de maio, uma campanha vacinal para servidores e funcionários terceirizados da UFC com idade a partir de 56 anos ou que estejam no grupo de risco de infecção por coronavírus. https://t.co/aUIwijP3ns https://t.co/wMlbehhc6E"
1254772577764925440,2020-04-27 14:01:09,13,4,"Em tempos de pandemia e de disseminação de fake news, o Jornalismo de qualidade ganha importância extra. Grupo de pesquisa PraxisJor, da UFC, lança podcast que debate pesquisas em Comunicação e seus impactos sociais. Confira! https://t.co/AZ6mEi2QQZ"
