id,postado_em:,numero_de_favoritos,numero_de_retweets,texto
1306231882871431171,2020-09-16 14:02:04,8,3,Quarta fase do EPICOVID19-BR mostra desaceleração do coronavírus no Brasil https://t.co/dMjnZUHB9p
1306224940706861056,2020-09-16 13:34:29,2,0,UFPel Talks aborda a cultura em tempos de pandemia https://t.co/XDa54vEp78
1304116517441810435,2020-09-10 17:56:21,4,1,Pesquisa da UFPel sugere desaceleração da pandemia no RS https://t.co/jmSYf4kHZA
1303363293260677120,2020-09-08 16:03:19,3,0,Setembro Amarelo em meio à pandemia da COVID-19 https://t.co/b9m2Uj3N5V
1301983775711207427,2020-09-04 20:41:36,0,0,Colóquio do CLC discute práticas pedagógicas e administrativas na pandemia https://t.co/V2BiCAMiLA
1301540600790085632,2020-09-03 15:20:35,1,0,Pesquisa sobre coronavírus no RS inicia oitava etapa nesta sexta (4) https://t.co/MeCE56Rkd2
1299001922595287046,2020-08-27 15:12:47,3,0,"Justiça Curricular em tempos de pandemia será tema de conferência, no dia 2 https://t.co/ALaKhjtR8b"
1298677996535123979,2020-08-26 17:45:37,4,1,UFPel pesquisa impactos da mudança de hábito em relação ao consumo de energia elétrica residencial durante a pandemia https://t.co/XaFe6gfG56
1298644333948739585,2020-08-26 15:31:51,1,0,UFPel Talks discute os desafios do ensino universitário em tempos de pandemia https://t.co/HVmrIH1fti
1297925927578599425,2020-08-24 15:57:10,10,3,Pesquisa avalia alimentação e exercícios físicos na pandemia https://t.co/kwMj1BOxZH
1296423123357782018,2020-08-20 12:25:33,1,0,FaE integra pesquisa nacional sobre ensino remoto e a Política Nacional de Alfabetização (PNA) durante a pandemia https://t.co/ddCHU6G7Ih
1296418391457234944,2020-08-20 12:06:45,0,0,FaE integra organização do Seminário Virtual de Filosofia &amp; Educação: Tempos de pandemia e seus impactos https://t.co/b2FR6AZ0aH
1295729508423798784,2020-08-18 14:29:22,15,2,Estudo da UFPel avaliou os efeitos da pandemia na saúde física e mental dos gaúchos https://t.co/vrc1tW1XDM
1295699289373650944,2020-08-18 12:29:18,0,0,Transformações na comercialização e consumo de alimentos na pandemia é tema de debate https://t.co/PmWfJ6Ky62
1295381442407604226,2020-08-17 15:26:17,5,2,O Físico quer saber discute como os físicos têm atuado na pandemia https://t.co/Y9UYmr1Ckd
1292850821303083011,2020-08-10 15:50:30,0,0,Docentes da Psicologia falam sobre relação de pais e filhos na pandemia https://t.co/2BXi1H5Fbb
1292848012570525696,2020-08-10 15:39:20,7,0,Pesquisa sobre coronavírus entra na sétima etapa de testes em nove cidades do RS https://t.co/avKn3vUpaK
1291075421895786498,2020-08-05 18:15:42,1,0,Estudo investiga impactos da pandemia nas empresas de esporte e atividade física https://t.co/47SIPdV1Cv
1291039480162508801,2020-08-05 15:52:53,12,4,Epicovid19 anuncia próxima etapa da pesquisa nacional sobre coronavírus https://t.co/9odI0hTW4t
1288536006694666245,2020-07-29 18:04:58,14,1,Epicovid – RS tem um infectado por coronavírus a cada 104 habitantes https://t.co/fQqPyUUkRd
1288116944600588296,2020-07-28 14:19:46,9,1,"Semana de frio e pouca chuva. Veranico volta em agosto A previsão está no boletim especial, feito em função da pandemia de Covid-19, elaborado pelo CPMET (Centro de Pesquisas e Previsões Meteorológicas) e alunos e professores de graduação e pós-graduação… https://t.co/Vj86pqQKJs"
1286301639326998528,2020-07-23 14:06:23,2,0,RS tem sexta rodada de testes rápidos da pesquisa sobre coronavírus a partir de sábado https://t.co/NY5uhsgux1
1285589038884413440,2020-07-21 14:54:46,2,1,Janelas do Feminino compartilha produção teatral de estudantes durante a pandemia https://t.co/GaLYKR757s
1284127850845675520,2020-07-17 14:08:32,1,0,Núcleo de Ações Afirmativas e Diversidade informa sobre matrícula por cota étnico-racial durante a pandemia https://t.co/tlc68KIzr0
1283108251505229826,2020-07-14 18:37:00,38,9,"Terapia Ocupacional atende, durante a pandemia, populações em vulnerabilidade https://t.co/1hKPij1bEh"
1281197535479111680,2020-07-09 12:04:30,4,0,UFPel vai avaliar o impacto da pandemia no ensino odontológico brasileiro https://t.co/3njHewIXja
1280137164735553537,2020-07-06 13:50:58,4,1,Projeto Elas por elas: as mulheres e a pandemia lança página no Facebook https://t.co/ZTLPtoLbHr
1278809873480851458,2020-07-02 21:56:47,1,0,Epicovid19-BR divulga novos resultados sobre o coronavírus no Brasil https://t.co/B5XgY48FoH
1278398559365332993,2020-07-01 18:42:22,14,3,Pesquisa estima que um em cada 214 habitantes do RS já tenha contraído coronavírus https://t.co/sJgiKvvj3m
1277948299975241732,2020-06-30 12:53:12,2,0,Projeto busca preservar memórias da alfabetização em tempos de pandemia https://t.co/9DoF2AIEVj
1275845889358270465,2020-06-24 17:38:58,7,0,Começa o Curso de Saúde Mental em Emergências Humanitárias como a pandemia de COVID-19 https://t.co/cENjNwheM4
1275502848713863168,2020-06-23 18:55:51,2,1,"Em meio à pandemia, doação de sangue não pode parar https://t.co/kiSF83MQG0"
1275491450785009666,2020-06-23 18:10:34,0,0,Expressa Extensão submete artigos sobre extensão na pandemia https://t.co/pCc6A1FT0p
1272978670190301185,2020-06-16 19:45:40,39,11,UFPel e UFSM pesquisam impacto da pandemia na saúde mental da população https://t.co/WYKgkVAm2Y
1272547497760772097,2020-06-15 15:12:20,4,0,UFPel participa de projeto de educação popular sobre o coronavírus https://t.co/Ok5Mh7kvpI
1271237338191089664,2020-06-12 00:26:14,44,11,"Em 15 dias, aumenta em 50% a proporção da população com anticorpos para coronavírus no país https://t.co/YJwCk7zIct"
1270780691979087873,2020-06-10 18:11:41,13,1,Psicologia faz podcast sobre Produtividade na pandemia https://t.co/WscSLzakJf
1270097853550125057,2020-06-08 20:58:20,2,0,Live aborda situação da pandemia no Norte do país https://t.co/UAqfD6GU08
1269977356619448322,2020-06-08 12:59:31,3,0,Psicologia pesquisa sobre relações entre pais e filhos em tempos de pandemia https://t.co/7rXLjCzxtJ
1268206834135044096,2020-06-03 15:44:06,7,2,Mulheres na ciência e a pandemia https://t.co/dEhhNik2Py
1267440671637614592,2020-06-01 12:59:38,8,2,Pesquisa nacional sobre infecção por coronavírus tem nova etapa de testes rápidos a partir de quinta-feira (4) https://t.co/58VONNnSEs
1265752193690480640,2020-05-27 21:10:14,11,2,Estudo aponta estabilidade da proporção de casos de coronavírus no RS https://t.co/7hig4SeEDN
1265318541131120641,2020-05-26 16:27:03,5,1,Projeto levanta realidade das mulheres nas pesquisas e ações contra a pandemia https://t.co/mFw8EfeYpt
1263156942966599680,2020-05-20 17:17:38,2,0,PET Educação pesquisa atuação de profissionais da área na pandemia. Veja respostas https://t.co/KIrl0yVKAm
1262776840760053761,2020-05-19 16:07:14,1,1,Pesquisa analisa a aprendizagem na pandemia. Estudantes podem responder https://t.co/khANvhPigR
1262363839628292102,2020-05-18 12:46:07,15,5,Manaus é a primeira cidade a concluir testes de pesquisa nacional sobre coronavírus https://t.co/Yq5JdX61Lg
1261269943619854339,2020-05-15 12:19:22,3,2,Comunidade pode contribuir com a Memória Visual da UFPel durante a pandemia https://t.co/eUib308XlJ
1261033608732651528,2020-05-14 20:40:15,7,1,UFPel conta com mais de 30 projetos sobre o novo coronavírus https://t.co/yHS61JpPzQ
1260674259422248966,2020-05-13 20:52:20,3,1,PRPPGI publica orientações para utilização de laboratórios e atividades de pesquisa durante a pandemia https://t.co/XMBQfYMLec
1260569149077630977,2020-05-13 13:54:40,1,0,“A força da empatia em um mundo transformado por uma pandemia” é tema de roda de conversa https://t.co/gKwP9Xrfg3
1258787722589802498,2020-05-08 15:55:54,19,2,Estudo sobre coronavírus no RS chega à 3ª fase neste fim de semana https://t.co/ZL05XIyL1H
1255520880039469056,2020-04-29 15:34:38,1,2,Museu busca objetos que lembrem entes queridos durante pandemia https://t.co/DlxaRM5zFb
1253682018615021569,2020-04-24 13:47:40,18,4,Estudo sobre coronavírus no RS inicia 2ª fase de testes rápidos neste sábado (25) https://t.co/7lpgQpIM2d https://t.co/Xo7DbcPes5
1253342323481722881,2020-04-23 15:17:50,11,3,UFPel desenvolve plataforma para projeção de necessidade de leitos durante a pandemia https://t.co/8kHLialNZ2
1253313248251740160,2020-04-23 13:22:18,6,0,Direito informa sobre relações de trabalho em meio à pandemia https://t.co/fuCsTvHEgj https://t.co/S5V49iApGR
1247928214133133325,2020-04-08 16:44:06,2,0,Ibict lança diretório sobre coronavirus e Covid-19 https://t.co/HlGKTlVBr3
1247210044321644553,2020-04-06 17:10:21,3,1,Projeto Assistência de Enfermagem ao Idoso da Vila Municipal faz infográficos sobre o coronavirus https://t.co/5Ripoy2jMG
1245448604925526017,2020-04-01 20:31:01,12,1,Instituto Serrapilheira financiará pesquisa sobre coronavirus coordenada pela UFPel https://t.co/S4mw0MLFFH
1245312748302544896,2020-04-01 11:31:10,11,5,Gráfico da evolução temporal do coronavírus – Atualização de 31.03.2020 https://t.co/vHScPPPXjf https://t.co/D5ox6fnQ2g
1245100460756865032,2020-03-31 21:27:37,17,3,Gráfico da evolução temporal do coronavírus – Atualização de 30.03.2020 https://t.co/VmyZB6NSXd https://t.co/DnEWyZzplt
1243387698393403392,2020-03-27 04:01:42,29,13,Gráfico da evolução temporal do coronavírus – Atualização de 26.03.2020 https://t.co/OMNZBECKIl https://t.co/BEELpW5Vxm
1243159951054381056,2020-03-26 12:56:43,15,4,Gráfico da evolução temporal do coronavírus – Atualização de 25.03.2020 https://t.co/t1OrNieEs6 https://t.co/qgOziukwY2
1243152290179055617,2020-03-26 12:26:17,15,0,Covid-19: UFPel coordena estudo populacional sobre a pandemia no RS https://t.co/60WtrFbnaM
1242917448728395778,2020-03-25 20:53:06,27,8,HE cria 23 leitos exclusivos para tratar pacientes com coronavírus https://t.co/4ME2rfGFNv
1242914842434056193,2020-03-25 20:42:45,13,6,Enfermagem lança videos como ação de enfrentamento ao coronavirus https://t.co/n6Y8O580rP
1242862477769138182,2020-03-25 17:14:40,12,3,"UFPel disponibiliza site com gráficos sobre o avanço, no país, do coronavirus https://t.co/ewSvJpX1rG"
1242821364362498053,2020-03-25 14:31:18,32,4,Gráfico da evolução temporal do coronavírus – Atualização de 24.03.2020 https://t.co/Bf1cdTEyGU https://t.co/MAlp8SOnkx
1242264606187425792,2020-03-24 01:38:56,13,0,Gráfico da evolução temporal do coronavírus – Atualização de 23.03.2020 https://t.co/a8ACLyduxM https://t.co/RAPqWDUj94
1242189577789546504,2020-03-23 20:40:48,3,3,Saiu o segundo boletim meteorológico da pandemia do coronavírus https://t.co/tdnyiEyWbn
1242113297803087872,2020-03-23 15:37:42,11,2,Gráfico da evolução temporal do coronavírus – Atualização de 22.03.2020 https://t.co/0nF7tpStmW https://t.co/cmLNvEolgP
1241400324914642945,2020-03-21 16:24:36,54,15,Gráfico da evolução temporal do coronavírus – Atualização de 20.03.2020 https://t.co/aew3GLX5FG https://t.co/uvIGgtAYXE
1241103480967835649,2020-03-20 20:45:03,17,6,"Em meio à pandemia, CAPES amplia o corte de bolsas de pesquisa https://t.co/9bdVsRrmOu"
1240793490889596928,2020-03-20 00:13:15,21,4,Gráfico da evolução temporal do coronavírus – Atualização de 19.03.2020 https://t.co/kdFhoHT0qE https://t.co/b21fg5yihx
1240420886324432897,2020-03-18 23:32:39,17,2,Alunos da UFPel preparam vídeos educativos para prevenção do coronavírus https://t.co/uUD5ayNf1i
1240405020786528256,2020-03-18 22:29:37,22,4,Gráfico da evolução temporal do coronavírus – Atualização de 18.03.2020 https://t.co/02A9KlG2Pu https://t.co/wTPoC7At73
1240294202216513537,2020-03-18 15:09:16,38,10,Pesquisadores da UFPel desenvolvem modelagem da evolução temporal do coronavírus https://t.co/vWVU1GmRVs https://t.co/U4W7BXyyXT
1240047571130822657,2020-03-17 22:49:14,8,0,Museus da UFPel fecham para prevenir coronavirus https://t.co/SOT3Wkg4Pl
1239640344075087877,2020-03-16 19:51:04,5,0,HE inserido na estratégia municipal para receber casos de coronavirus https://t.co/vzOT94sz0j
1239630169113014275,2020-03-16 19:10:38,5,0,Reitoria reúne supervisores de terceirizados para falar sobre o coronavirus https://t.co/Hjar1QL2x3
1237875358537400320,2020-03-11 22:57:38,18,5,Nota da Gestão sobre o novo coronavírus https://t.co/FHZgXMO2yb
1230139334231306247,2020-02-19 14:37:26,4,1,A Epidemiologia e o surto de coronavírus https://t.co/ziyrGZpOom
